Sheet: Bewertungen
B1: Batteriemasse (indirekt)
B2: 204 Opportunity | F2: 204 Overnight | G2: 192 Opportunity | K2: 192 Overnight
B3: 40kW | C3: 375kW | D3: 200kW | E3: Swap | F3: 40kW | G3: 40kW | H3: 375kW | I3: 200kW | J3: Swap | K3: 40kW
A4: Blei | B4: 2125 | C4: 2130.1 | D4: 2145.4 | E4: 2119.9 | F4: 8051.1 | G4: 2751.1 | H4: 2758.5 | I4: 2780.6 | J4: 2743.8 | K4: 11432
A5: 18650 | B5: 214.96 | C5: 215.44 | D5: 216.85 | E5: 214.48 | F5: 667.9 | G5: 264.39 | H5: 265.06 | I5: 267.08 | J5: 263.71 | K5: 797.25
A6: LFP-HE | B6: 358.06 | C6: 358.76 | D6: 360.96 | E6: 357.34 | F6: 1180.4 | G6: 435 | H6: 435.99 | I6: 438.96 | J6: 433.98 | K6: 1400.4
A7: LFP-HP | B7: 480.13 | C7: 481.2 | D7: 484.39 | E7: 479.08 | F7: 1532.1 | G7: 592.47 | H7: 593.98 | I7: 598.47 | J7: 590.97 | K7: 1850.6
A8: LTO | B8: 539.91 | C8: 540.8 | D8: 543.45 | E8: 539 | F8: 2107.4 | G8: 646.65 | H8: 647.91 | I8: 651.71 | J8: 645.55 | K8: 2558.8
B10: Fahrzeugmasse
B11: 204 Opportunity | F11: 204 Overnight | G11: 192 Opportunity | K11: 192 Overnight | L11: Punktezuordnung Masse | O11: Batteriemasse Punkte
B12: 40kW | C12: 375kW | D12: 200kW | E12: Swap | F12: 40kW | G12: 40kW | H12: 375kW | I12: 200kW | J12: Swap | K12: 40kW | L12: Wert | M12: Punkte | O12: 204 Opportunity | S12: 204 Overnight | T12: 192 Opportunity | X12: 192 Overnight
A13: Ladesysmasse | B13: 50 | C13: 185 | D13: 450 | E13: 0 | F13: 50 | G13: of:=[.B13] -> 50 | H13: of:=[.C13] -> 185 | I13: of:=[.D13] -> 450 | J13: of:=[.E13] -> 0 | K13: of:=[.F13] -> 50 | L13: 0 | M13: 4 | O13: 40kW | P13: 375kW | Q13: 200kW | R13: Swap | S13: 40kW | T13: 40kW | U13: 375kW | V13: 200kW | W13: Swap | X13: 40kW
A14: 18650 | B14: of:=[.B5]+[.B$13] -> 264.96 | C14: of:=[.C5]+[.C$13] -> 400.44 | D14: of:=[.D5]+[.D$13] -> 666.85 | E14: of:=[.E5]+[.E$13] -> 214.48 | F14: of:=[.F5]+[.F$13] -> 717.9 | G14: of:=[.G5]+[.G$13] -> 314.39 | H14: of:=[.H5]+[.H$13] -> 450.06 | I14: of:=[.I5]+[.I$13] -> 717.08 | J14: of:=[.J5]+[.J$13] -> 263.71 | K14: of:=[.K5]+[.K$13] -> 847.25 | L14: 250 | M14: 3 | N14: 18650 | O14: of:=(VLOOKUP([.B14]; [.$L$13:.$M$17];2;1)) -> 3 | P14: of:=(VLOOKUP([.C14]; [.$L$13:.$M$17];2;1)) -> 3 | Q14: of:=(VLOOKUP([.D14]; [.$L$13:.$M$17];2;1)) -> 3 | R14: of:=(VLOOKUP([.E14]; [.$L$13:.$M$17];2;1)) -> 4 | S14: of:=(VLOOKUP([.F14]; [.$L$13:.$M$17];2;1)) -> 3 | T14: of:=(VLOOKUP([.G14]; [.$L$13:.$M$17];2;1)) -> 3 | U14: of:=(VLOOKUP([.H14]; [.$L$13:.$M$17];2;1)) -> 3 | V14: of:=(VLOOKUP([.I14]; [.$L$13:.$M$17];2;1)) -> 3 | W14: of:=(VLOOKUP([.J14]; [.$L$13:.$M$17];2;1)) -> 3 | X14: of:=(VLOOKUP([.K14]; [.$L$13:.$M$17];2;1)) -> 2
A15: LFP-HE | B15: of:=[.B6]+[.B$13] -> 408.06 | C15: of:=[.C6]+[.C$13] -> 543.76 | D15: of:=[.D6]+[.D$13] -> 810.96 | E15: of:=[.E6]+[.E$13] -> 357.34 | F15: of:=[.F6]+[.F$13] -> 1230.4 | G15: of:=[.G6]+[.G$13] -> 485 | H15: of:=[.H6]+[.H$13] -> 620.99 | I15: of:=[.I6]+[.I$13] -> 888.96 | J15: of:=[.J6]+[.J$13] -> 433.98 | K15: of:=[.K6]+[.K$13] -> 1450.4 | L15: 750 | M15: 2 | N15: LFP-HE | O15: of:=(VLOOKUP([.B15]; [.$L$13:.$M$17];2;1)) -> 3 | P15: of:=(VLOOKUP([.C15]; [.$L$13:.$M$17];2;1)) -> 3 | Q15: of:=(VLOOKUP([.D15]; [.$L$13:.$M$17];2;1)) -> 2 | R15: of:=(VLOOKUP([.E15]; [.$L$13:.$M$17];2;1)) -> 3 | S15: of:=(VLOOKUP([.F15]; [.$L$13:.$M$17];2;1)) -> 2 | T15: of:=(VLOOKUP([.G15]; [.$L$13:.$M$17];2;1)) -> 3 | U15: of:=(VLOOKUP([.H15]; [.$L$13:.$M$17];2;1)) -> 3 | V15: of:=(VLOOKUP([.I15]; [.$L$13:.$M$17];2;1)) -> 2 | W15: of:=(VLOOKUP([.J15]; [.$L$13:.$M$17];2;1)) -> 3 | X15: of:=(VLOOKUP([.K15]; [.$L$13:.$M$17];2;1)) -> 1
A16: LFP-HP | B16: of:=[.B7]+[.B$13] -> 530.13 | C16: of:=[.C7]+[.C$13] -> 666.2 | D16: of:=[.D7]+[.D$13] -> 934.39 | E16: of:=[.E7]+[.E$13] -> 479.08 | F16: of:=[.F7]+[.F$13] -> 1582.1 | G16: of:=[.G7]+[.G$13] -> 642.47 | H16: of:=[.H7]+[.H$13] -> 778.98 | I16: of:=[.I7]+[.I$13] -> 1048.47 | J16: of:=[.J7]+[.J$13] -> 590.97 | K16: of:=[.K7]+[.K$13] -> 1900.6 | L16: 1250 | M16: 1 | N16: LFP-HP | O16: of:=(VLOOKUP([.B16]; [.$L$13:.$M$17];2;1)) -> 3 | P16: of:=(VLOOKUP([.C16]; [.$L$13:.$M$17];2;1)) -> 3 | Q16: of:=(VLOOKUP([.D16]; [.$L$13:.$M$17];2;1)) -> 2 | R16: of:=(VLOOKUP([.E16]; [.$L$13:.$M$17];2;1)) -> 3 | S16: of:=(VLOOKUP([.F16]; [.$L$13:.$M$17];2;1)) -> 1 | T16: of:=(VLOOKUP([.G16]; [.$L$13:.$M$17];2;1)) -> 3 | U16: of:=(VLOOKUP([.H16]; [.$L$13:.$M$17];2;1)) -> 2 | V16: of:=(VLOOKUP([.I16]; [.$L$13:.$M$17];2;1)) -> 2 | W16: of:=(VLOOKUP([.J16]; [.$L$13:.$M$17];2;1)) -> 3 | X16: of:=(VLOOKUP([.K16]; [.$L$13:.$M$17];2;1)) -> 1
A17: LiTiO | B17: of:=[.B8]+[.B$13] -> 589.91 | C17: of:=[.C8]+[.C$13] -> 725.8 | D17: of:=[.D8]+[.D$13] -> 993.45 | E17: of:=[.E8]+[.E$13] -> 539 | F17: of:=[.F8]+[.F$13] -> 2157.4 | G17: of:=[.G8]+[.G$13] -> 696.65 | H17: of:=[.H8]+[.H$13] -> 832.91 | I17: of:=[.I8]+[.I$13] -> 1101.71 | J17: of:=[.J8]+[.J$13] -> 645.55 | K17: of:=[.K8]+[.K$13] -> 2608.8 | L17: 100000 | M17: 0 | N17: LiTiO | O17: of:=(VLOOKUP([.B17]; [.$L$13:.$M$17];2;1)) -> 3 | P17: of:=(VLOOKUP([.C17]; [.$L$13:.$M$17];2;1)) -> 3 | Q17: of:=(VLOOKUP([.D17]; [.$L$13:.$M$17];2;1)) -> 2 | R17: of:=(VLOOKUP([.E17]; [.$L$13:.$M$17];2;1)) -> 3 | S17: of:=(VLOOKUP([.F17]; [.$L$13:.$M$17];2;1)) -> 1 | T17: of:=(VLOOKUP([.G17]; [.$L$13:.$M$17];2;1)) -> 3 | U17: of:=(VLOOKUP([.H17]; [.$L$13:.$M$17];2;1)) -> 2 | V17: of:=(VLOOKUP([.I17]; [.$L$13:.$M$17];2;1)) -> 2 | W17: of:=(VLOOKUP([.J17]; [.$L$13:.$M$17];2;1)) -> 3 | X17: of:=(VLOOKUP([.K17]; [.$L$13:.$M$17];2;1)) -> 1
A18: Mittelwert | B18: of:=AVERAGE([.B14:.K17]) -> 803.2885 | L18: Gewichtung | M18: 6 | N18: Mittelwert | O18: of:=AVERAGE([.O14:.X17]) -> 2.525
A19: Min | B19: of:=MIN([.B14:.K17]) -> 214.48 | N19: Min | O19: of:=MIN([.O14:.X17]) -> 1
A20: Max | B20: of:=MAX([.B14:.K17]) -> 2608.8 | N20: Max | O20: of:=MAX([.O14:.X17]) -> 4
B22: Fahrzeugvolumen frei (indirekt)
B23: 204 Opportunity | F23: 204 Overnight | G23: 192 Opportunity | K23: 192 Overnight
B24: 40kW | C24: 375kW | D24: 200kW | E24: Swap | F24: 40kW | G24: 40kW | H24: 375kW | I24: 200kW | J24: Swap | K24: 40kW
A25: 18650 | B25: 77.783 | C25: 77.956 | D25: 78.468 | E25: 77.61 | F25: 241.68 | G25: 95.671 | H25: 95.915 | I25: 96.646 | J25: 95.427 | K25: 288.49
A26: LFP-HE | B26: 217.01 | C26: 217.43 | D26: 218.77 | E26: 216.57 | F26: 715.41 | G26: 263.63 | H26: 264.24 | I26: 266.04 | J26: 263.02 | K26: 848.72
A27: LFP-HP | B27: 250.72 | C27: 251.28 | D27: 252.95 | E27: 250.17 | F27: 800.07 | G27: 309.39 | H27: 310.17 | I27: 312.52 | J27: 308.6 | K27: 966.36
A28: LiTiO | B28: 377.93 | C28: 378.56 | D28: 380.41 | E28: 377.3 | F28: 1475.2 | G28: 452.65 | H28: 453.54 | I28: 456.2 | J28: 451.88 | K28: 1791.1
A29: Mittelwert | B29: of:=AVERAGE([.B25:.K28]) -> 383.08715
A30: Min | B30: of:=MIN([.B25:.K28]) -> 77.61
A31: Max | B31: of:=MAX([.B25:.K28]) -> 1791.1
B33: Gesamtvlumen frei | L33: Punktezuordnung Volumen | O33: Batterievolumen Punkte
B34: 204 Opportunity | F34: 204 Overnight | G34: 192 Opportunity | K34: 192 Overnight | L34: Wert | M34: Punkte | O34: 204 Opportunity | S34: 204 Overnight | T34: 192 Opportunity | X34: 192 Overnight
B35: 40kW | C35: 375kW | D35: 200kW | E35: Swap | F35: 40kW | G35: 40kW | H35: 375kW | I35: 200kW | J35: Swap | K35: 40kW | L35: 0 | M35: 4 | O35: 40kW | P35: 375kW | Q35: 200kW | R35: Swap | S35: 40kW | T35: 40kW | U35: 375kW | V35: 200kW | W35: Swap | X35: 40kW
A36: Ladesysvol | B36: 50 | C36: 100 | D36: 100 | E36: 0 | F36: 50 | G36: of:=[.B36] -> 50 | H36: of:=[.C36] -> 100 | I36: of:=[.D36] -> 100 | J36: of:=[.E36] -> 0 | K36: of:=[.F36] -> 50 | L36: 100 | M36: 3 | N36: 18650 | O36: of:=(VLOOKUP([.B36]; [.$L$35:.$M$38];2;1)) -> 4 | P36: of:=(VLOOKUP([.C36]; [.$L$35:.$M$38];2;1)) -> 3 | Q36: of:=(VLOOKUP([.D36]; [.$L$35:.$M$38];2;1)) -> 3 | R36: of:=(VLOOKUP([.E36]; [.$L$35:.$M$38];2;1)) -> 4 | S36: of:=(VLOOKUP([.F36]; [.$L$35:.$M$38];2;1)) -> 4 | T36: of:=(VLOOKUP([.G36]; [.$L$35:.$M$38];2;1)) -> 4 | U36: of:=(VLOOKUP([.H36]; [.$L$35:.$M$38];2;1)) -> 3 | V36: of:=(VLOOKUP([.I36]; [.$L$35:.$M$38];2;1)) -> 3 | W36: of:=(VLOOKUP([.J36]; [.$L$35:.$M$38];2;1)) -> 4 | X36: of:=(VLOOKUP([.K36]; [.$L$35:.$M$38];2;1)) -> 4
A37: 18650 | B37: of:=[.B25]+[.B$36] -> 127.783 | C37: of:=[.C25]+[.C$36] -> 177.956 | D37: of:=[.D25]+[.D$36] -> 178.468 | E37: of:=[.E25]+[.E$36] -> 77.61 | F37: of:=[.F25]+[.F$36] -> 291.68 | G37: of:=[.G25]+[.G$36] -> 145.671 | H37: of:=[.H25]+[.H$36] -> 195.915 | I37: of:=[.I25]+[.I$36] -> 196.646 | J37: of:=[.J25]+[.J$36] -> 95.427 | K37: of:=[.K25]+[.K$36] -> 338.49 | L37: 200 | M37: 2 | N37: LFP-HE | O37: of:=(VLOOKUP([.B37]; [.$L$35:.$M$38];2;1)) -> 3 | P37: of:=(VLOOKUP([.C37]; [.$L$35:.$M$38];2;1)) -> 3 | Q37: of:=(VLOOKUP([.D37]; [.$L$35:.$M$38];2;1)) -> 3 | R37: of:=(VLOOKUP([.E37]; [.$L$35:.$M$38];2;1)) -> 4 | S37: of:=(VLOOKUP([.F37]; [.$L$35:.$M$38];2;1)) -> 2 | T37: of:=(VLOOKUP([.G37]; [.$L$35:.$M$38];2;1)) -> 3 | U37: of:=(VLOOKUP([.H37]; [.$L$35:.$M$38];2;1)) -> 3 | V37: of:=(VLOOKUP([.I37]; [.$L$35:.$M$38];2;1)) -> 3 | W37: of:=(VLOOKUP([.J37]; [.$L$35:.$M$38];2;1)) -> 4 | X37: of:=(VLOOKUP([.K37]; [.$L$35:.$M$38];2;1)) -> 2
A38: LFP-HE | B38: of:=[.B26]+[.B$36] -> 267.01 | C38: of:=[.C26]+[.C$36] -> 317.43 | D38: of:=[.D26]+[.D$36] -> 318.77 | E38: of:=[.E26]+[.E$36] -> 216.57 | F38: of:=[.F26]+[.F$36] -> 765.41 | G38: of:=[.G26]+[.G$36] -> 313.63 | H38: of:=[.H26]+[.H$36] -> 364.24 | I38: of:=[.I26]+[.I$36] -> 366.04 | J38: of:=[.J26]+[.J$36] -> 263.02 | K38: of:=[.K26]+[.K$36] -> 898.72 | L38: 400 | M38: 1 | N38: LFP-HP | O38: of:=(VLOOKUP([.B38]; [.$L$35:.$M$38];2;1)) -> 2 | P38: of:=(VLOOKUP([.C38]; [.$L$35:.$M$38];2;1)) -> 2 | Q38: of:=(VLOOKUP([.D38]; [.$L$35:.$M$38];2;1)) -> 2 | R38: of:=(VLOOKUP([.E38]; [.$L$35:.$M$38];2;1)) -> 2 | S38: of:=(VLOOKUP([.F38]; [.$L$35:.$M$38];2;1)) -> 1 | T38: of:=(VLOOKUP([.G38]; [.$L$35:.$M$38];2;1)) -> 2 | U38: of:=(VLOOKUP([.H38]; [.$L$35:.$M$38];2;1)) -> 2 | V38: of:=(VLOOKUP([.I38]; [.$L$35:.$M$38];2;1)) -> 2 | W38: of:=(VLOOKUP([.J38]; [.$L$35:.$M$38];2;1)) -> 2 | X38: of:=(VLOOKUP([.K38]; [.$L$35:.$M$38];2;1)) -> 1
A39: LFP-HP | B39: of:=[.B27]+[.B$36] -> 300.72 | C39: of:=[.C27]+[.C$36] -> 351.28 | D39: of:=[.D27]+[.D$36] -> 352.95 | E39: of:=[.E27]+[.E$36] -> 250.17 | F39: of:=[.F27]+[.F$36] -> 850.07 | G39: of:=[.G27]+[.G$36] -> 359.39 | H39: of:=[.H27]+[.H$36] -> 410.17 | I39: of:=[.I27]+[.I$36] -> 412.52 | J39: of:=[.J27]+[.J$36] -> 308.6 | K39: of:=[.K27]+[.K$36] -> 1016.36 | L39: Gewichtung | M39: 10 | N39: LiTiO | O39: of:=(VLOOKUP([.B39]; [.$L$35:.$M$38];2;1)) -> 2 | P39: of:=(VLOOKUP([.C39]; [.$L$35:.$M$38];2;1)) -> 2 | Q39: of:=(VLOOKUP([.D39]; [.$L$35:.$M$38];2;1)) -> 2 | R39: of:=(VLOOKUP([.E39]; [.$L$35:.$M$38];2;1)) -> 2 | S39: of:=(VLOOKUP([.F39]; [.$L$35:.$M$38];2;1)) -> 1 | T39: of:=(VLOOKUP([.G39]; [.$L$35:.$M$38];2;1)) -> 2 | U39: of:=(VLOOKUP([.H39]; [.$L$35:.$M$38];2;1)) -> 1 | V39: of:=(VLOOKUP([.I39]; [.$L$35:.$M$38];2;1)) -> 1 | W39: of:=(VLOOKUP([.J39]; [.$L$35:.$M$38];2;1)) -> 2 | X39: of:=(VLOOKUP([.K39]; [.$L$35:.$M$38];2;1)) -> 1
A40: LiTiO | B40: of:=[.B28]+[.B$36] -> 427.93 | C40: of:=[.C28]+[.C$36] -> 478.56 | D40: of:=[.D28]+[.D$36] -> 480.41 | E40: of:=[.E28]+[.E$36] -> 377.3 | F40: of:=[.F28]+[.F$36] -> 1525.2 | G40: of:=[.G28]+[.G$36] -> 502.65 | H40: of:=[.H28]+[.H$36] -> 553.54 | I40: of:=[.I28]+[.I$36] -> 556.2 | J40: of:=[.J28]+[.J$36] -> 451.88 | K40: of:=[.K28]+[.K$36] -> 1841.1 | N40: Mittelwert | O40: of:=AVERAGE([.O36:.X39]) -> 2.5
A41: Mittelwert | B41: of:=AVERAGE([.B37:.K40]) -> 443.08715 | N41: Min | O41: of:=MIN([.O36:.X39]) -> 1
A42: Min | B42: of:=MIN([.B37:.K40]) -> 77.61 | N42: Max | O42: of:=MAX([.O36:.X39]) -> 4
A43: Max | B43: of:=MAX([.B37:.K40]) -> 1841.1
B45: Ladezyklen pro tausend km | L45: Punktezuordnung LZPkm | O45: Ladezyklen pro km | AA45: Ladezyklen pro tausend km
B46: 204 Opportunity | F46: 204 Overnight | G46: 192 Opportunity | K46: 192 Overnight | L46: Wert | M46: Punkte | O46: 204 Opportunity | S46: 204 Overnight | T46: 192 Opportunity | X46: 192 Overnight | AA46: 204 Opportunity | AE46: 204 Overnight | AF46: 192 Opportunity | AJ46: 192 Overnight
B47: 40kW | C47: 375kW | D47: 200kW | E47: Swap | F47: 40kW | G47: 40kW | H47: 375kW | I47: 200kW | J47: Swap | K47: 40kW | L47: 0 | M47: 4 | O47: 40kW | P47: 375kW | Q47: 200kW | R47: Swap | S47: 40kW | T47: 40kW | U47: 375kW | V47: 200kW | W47: Swap | X47: 40kW | AA47: 40kW | AB47: 375kW | AC47: 200kW | AD47: Swap | AE47: 40kW | AF47: 40kW | AG47: 375kW | AH47: 200kW | AI47: Swap | AJ47: 40kW
A48: 18650 | B48: of:=1000*[.AA48] -> 23.654 | C48: of:=1000*[.AB48] -> 23.655 | D48: of:=1000*[.AC48] -> 23.657 | E48: of:=1000*[.AD48] -> 23.653 | F48: of:=1000*[.AE48] -> 6.4549 | G48: of:=1000*[.AF48] -> 15.29 | H48: of:=1000*[.AG48] -> 15.29 | I48: of:=1000*[.AH48] -> 15.292 | J48: of:=1000*[.AI48] -> 15.289 | K48: of:=1000*[.AJ48] -> 4.1719 | L48: 5 | M48: 3 | N48: 18650 | O48: of:=(VLOOKUP([.B48]; [.$L$47:.$M$50];2;1)) -> 2 | P48: of:=(VLOOKUP([.C48]; [.$L$47:.$M$50];2;1)) -> 2 | Q48: of:=(VLOOKUP([.D48]; [.$L$47:.$M$50];2;1)) -> 2 | R48: of:=(VLOOKUP([.E48]; [.$L$47:.$M$50];2;1)) -> 2 | S48: of:=(VLOOKUP([.F48]; [.$L$47:.$M$50];2;1)) -> 3 | T48: of:=(VLOOKUP([.G48]; [.$L$47:.$M$50];2;1)) -> 2 | U48: of:=(VLOOKUP([.H48]; [.$L$47:.$M$50];2;1)) -> 2 | V48: of:=(VLOOKUP([.I48]; [.$L$47:.$M$50];2;1)) -> 2 | W48: of:=(VLOOKUP([.J48]; [.$L$47:.$M$50];2;1)) -> 2 | X48: of:=(VLOOKUP([.K48]; [.$L$47:.$M$50];2;1)) -> 4 | Z48: 18650 | AA48: 0.023654 | AB48: 0.023655 | AC48: 0.023657 | AD48: 0.023653 | AE48: 0.0064549 | AF48: 0.01529 | AG48: 0.01529 | AH48: 0.015292 | AI48: 0.015289 | AJ48: 0.0041719
A49: LFP-HE | B49: of:=1000*[.AA49] -> 23.739 | C49: of:=1000*[.AB49] -> 23.739 | D49: of:=1000*[.AC49] -> 23.741 | E49: of:=1000*[.AD49] -> 23.736 | F49: of:=1000*[.AE49] -> 6.4713 | G49: of:=1000*[.AF49] -> 15.28 | H49: of:=1000*[.AG49] -> 15.281 | I49: of:=1000*[.AH49] -> 15.283 | J49: of:=1000*[.AI49] -> 15.279 | K49: of:=1000*[.AJ49] -> 4.157 | L49: 15 | M49: 2 | N49: LFP-HE | O49: of:=(VLOOKUP([.B49]; [.$L$47:.$M$50];2;1)) -> 2 | P49: of:=(VLOOKUP([.C49]; [.$L$47:.$M$50];2;1)) -> 2 | Q49: of:=(VLOOKUP([.D49]; [.$L$47:.$M$50];2;1)) -> 2 | R49: of:=(VLOOKUP([.E49]; [.$L$47:.$M$50];2;1)) -> 2 | S49: of:=(VLOOKUP([.F49]; [.$L$47:.$M$50];2;1)) -> 3 | T49: of:=(VLOOKUP([.G49]; [.$L$47:.$M$50];2;1)) -> 2 | U49: of:=(VLOOKUP([.H49]; [.$L$47:.$M$50];2;1)) -> 2 | V49: of:=(VLOOKUP([.I49]; [.$L$47:.$M$50];2;1)) -> 2 | W49: of:=(VLOOKUP([.J49]; [.$L$47:.$M$50];2;1)) -> 2 | X49: of:=(VLOOKUP([.K49]; [.$L$47:.$M$50];2;1)) -> 4 | Z49: LFP-HE | AA49: 0.023739 | AB49: 0.023739 | AC49: 0.023741 | AD49: 0.023736 | AE49: 0.0064713 | AF49: 0.01528 | AG49: 0.015281 | AH49: 0.015283 | AI49: 0.015279 | AJ49: 0.004157
A50: LFP-HP | B50: of:=1000*[.AA50] -> 23.732 | C50: of:=1000*[.AB50] -> 23.733 | D50: of:=1000*[.AC50] -> 23.735 | E50: of:=1000*[.AD50] -> 23.733 | F50: of:=1000*[.AE50] -> 6.4686 | G50: of:=1000*[.AF50] -> 15.266 | H50: of:=1000*[.AG50] -> 15.267 | I50: of:=1000*[.AH50] -> 15.269 | J50: of:=1000*[.AI50] -> 15.265 | K50: of:=1000*[.AJ50] -> 4.158 | L50: 30 | M50: 1 | N50: LFP-HP | O50: of:=(VLOOKUP([.B50]; [.$L$47:.$M$50];2;1)) -> 2 | P50: of:=(VLOOKUP([.C50]; [.$L$47:.$M$50];2;1)) -> 2 | Q50: of:=(VLOOKUP([.D50]; [.$L$47:.$M$50];2;1)) -> 2 | R50: of:=(VLOOKUP([.E50]; [.$L$47:.$M$50];2;1)) -> 2 | S50: of:=(VLOOKUP([.F50]; [.$L$47:.$M$50];2;1)) -> 3 | T50: of:=(VLOOKUP([.G50]; [.$L$47:.$M$50];2;1)) -> 2 | U50: of:=(VLOOKUP([.H50]; [.$L$47:.$M$50];2;1)) -> 2 | V50: of:=(VLOOKUP([.I50]; [.$L$47:.$M$50];2;1)) -> 2 | W50: of:=(VLOOKUP([.J50]; [.$L$47:.$M$50];2;1)) -> 2 | X50: of:=(VLOOKUP([.K50]; [.$L$47:.$M$50];2;1)) -> 4 | Z50: LFP-HP | AA50: 0.023732 | AB50: 0.023733 | AC50: 0.023735 | AD50: 0.023733 | AE50: 0.0064686 | AF50: 0.015266 | AG50: 0.015267 | AH50: 0.015269 | AI50: 0.015265 | AJ50: 0.004158
A51: LiTiO | B51: of:=1000*[.AA51] -> 23.708 | C51: of:=1000*[.AB51] -> 23.71 | D51: of:=1000*[.AC51] -> 23.715 | E51: of:=1000*[.AD51] -> 23.707 | F51: of:=1000*[.AE51] -> 6.473 | G51: of:=1000*[.AF51] -> 15.253 | H51: of:=1000*[.AG51] -> 15.247 | I51: of:=1000*[.AH51] -> 15.25 | J51: of:=1000*[.AI51] -> 15.247 | K51: of:=1000*[.AJ51] -> 4.1561 | L51: Gewichtung | M51: 8 | N51: LiTiO | O51: of:=(VLOOKUP([.B51]; [.$L$47:.$M$50];2;1)) -> 2 | P51: of:=(VLOOKUP([.C51]; [.$L$47:.$M$50];2;1)) -> 2 | Q51: of:=(VLOOKUP([.D51]; [.$L$47:.$M$50];2;1)) -> 2 | R51: of:=(VLOOKUP([.E51]; [.$L$47:.$M$50];2;1)) -> 2 | S51: of:=(VLOOKUP([.F51]; [.$L$47:.$M$50];2;1)) -> 3 | T51: of:=(VLOOKUP([.G51]; [.$L$47:.$M$50];2;1)) -> 2 | U51: of:=(VLOOKUP([.H51]; [.$L$47:.$M$50];2;1)) -> 2 | V51: of:=(VLOOKUP([.I51]; [.$L$47:.$M$50];2;1)) -> 2 | W51: of:=(VLOOKUP([.J51]; [.$L$47:.$M$50];2;1)) -> 2 | X51: of:=(VLOOKUP([.K51]; [.$L$47:.$M$50];2;1)) -> 4 | Z51: LiTiO | AA51: 0.023708 | AB51: 0.02371 | AC51: 0.023715 | AD51: 0.023707 | AE51: 0.006473 | AF51: 0.015253 | AG51: 0.015247 | AH51: 0.01525 | AI51: 0.015247 | AJ51: 0.0041561
A52: Mittelwert | B52: of:=AVERAGE([.B48:.K51]) -> 16.655145 | N52: Mittelwert | O52: of:=AVERAGE([.O48:.X51]) -> 2.3 | Z52: Mittelwert | AA52: of:=AVERAGE([.AA48:.AJ51]) -> 0.016655145
A53: Min | B53: of:=MIN([.B48:.K51]) -> 4.1561 | N53: Min | O53: of:=MIN([.O48:.X51]) -> 2 | Z53: Min | AA53: of:=MIN([.AA48:.AJ51]) -> 0.0041561
A54: Max | B54: of:=MAX([.B48:.K51]) -> 23.741 | N54: Max | O54: of:=MAX([.O48:.X51]) -> 4 | Z54: Max | AA54: of:=MAX([.AA48:.AJ51]) -> 0.023741
B56: Positionierungsgenauigkeit Fläche | L56: Punktezuordnung Fläche | O56: Punkte Fläche
B57: 204 Opportunity | F57: 204 Overnight | G57: 192 Opportunity | K57: 192 Overnight | L57: Wert | M57: Punkte | O57: 204 Opportunity | S57: 204 Overnight | T57: 192 Opportunity | X57: 192 Overnight
B58: 40kW | C58: 375kW | D58: 200kW | E58: Swap | F58: 40kW | G58: 40kW | H58: 375kW | I58: 200kW | J58: Swap | K58: 40kW | L58: 0 | M58: 1 | O58: 40kW | P58: 375kW | Q58: 200kW | R58: Swap | S58: 40kW | T58: 40kW | U58: 375kW | V58: 200kW | W58: Swap | X58: 40kW
B59: 47 | C59: 1.75 | D59: 1 | E59: 4 | F59: of:=[.B59] -> 47 | G59: of:=[.B59] -> 47 | H59: of:=[.C59] -> 1.75 | I59: of:=[.D59] -> 1 | J59: of:=[.E59] -> 4 | K59: of:=[.F59] -> 47 | L59: 3 | M59: 2 | N59: 18650 | O59: of:=(VLOOKUP([.B60]; [.$L$58:.$M$61];2;1)) -> 4 | P59: of:=(VLOOKUP([.C60]; [.$L$58:.$M$61];2;1)) -> 1 | Q59: of:=(VLOOKUP([.C60]; [.$L$58:.$M$61];2;1)) -> 1 | R59: of:=(VLOOKUP([.E60]; [.$L$58:.$M$61];2;1)) -> 2 | S59: of:=(VLOOKUP([.F60]; [.$L$58:.$M$61];2;1)) -> 4 | T59: of:=(VLOOKUP([.G60]; [.$L$58:.$M$61];2;1)) -> 4 | U59: of:=(VLOOKUP([.H60]; [.$L$58:.$M$61];2;1)) -> 1 | V59: of:=(VLOOKUP([.I60]; [.$L$58:.$M$61];2;1)) -> 1 | W59: of:=(VLOOKUP([.J60]; [.$L$58:.$M$61];2;1)) -> 2 | X59: of:=(VLOOKUP([.K60]; [.$L$58:.$M$61];2;1)) -> 4
A60: 18650 | B60: of:=[.B$59] -> 47 | C60: of:=[.C$59] -> 1.75 | D60: 1 | E60: of:=[.E$59] -> 4 | F60: of:=[.F$59] -> 47 | G60: of:=[.G$59] -> 47 | H60: of:=[.H$59] -> 1.75 | I60: of:=[.I$59] -> 1 | J60: of:=[.J$59] -> 4 | K60: of:=[.K$59] -> 47 | L60: 6 | M60: 3 | N60: LFP-HE | O60: of:=(VLOOKUP([.B61]; [.$L$58:.$M$61];2;1)) -> 4 | P60: of:=(VLOOKUP([.C61]; [.$L$58:.$M$61];2;1)) -> 1 | Q60: of:=(VLOOKUP([.C61]; [.$L$58:.$M$61];2;1)) -> 1 | R60: of:=(VLOOKUP([.E61]; [.$L$58:.$M$61];2;1)) -> 2 | S60: of:=(VLOOKUP([.F61]; [.$L$58:.$M$61];2;1)) -> 4 | T60: of:=(VLOOKUP([.G61]; [.$L$58:.$M$61];2;1)) -> 4 | U60: of:=(VLOOKUP([.H61]; [.$L$58:.$M$61];2;1)) -> 1 | V60: of:=(VLOOKUP([.I61]; [.$L$58:.$M$61];2;1)) -> 1 | W60: of:=(VLOOKUP([.J61]; [.$L$58:.$M$61];2;1)) -> 2 | X60: of:=(VLOOKUP([.K61]; [.$L$58:.$M$61];2;1)) -> 4
A61: LFP-HE | B61: of:=[.B$59] -> 47 | C61: of:=[.C$59] -> 1.75 | D61: 1 | E61: of:=[.E$59] -> 4 | F61: of:=[.F$59] -> 47 | G61: of:=[.G$59] -> 47 | H61: of:=[.H$59] -> 1.75 | I61: of:=[.I$59] -> 1 | J61: of:=[.J$59] -> 4 | K61: of:=[.K$59] -> 47 | L61: 9 | M61: 4 | N61: LFP-HP | O61: of:=(VLOOKUP([.B62]; [.$L$58:.$M$61];2;1)) -> 4 | P61: of:=(VLOOKUP([.C62]; [.$L$58:.$M$61];2;1)) -> 1 | Q61: of:=(VLOOKUP([.C62]; [.$L$58:.$M$61];2;1)) -> 1 | R61: of:=(VLOOKUP([.E62]; [.$L$58:.$M$61];2;1)) -> 2 | S61: of:=(VLOOKUP([.F62]; [.$L$58:.$M$61];2;1)) -> 4 | T61: of:=(VLOOKUP([.G62]; [.$L$58:.$M$61];2;1)) -> 4 | U61: of:=(VLOOKUP([.H62]; [.$L$58:.$M$61];2;1)) -> 1 | V61: of:=(VLOOKUP([.I62]; [.$L$58:.$M$61];2;1)) -> 1 | W61: of:=(VLOOKUP([.J62]; [.$L$58:.$M$61];2;1)) -> 2 | X61: of:=(VLOOKUP([.K62]; [.$L$58:.$M$61];2;1)) -> 4
A62: LFP-HP | B62: of:=[.B$59] -> 47 | C62: of:=[.C$59] -> 1.75 | D62: 1 | E62: of:=[.E$59] -> 4 | F62: of:=[.F$59] -> 47 | G62: of:=[.G$59] -> 47 | H62: of:=[.H$59] -> 1.75 | I62: of:=[.I$59] -> 1 | J62: of:=[.J$59] -> 4 | K62: of:=[.K$59] -> 47 | L62: Gewichtung | M62: 6 | N62: LiTiO | O62: of:=(VLOOKUP([.B63]; [.$L$58:.$M$61];2;1)) -> 4 | P62: of:=(VLOOKUP([.C63]; [.$L$58:.$M$61];2;1)) -> 1 | Q62: of:=(VLOOKUP([.C63]; [.$L$58:.$M$61];2;1)) -> 1 | R62: of:=(VLOOKUP([.E63]; [.$L$58:.$M$61];2;1)) -> 2 | S62: of:=(VLOOKUP([.F63]; [.$L$58:.$M$61];2;1)) -> 4 | T62: of:=(VLOOKUP([.G63]; [.$L$58:.$M$61];2;1)) -> 4 | U62: of:=(VLOOKUP([.H63]; [.$L$58:.$M$61];2;1)) -> 1 | V62: of:=(VLOOKUP([.I63]; [.$L$58:.$M$61];2;1)) -> 1 | W62: of:=(VLOOKUP([.J63]; [.$L$58:.$M$61];2;1)) -> 2 | X62: of:=(VLOOKUP([.K63]; [.$L$58:.$M$61];2;1)) -> 4
A63: LiTiO | B63: of:=[.B$59] -> 47 | C63: of:=[.C$59] -> 1.75 | D63: 1 | E63: of:=[.E$59] -> 4 | F63: of:=[.F$59] -> 47 | G63: of:=[.G$59] -> 47 | H63: of:=[.H$59] -> 1.75 | I63: of:=[.I$59] -> 1 | J63: of:=[.J$59] -> 4 | K63: of:=[.K$59] -> 47 | N63: Mittelwert | O63: of:=AVERAGE([.O59:.X62]) -> 2.4
A64: Mittelwert | B64: of:=AVERAGE([.B60:.K63]) -> 20.15 | N64: Min | O64: of:=MIN([.O59:.X62]) -> 1
A65: Min | B65: of:=MIN([.B60:.K63]) -> 1 | N65: Max | O65: of:=MAX([.O59:.X62]) -> 4
A66: Max | B66: of:=MAX([.B60:.K63]) -> 47
B68: Positionierungsgenauigkeit Winkel | L68: Punktezuordnung Winkel | O68: Punkte Winkel
B69: 204 Opportunity | F69: 204 Overnight | G69: 192 Opportunity | K69: 192 Overnight | L69: Wert | M69: Punkte | O69: 204 Opportunity | S69: 204 Overnight | T69: 192 Opportunity | X69: 192 Overnight
B70: 40kW | C70: 375kW | D70: 200kW | E70: Swap | F70: 40kW | G70: 40kW | H70: 375kW | I70: 200kW | J70: Swap | K70: 40kW | L70: 0 | M70: 1 | O70: 40kW | P70: 375kW | Q70: 200kW | R70: Swap | S70: 40kW | T70: 40kW | U70: 375kW | V70: 200kW | W70: Swap | X70: 40kW
B71: 360 | C71: 2 | D71: 360 | E71: 1 | F71: of:=[.B71] -> 360 | G71: of:=[.B71] -> 360 | H71: of:=[.C71] -> 2 | I71: of:=[.D71] -> 360 | J71: of:=[.E71] -> 1 | K71: of:=[.F71] -> 360 | L71: 90 | M71: 2 | N71: 18650 | O71: of:=(VLOOKUP([.B72]; [.$L$70:.$M$73];2;1)) -> 4 | P71: of:=(VLOOKUP([.D72]; [.$L$70:.$M$73];2;1)) -> 4 | Q71: of:=(VLOOKUP([.D72]; [.$L$70:.$M$73];2;1)) -> 4 | R71: of:=(VLOOKUP([.E72]; [.$L$70:.$M$73];2;1)) -> 1 | S71: of:=(VLOOKUP([.F72]; [.$L$70:.$M$73];2;1)) -> 4 | T71: of:=(VLOOKUP([.G72]; [.$L$70:.$M$73];2;1)) -> 4 | U71: of:=(VLOOKUP([.H72]; [.$L$70:.$M$73];2;1)) -> 1 | V71: of:=(VLOOKUP([.I72]; [.$L$70:.$M$73];2;1)) -> 4 | W71: of:=(VLOOKUP([.J72]; [.$L$70:.$M$73];2;1)) -> 1 | X71: of:=(VLOOKUP([.K72]; [.$L$70:.$M$73];2;1)) -> 4
A72: 18650 | B72: of:=[.B$71] -> 360 | C72: 2 | D72: of:=[.D$71] -> 360 | E72: of:=[.E$71] -> 1 | F72: of:=[.F$71] -> 360 | G72: of:=[.G$71] -> 360 | H72: of:=[.H$71] -> 2 | I72: of:=[.I$71] -> 360 | J72: of:=[.J$71] -> 1 | K72: of:=[.K$71] -> 360 | L72: 180 | M72: 3 | N72: LFP-HE | O72: of:=(VLOOKUP([.B73]; [.$L$70:.$M$73];2;1)) -> 4 | P72: of:=(VLOOKUP([.D73]; [.$L$70:.$M$73];2;1)) -> 4 | Q72: of:=(VLOOKUP([.D73]; [.$L$70:.$M$73];2;1)) -> 4 | R72: of:=(VLOOKUP([.E73]; [.$L$70:.$M$73];2;1)) -> 1 | S72: of:=(VLOOKUP([.F73]; [.$L$70:.$M$73];2;1)) -> 4 | T72: of:=(VLOOKUP([.G73]; [.$L$70:.$M$73];2;1)) -> 4 | U72: of:=(VLOOKUP([.H73]; [.$L$70:.$M$73];2;1)) -> 1 | V72: of:=(VLOOKUP([.I73]; [.$L$70:.$M$73];2;1)) -> 4 | W72: of:=(VLOOKUP([.J73]; [.$L$70:.$M$73];2;1)) -> 1 | X72: of:=(VLOOKUP([.K73]; [.$L$70:.$M$73];2;1)) -> 4
A73: LFP-HE | B73: of:=[.B$71] -> 360 | C73: 2 | D73: of:=[.D$71] -> 360 | E73: of:=[.E$71] -> 1 | F73: of:=[.F$71] -> 360 | G73: of:=[.G$71] -> 360 | H73: of:=[.H$71] -> 2 | I73: of:=[.I$71] -> 360 | J73: of:=[.J$71] -> 1 | K73: of:=[.K$71] -> 360 | L73: 360 | M73: 4 | N73: LFP-HP | O73: of:=(VLOOKUP([.B74]; [.$L$70:.$M$73];2;1)) -> 4 | P73: of:=(VLOOKUP([.D74]; [.$L$70:.$M$73];2;1)) -> 4 | Q73: of:=(VLOOKUP([.D74]; [.$L$70:.$M$73];2;1)) -> 4 | R73: of:=(VLOOKUP([.E74]; [.$L$70:.$M$73];2;1)) -> 1 | S73: of:=(VLOOKUP([.F74]; [.$L$70:.$M$73];2;1)) -> 4 | T73: of:=(VLOOKUP([.G74]; [.$L$70:.$M$73];2;1)) -> 4 | U73: of:=(VLOOKUP([.H74]; [.$L$70:.$M$73];2;1)) -> 1 | V73: of:=(VLOOKUP([.I74]; [.$L$70:.$M$73];2;1)) -> 4 | W73: of:=(VLOOKUP([.J74]; [.$L$70:.$M$73];2;1)) -> 1 | X73: of:=(VLOOKUP([.K74]; [.$L$70:.$M$73];2;1)) -> 4
A74: LFP-HP | B74: of:=[.B$71] -> 360 | C74: 2 | D74: of:=[.D$71] -> 360 | E74: of:=[.E$71] -> 1 | F74: of:=[.F$71] -> 360 | G74: of:=[.G$71] -> 360 | H74: of:=[.H$71] -> 2 | I74: of:=[.I$71] -> 360 | J74: of:=[.J$71] -> 1 | K74: of:=[.K$71] -> 360 | L74: Gewichtung | M74: 3 | N74: LiTiO | O74: of:=(VLOOKUP([.B75]; [.$L$70:.$M$73];2;1)) -> 4 | P74: of:=(VLOOKUP([.D75]; [.$L$70:.$M$73];2;1)) -> 4 | Q74: of:=(VLOOKUP([.D75]; [.$L$70:.$M$73];2;1)) -> 4 | R74: of:=(VLOOKUP([.E75]; [.$L$70:.$M$73];2;1)) -> 1 | S74: of:=(VLOOKUP([.F75]; [.$L$70:.$M$73];2;1)) -> 4 | T74: of:=(VLOOKUP([.G75]; [.$L$70:.$M$73];2;1)) -> 4 | U74: of:=(VLOOKUP([.H75]; [.$L$70:.$M$73];2;1)) -> 1 | V74: of:=(VLOOKUP([.I75]; [.$L$70:.$M$73];2;1)) -> 4 | W74: of:=(VLOOKUP([.J75]; [.$L$70:.$M$73];2;1)) -> 1 | X74: of:=(VLOOKUP([.K75]; [.$L$70:.$M$73];2;1)) -> 4
A75: LiTiO | B75: of:=[.B$71] -> 360 | C75: 2 | D75: of:=[.D$71] -> 360 | E75: of:=[.E$71] -> 1 | F75: of:=[.F$71] -> 360 | G75: of:=[.G$71] -> 360 | H75: of:=[.H$71] -> 2 | I75: of:=[.I$71] -> 360 | J75: of:=[.J$71] -> 1 | K75: of:=[.K$71] -> 360 | N75: Mittelwert | O75: of:=AVERAGE([.O71:.X74]) -> 3.1
A76: Mittelwert | B76: of:=AVERAGE([.B72:.K75]) -> 216.6 | N76: Min | O76: of:=MIN([.O71:.X74]) -> 1
A77: Min | B77: of:=MIN([.B72:.K75]) -> 1 | N77: Max | O77: of:=MAX([.O71:.X74]) -> 4
A78: Max | B78: of:=MAX([.B72:.K75]) -> 360
B81: Ladezeit
B82: 204 Opportunity | F82: 204 Overnight | G82: 192 Opportunity | K82: 192 Overnight
B83: 40kW | C83: 375kW | D83: 200kW | E83: Swap | F83: 40kW | G83: 40kW | H83: 375kW | I83: 200kW | J83: Swap | K83: 40kW
A84: 18650 | B84: 2292 | C84: 2240 | D84: 2241 | E84: 420 | F84: 16910 | G84: 2301 | H84: 2249 | I84: 2250 | J84: 420 | K84: 19566
A85: LFP-HE | B85: 1542 | C85: 1078 | D85: 1079 | E85: 420 | F85: 14597 | G85: 1852 | H85: 1078 | I85: 1079 | J85: 420 | K85: 17160
A86: LFP-HP | B86: 2199 | C86: 2147 | D86: 2148 | E86: 420 | F86: 18227 | G86: 2197 | H86: 2145 | I86: 2147 | J86: 420 | K86: 20930
A87: LiTiO | B87: 1442 | C87: 489 | D87: 490 | E87: 420 | F87: 17562 | G87: 1704 | H87: 489 | I87: 490 | J87: 420 | K87: 20211
A88: Mittelwert | B88: of:=AVERAGE([.B84:.K87]) -> 4697.275
A89: Min | B89: of:=MIN([.B84:.K87]) -> 420
A90: Max | B90: of:=MAX([.B84:.K87]) -> 20930
A92: Fahrzeit 204 | B92: 4646 | D92: Fahrzeit 196 | E92: 3661 | J92: LZ Swap | K92: 420
B93: Fahrzeitanteil | L93: Punktezuordnung FZA | O93: Punkte FZA
B94: 204 Opportunity | F94: 204 Overnight | G94: 192 Opportunity | K94: 192 Overnight | L94: Wert | M94: Punkte | O94: 204 Opportunity | S94: 204 Overnight | T94: 192 Opportunity | X94: 192 Overnight
B95: 40kW | C95: 375kW | D95: 200kW | E95: Swap | F95: 40kW | G95: 40kW | H95: 375kW | I95: 200kW | J95: Swap | K95: 40kW | L95: 0 | M95: 1 | O95: 40kW | P95: 375kW | Q95: 200kW | R95: Swap | S95: 40kW | T95: 40kW | U95: 375kW | V95: 200kW | W95: Swap | X95: 40kW
A96: 18650 | B96: of:=[.$B$92]/([.B84]+[.$B$92]) -> 0.669645430959931 | C96: of:=[.$B$92]/([.C84]+[.$B$92]) -> 0.674702294510601 | D96: of:=[.$B$92]/([.D84]+[.$B$92]) -> 0.674604326992885 | E96: of:=[.$B$92]/([.E84]+[.$B$92]) -> 0.917094354520332 | F96: of:=(11*[.$B$92])/([.F84]+(11*[.$B$92])) -> 0.751382027758175 | G96: of:=[.$E$92]/([.G84]+[.$E$92]) -> 0.614055686011406 | H96: of:=[.$E$92]/([.H84]+[.$E$92]) -> 0.619458544839256 | I96: of:=[.$E$92]/([.I84]+[.$E$92]) -> 0.619353747250888 | J96: of:=[.$E$92]/([.J84]+[.$E$92]) -> 0.897084048027444 | K96: of:=(11*[.$E$92])/([.K84]+(11*[.$E$92])) -> 0.673011681735381 | L96: 0.6 | M96: 2 | N96: 18650 | O96: of:=(VLOOKUP([.B96]; [.$L$95:.$M$98];2;1)) -> 2 | P96: of:=(VLOOKUP([.C96]; [.$L$95:.$M$98];2;1)) -> 2 | Q96: of:=(VLOOKUP([.D96]; [.$L$95:.$M$98];2;1)) -> 2 | R96: of:=(VLOOKUP([.E96]; [.$L$95:.$M$98];2;1)) -> 4 | S96: of:=(VLOOKUP([.F96]; [.$L$95:.$M$98];2;1)) -> 3 | T96: of:=(VLOOKUP([.G96]; [.$L$95:.$M$98];2;1)) -> 2 | U96: of:=(VLOOKUP([.H96]; [.$L$95:.$M$98];2;1)) -> 2 | V96: of:=(VLOOKUP([.I96]; [.$L$95:.$M$98];2;1)) -> 2 | W96: of:=(VLOOKUP([.J96]; [.$L$95:.$M$98];2;1)) -> 3 | X96: of:=(VLOOKUP([.K96]; [.$L$95:.$M$98];2;1)) -> 2
A97: LFP-HE | B97: of:=[.$B$92]/([.B85]+[.$B$92]) -> 0.750808015513898 | C97: of:=[.$B$92]/([.C85]+[.$B$92]) -> 0.811670160726764 | D97: of:=[.$B$92]/([.D85]+[.$B$92]) -> 0.811528384279476 | E97: of:=[.$B$92]/([.E85]+[.$B$92]) -> 0.917094354520332 | F97: of:=(11*[.$B$92])/([.F85]+(11*[.$B$92])) -> 0.777833584463419 | G97: of:=[.$E$92]/([.G85]+[.$E$92]) -> 0.664066751315073 | H97: of:=[.$E$92]/([.H85]+[.$E$92]) -> 0.772525849335303 | I97: of:=[.$E$92]/([.I85]+[.$E$92]) -> 0.772362869198312 | J97: of:=[.$E$92]/([.J85]+[.$E$92]) -> 0.897084048027444 | K97: of:=(11*[.$E$92])/([.K85]+(11*[.$E$92])) -> 0.701206665389772 | L97: 0.75 | M97: 3 | N97: LFP-HE | O97: of:=(VLOOKUP([.B97]; [.$L$95:.$M$98];2;1)) -> 3 | P97: of:=(VLOOKUP([.C97]; [.$L$95:.$M$98];2;1)) -> 3 | Q97: of:=(VLOOKUP([.D97]; [.$L$95:.$M$98];2;1)) -> 3 | R97: of:=(VLOOKUP([.E97]; [.$L$95:.$M$98];2;1)) -> 4 | S97: of:=(VLOOKUP([.F97]; [.$L$95:.$M$98];2;1)) -> 3 | T97: of:=(VLOOKUP([.G97]; [.$L$95:.$M$98];2;1)) -> 2 | U97: of:=(VLOOKUP([.H97]; [.$L$95:.$M$98];2;1)) -> 3 | V97: of:=(VLOOKUP([.I97]; [.$L$95:.$M$98];2;1)) -> 3 | W97: of:=(VLOOKUP([.J97]; [.$L$95:.$M$98];2;1)) -> 3 | X97: of:=(VLOOKUP([.K97]; [.$L$95:.$M$98];2;1)) -> 2
A98: LFP-HP | B98: of:=[.$B$92]/([.B86]+[.$B$92]) -> 0.678743608473338 | C98: of:=[.$B$92]/([.C86]+[.$B$92]) -> 0.683939349330193 | D98: of:=[.$B$92]/([.D86]+[.$B$92]) -> 0.683838681189285 | E98: of:=[.$B$92]/([.E86]+[.$B$92]) -> 0.917094354520332 | F98: of:=(11*[.$B$92])/([.F86]+(11*[.$B$92])) -> 0.737109313025543 | G98: of:=[.$E$92]/([.G86]+[.$E$92]) -> 0.624957323318539 | H98: of:=[.$E$92]/([.H86]+[.$E$92]) -> 0.630554598691009 | I98: of:=[.$E$92]/([.I86]+[.$E$92]) -> 0.630337465564738 | J98: of:=[.$E$92]/([.J86]+[.$E$92]) -> 0.897084048027444 | K98: of:=(11*[.$E$92])/([.K86]+(11*[.$E$92])) -> 0.658012123984902 | L98: 0.9 | M98: 4 | N98: LFP-HP | O98: of:=(VLOOKUP([.B98]; [.$L$95:.$M$98];2;1)) -> 2 | P98: of:=(VLOOKUP([.C98]; [.$L$95:.$M$98];2;1)) -> 2 | Q98: of:=(VLOOKUP([.D98]; [.$L$95:.$M$98];2;1)) -> 2 | R98: of:=(VLOOKUP([.E98]; [.$L$95:.$M$98];2;1)) -> 4 | S98: of:=(VLOOKUP([.F98]; [.$L$95:.$M$98];2;1)) -> 2 | T98: of:=(VLOOKUP([.G98]; [.$L$95:.$M$98];2;1)) -> 2 | U98: of:=(VLOOKUP([.H98]; [.$L$95:.$M$98];2;1)) -> 2 | V98: of:=(VLOOKUP([.I98]; [.$L$95:.$M$98];2;1)) -> 2 | W98: of:=(VLOOKUP([.J98]; [.$L$95:.$M$98];2;1)) -> 3 | X98: of:=(VLOOKUP([.K98]; [.$L$95:.$M$98];2;1)) -> 2
A99: LiTiO | B99: of:=[.$B$92]/([.B87]+[.$B$92]) -> 0.763140604467806 | C99: of:=[.$B$92]/([.C87]+[.$B$92]) -> 0.9047711781889 | D99: of:=[.$B$92]/([.D87]+[.$B$92]) -> 0.904595015576324 | E99: of:=[.$B$92]/([.E87]+[.$B$92]) -> 0.917094354520332 | F99: of:=(11*[.$B$92])/([.F87]+(11*[.$B$92])) -> 0.74424768451098 | G99: of:=[.$E$92]/([.G87]+[.$E$92]) -> 0.682385834109972 | H99: of:=[.$E$92]/([.H87]+[.$E$92]) -> 0.882168674698795 | I99: of:=[.$E$92]/([.I87]+[.$E$92]) -> 0.881956155143339 | J99: of:=[.$E$92]/([.J87]+[.$E$92]) -> 0.897084048027444 | K99: of:=(11*[.$E$92])/([.K87]+(11*[.$E$92])) -> 0.66583446314606 | L99: Gewichtung | M99: 15 | N99: LiTiO | O99: of:=(VLOOKUP([.B99]; [.$L$95:.$M$98];2;1)) -> 3 | P99: of:=(VLOOKUP([.C99]; [.$L$95:.$M$98];2;1)) -> 4 | Q99: of:=(VLOOKUP([.D99]; [.$L$95:.$M$98];2;1)) -> 4 | R99: of:=(VLOOKUP([.E99]; [.$L$95:.$M$98];2;1)) -> 4 | S99: of:=(VLOOKUP([.F99]; [.$L$95:.$M$98];2;1)) -> 2 | T99: of:=(VLOOKUP([.G99]; [.$L$95:.$M$98];2;1)) -> 2 | U99: of:=(VLOOKUP([.H99]; [.$L$95:.$M$98];2;1)) -> 3 | V99: of:=(VLOOKUP([.I99]; [.$L$95:.$M$98];2;1)) -> 3 | W99: of:=(VLOOKUP([.J99]; [.$L$95:.$M$98];2;1)) -> 3 | X99: of:=(VLOOKUP([.K99]; [.$L$95:.$M$98];2;1)) -> 2
A100: Mittelwert | B100: of:=AVERAGE([.B96:.K99]) -> 0.759288042597284 | N100: Mittelwert | O100: of:=AVERAGE([.O96:.X99]) -> 2.65
A101: Min | B101: of:=MIN([.B96:.K99]) -> 0.614055686011406 | N101: Min | O101: of:=MIN([.O96:.X99]) -> 2
A102: Max | B102: of:=MAX([.B96:.K99]) -> 0.917094354520332 | N102: Max | O102: of:=MAX([.O96:.X99]) -> 4
B104: Freiheitsgrade | L104: Punktezuordnung FHG | O104: Punkte Winkel
B105: 204 Opportunity | F105: 204 Overnight | G105: 192 Opportunity | K105: 192 Overnight | L105: Wert | M105: Punkte | O105: 204 Opportunity | S105: 204 Overnight | T105: 192 Opportunity | X105: 192 Overnight
B106: 40kW | C106: 375kW | D106: 200kW | E106: Swap | F106: 40kW | G106: 40kW | H106: 375kW | I106: 200kW | J106: Swap | K106: 40kW | L106: 0 | M106: 4 | O106: 40kW | P106: 375kW | Q106: 200kW | R106: Swap | S106: 40kW | T106: 40kW | U106: 375kW | V106: 200kW | W106: Swap | X106: 40kW
B107: 0 | C107: 3 | D107: 1 | E107: 4 | F107: of:=[.B107] -> 0 | G107: of:=[.B107] -> 0 | H107: of:=[.C107] -> 3 | I107: of:=[.D107] -> 1 | J107: of:=[.E107] -> 4 | K107: of:=[.F107] -> 0 | L107: 1 | M107: 3 | N107: 18650 | O107: of:=(VLOOKUP([.B108]; [.$L$106:.$M$109];2;1)) -> 4 | P107: of:=(VLOOKUP([.C108]; [.$L$106:.$M$109];2;1)) -> 1 | Q107: of:=(VLOOKUP([.D108]; [.$L$106:.$M$109];2;1)) -> 3 | R107: of:=(VLOOKUP([.E108]; [.$L$106:.$M$109];2;1)) -> 1 | S107: of:=(VLOOKUP([.F108]; [.$L$106:.$M$109];2;1)) -> 4 | T107: of:=(VLOOKUP([.G108]; [.$L$106:.$M$109];2;1)) -> 4 | U107: of:=(VLOOKUP([.H108]; [.$L$106:.$M$109];2;1)) -> 1 | V107: of:=(VLOOKUP([.I108]; [.$L$106:.$M$109];2;1)) -> 3 | W107: of:=(VLOOKUP([.J108]; [.$L$106:.$M$109];2;1)) -> 1 | X107: of:=(VLOOKUP([.K108]; [.$L$106:.$M$109];2;1)) -> 4
A108: 18650 | B108: of:=[.B$107] -> 0 | C108: of:=[.C$107] -> 3 | D108: of:=[.D$107] -> 1 | E108: of:=[.E$107] -> 4 | F108: of:=[.F$107] -> 0 | G108: of:=[.G$107] -> 0 | H108: of:=[.H$107] -> 3 | I108: of:=[.I$107] -> 1 | J108: of:=[.J$107] -> 4 | K108: of:=[.K$107] -> 0 | L108: 2 | M108: 2 | N108: LFP-HE | O108: of:=(VLOOKUP([.B109]; [.$L$106:.$M$109];2;1)) -> 4 | P108: of:=(VLOOKUP([.C109]; [.$L$106:.$M$109];2;1)) -> 1 | Q108: of:=(VLOOKUP([.D109]; [.$L$106:.$M$109];2;1)) -> 3 | R108: of:=(VLOOKUP([.E109]; [.$L$106:.$M$109];2;1)) -> 1 | S108: of:=(VLOOKUP([.F109]; [.$L$106:.$M$109];2;1)) -> 4 | T108: of:=(VLOOKUP([.G109]; [.$L$106:.$M$109];2;1)) -> 4 | U108: of:=(VLOOKUP([.H109]; [.$L$106:.$M$109];2;1)) -> 1 | V108: of:=(VLOOKUP([.I109]; [.$L$106:.$M$109];2;1)) -> 3 | W108: of:=(VLOOKUP([.J109]; [.$L$106:.$M$109];2;1)) -> 1 | X108: of:=(VLOOKUP([.K109]; [.$L$106:.$M$109];2;1)) -> 4
A109: LFP-HE | B109: of:=[.B$107] -> 0 | C109: of:=[.C$107] -> 3 | D109: of:=[.D$107] -> 1 | E109: of:=[.E$107] -> 4 | F109: of:=[.F$107] -> 0 | G109: of:=[.G$107] -> 0 | H109: of:=[.H$107] -> 3 | I109: of:=[.I$107] -> 1 | J109: of:=[.J$107] -> 4 | K109: of:=[.K$107] -> 0 | L109: 3 | M109: 1 | N109: LFP-HP | O109: of:=(VLOOKUP([.B110]; [.$L$106:.$M$109];2;1)) -> 4 | P109: of:=(VLOOKUP([.C110]; [.$L$106:.$M$109];2;1)) -> 1 | Q109: of:=(VLOOKUP([.D110]; [.$L$106:.$M$109];2;1)) -> 3 | R109: of:=(VLOOKUP([.E110]; [.$L$106:.$M$109];2;1)) -> 1 | S109: of:=(VLOOKUP([.F110]; [.$L$106:.$M$109];2;1)) -> 4 | T109: of:=(VLOOKUP([.G110]; [.$L$106:.$M$109];2;1)) -> 4 | U109: of:=(VLOOKUP([.H110]; [.$L$106:.$M$109];2;1)) -> 1 | V109: of:=(VLOOKUP([.I110]; [.$L$106:.$M$109];2;1)) -> 3 | W109: of:=(VLOOKUP([.J110]; [.$L$106:.$M$109];2;1)) -> 1 | X109: of:=(VLOOKUP([.K110]; [.$L$106:.$M$109];2;1)) -> 4
A110: LFP-HP | B110: of:=[.B$107] -> 0 | C110: of:=[.C$107] -> 3 | D110: of:=[.D$107] -> 1 | E110: of:=[.E$107] -> 4 | F110: of:=[.F$107] -> 0 | G110: of:=[.G$107] -> 0 | H110: of:=[.H$107] -> 3 | I110: of:=[.I$107] -> 1 | J110: of:=[.J$107] -> 4 | K110: of:=[.K$107] -> 0 | L110: Gewichtung | M110: 4 | N110: LiTiO | O110: of:=(VLOOKUP([.B111]; [.$L$106:.$M$109];2;1)) -> 4 | P110: of:=(VLOOKUP([.C111]; [.$L$106:.$M$109];2;1)) -> 1 | Q110: of:=(VLOOKUP([.D111]; [.$L$106:.$M$109];2;1)) -> 3 | R110: of:=(VLOOKUP([.E111]; [.$L$106:.$M$109];2;1)) -> 1 | S110: of:=(VLOOKUP([.F111]; [.$L$106:.$M$109];2;1)) -> 4 | T110: of:=(VLOOKUP([.G111]; [.$L$106:.$M$109];2;1)) -> 4 | U110: of:=(VLOOKUP([.H111]; [.$L$106:.$M$109];2;1)) -> 1 | V110: of:=(VLOOKUP([.I111]; [.$L$106:.$M$109];2;1)) -> 3 | W110: of:=(VLOOKUP([.J111]; [.$L$106:.$M$109];2;1)) -> 1 | X110: of:=(VLOOKUP([.K111]; [.$L$106:.$M$109];2;1)) -> 4
A111: LiTiO | B111: of:=[.B$107] -> 0 | C111: of:=[.C$107] -> 3 | D111: of:=[.D$107] -> 1 | E111: of:=[.E$107] -> 4 | F111: of:=[.F$107] -> 0 | G111: of:=[.G$107] -> 0 | H111: of:=[.H$107] -> 3 | I111: of:=[.I$107] -> 1 | J111: of:=[.J$107] -> 4 | K111: of:=[.K$107] -> 0 | N111: Mittelwert | O111: of:=AVERAGE([.O107:.X110]) -> 2.6
A112: Mittelwert | B112: of:=AVERAGE([.B108:.K111]) -> 1.6 | N112: Min | O112: of:=MIN([.O107:.X110]) -> 1
A113: Min | B113: of:=MIN([.B108:.K111]) -> 0 | N113: Max | O113: of:=MAX([.O107:.X110]) -> 4
A114: Max | B114: of:=MAX([.B108:.K111]) -> 4
B116: Zugänglichkeit Fahrzeug | L116: Punktezuordnung Z-FZG | O116: Punkte Zugänglichekti Fzg
B117: 204 Opportunity | F117: 204 Overnight | G117: 192 Opportunity | K117: 192 Overnight | L117: Wert | M117: Punkte | O117: 204 Opportunity | S117: 204 Overnight | T117: 192 Opportunity | X117: 192 Overnight
B118: 40kW | C118: 375kW | D118: 200kW | E118: Swap | F118: 40kW | G118: 40kW | H118: 375kW | I118: 200kW | J118: Swap | K118: 40kW | L118: dach | M118: 4 | O118: 40kW | P118: 375kW | Q118: 200kW | R118: Swap | S118: 40kW | T118: 40kW | U118: 375kW | V118: 200kW | W118: Swap | X118: 40kW
B119: seite | C119: dach | D119: unten | E119: seite | F119: seite | G119: of:=[.B119] -> seite | H119: of:=[.C119] -> dach | I119: of:=[.D119] -> unten | J119: of:=[.E119] -> seite | K119: of:=[.F119] -> seite | L119: unten | M119: 3 | N119: 18650 | O119: of:=(VLOOKUP([.B120]; [.$L$118:.$M$120];2;0)) -> 2 | P119: of:=(VLOOKUP([.D120]; [.$L$118:.$M$120];2;0)) -> 3 | Q119: of:=(VLOOKUP([.D120]; [.$L$118:.$M$120];2;0)) -> 3 | R119: of:=(VLOOKUP([.E120]; [.$L$118:.$M$120];2;0)) -> 2 | S119: of:=(VLOOKUP([.F120]; [.$L$118:.$M$120];2;0)) -> 2 | T119: of:=(VLOOKUP([.G120]; [.$L$118:.$M$120];2;0)) -> 2 | U119: of:=(VLOOKUP([.H120]; [.$L$118:.$M$120];2;0)) -> 4 | V119: of:=(VLOOKUP([.I120]; [.$L$118:.$M$120];2;0)) -> 3 | W119: of:=(VLOOKUP([.J120]; [.$L$118:.$M$120];2;0)) -> 2 | X119: of:=(VLOOKUP([.K120]; [.$L$118:.$M$120];2;0)) -> 2
A120: 18650 | B120: seite | C120: dach | D120: unten | E120: seite | F120: seite | G120: of:=[.B120] -> seite | H120: of:=[.C120] -> dach | I120: of:=[.D120] -> unten | J120: of:=[.E120] -> seite | K120: of:=[.F120] -> seite | L120: seite | M120: 2 | N120: LFP-HE | O120: of:=(VLOOKUP([.B121]; [.$L$118:.$M$120];2;0)) -> 2 | P120: of:=(VLOOKUP([.D121]; [.$L$118:.$M$120];2;0)) -> 3 | Q120: of:=(VLOOKUP([.D121]; [.$L$118:.$M$120];2;0)) -> 3 | R120: of:=(VLOOKUP([.E121]; [.$L$118:.$M$120];2;0)) -> 2 | S120: of:=(VLOOKUP([.F121]; [.$L$118:.$M$120];2;0)) -> 2 | T120: of:=(VLOOKUP([.G121]; [.$L$118:.$M$120];2;0)) -> 2 | U120: of:=(VLOOKUP([.H121]; [.$L$118:.$M$120];2;0)) -> 4 | V120: of:=(VLOOKUP([.I121]; [.$L$118:.$M$120];2;0)) -> 3 | W120: of:=(VLOOKUP([.J121]; [.$L$118:.$M$120];2;0)) -> 2 | X120: of:=(VLOOKUP([.K121]; [.$L$118:.$M$120];2;0)) -> 2
A121: LFP-HE | B121: seite | C121: dach | D121: unten | E121: seite | F121: seite | G121: of:=[.B121] -> seite | H121: of:=[.C121] -> dach | I121: of:=[.D121] -> unten | J121: of:=[.E121] -> seite | K121: of:=[.F121] -> seite | M121: 1 | N121: LFP-HP | O121: of:=(VLOOKUP([.B122]; [.$L$118:.$M$120];2;0)) -> 2 | P121: of:=(VLOOKUP([.D122]; [.$L$118:.$M$120];2;0)) -> 3 | Q121: of:=(VLOOKUP([.D122]; [.$L$118:.$M$120];2;0)) -> 3 | R121: of:=(VLOOKUP([.E122]; [.$L$118:.$M$120];2;0)) -> 2 | S121: of:=(VLOOKUP([.F122]; [.$L$118:.$M$120];2;0)) -> 2 | T121: of:=(VLOOKUP([.G122]; [.$L$118:.$M$120];2;0)) -> 2 | U121: of:=(VLOOKUP([.H122]; [.$L$118:.$M$120];2;0)) -> 4 | V121: of:=(VLOOKUP([.I122]; [.$L$118:.$M$120];2;0)) -> 3 | W121: of:=(VLOOKUP([.J122]; [.$L$118:.$M$120];2;0)) -> 2 | X121: of:=(VLOOKUP([.K122]; [.$L$118:.$M$120];2;0)) -> 2
A122: LFP-HP | B122: seite | C122: dach | D122: unten | E122: seite | F122: seite | G122: of:=[.B122] -> seite | H122: of:=[.C122] -> dach | I122: of:=[.D122] -> unten | J122: of:=[.E122] -> seite | K122: of:=[.F122] -> seite | L122: Gewichtung | M122: 3 | N122: LiTiO | O122: of:=(VLOOKUP([.B123]; [.$L$118:.$M$120];2;0)) -> 2 | P122: of:=(VLOOKUP([.D123]; [.$L$118:.$M$120];2;0)) -> 3 | Q122: of:=(VLOOKUP([.D123]; [.$L$118:.$M$120];2;0)) -> 3 | R122: of:=(VLOOKUP([.E123]; [.$L$118:.$M$120];2;0)) -> 2 | S122: of:=(VLOOKUP([.F123]; [.$L$118:.$M$120];2;0)) -> 2 | T122: of:=(VLOOKUP([.G123]; [.$L$118:.$M$120];2;0)) -> 2 | U122: of:=(VLOOKUP([.H123]; [.$L$118:.$M$120];2;0)) -> 4 | V122: of:=(VLOOKUP([.I123]; [.$L$118:.$M$120];2;0)) -> 3 | W122: of:=(VLOOKUP([.J123]; [.$L$118:.$M$120];2;0)) -> 2 | X122: of:=(VLOOKUP([.K123]; [.$L$118:.$M$120];2;0)) -> 2
A123: LiTiO | B123: seite | C123: dach | D123: unten | E123: seite | F123: seite | G123: of:=[.B123] -> seite | H123: of:=[.C123] -> dach | I123: of:=[.D123] -> unten | J123: of:=[.E123] -> seite | K123: of:=[.F123] -> seite | N123: Mittelwert | O123: of:=AVERAGE([.O119:.X122]) -> 2.5
A124: Mittelwert | B124: of:=AVERAGE([.B120:.K123]) ->  | N124: Min | O124: of:=MIN([.O119:.X122]) -> 2
A125: Min | B125: of:=MIN([.B120:.K123]) -> 0 | N125: Max | O125: of:=MAX([.O119:.X122]) -> 4
A126: Max | B126: of:=MAX([.B120:.K123]) -> 0
B128: Exponierte Leiter | L128: Punktezuordnung expLeiter | O128: Punkte exponierte Leiter
B129: 204 Opportunity | F129: 204 Overnight | G129: 192 Opportunity | K129: 192 Overnight | L129: Wert | M129: Punkte | O129: 204 Opportunity | S129: 204 Overnight | T129: 192 Opportunity | X129: 192 Overnight
B130: 40kW | C130: 375kW | D130: 200kW | E130: Swap | F130: 40kW | G130: 40kW | H130: 375kW | I130: 200kW | J130: Swap | K130: 40kW | L130: nie | M130: 4 | O130: 40kW | P130: 375kW | Q130: 200kW | R130: Swap | S130: 40kW | T130: 40kW | U130: 375kW | V130: 200kW | W130: Swap | X130: 40kW
B131: nie | C131: nurLaden | D131: nie | E131: nie | F131: of:=[.B131] -> nie | G131: of:=[.B131] -> nie | H131: of:=[.C131] -> nurLaden | I131: of:=[.D131] -> nie | J131: of:=[.E131] -> nie | K131: of:=[.F131] -> nie | L131: nurLaden | M131: 3 | N131: 18650 | O131: of:=(VLOOKUP([.B132]; [.$L$130:.$M$132];2;0)) -> 4 | P131: of:=(VLOOKUP([.C132]; [.$L$130:.$M$132];2;0)) -> 3 | Q131: of:=(VLOOKUP([.C132]; [.$L$130:.$M$132];2;0)) -> 3 | R131: of:=(VLOOKUP([.E132]; [.$L$130:.$M$132];2;0)) -> 4 | S131: of:=(VLOOKUP([.F132]; [.$L$130:.$M$132];2;0)) -> 4 | T131: of:=(VLOOKUP([.G132]; [.$L$130:.$M$132];2;0)) -> 4 | U131: of:=(VLOOKUP([.H132]; [.$L$130:.$M$132];2;0)) -> 3 | V131: of:=(VLOOKUP([.I132]; [.$L$130:.$M$132];2;0)) -> 4 | W131: of:=(VLOOKUP([.J132]; [.$L$130:.$M$132];2;0)) -> 4 | X131: of:=(VLOOKUP([.K132]; [.$L$130:.$M$132];2;0)) -> 4
A132: 18650 | B132: nie | C132: nurLaden | D132: nie | E132: nie | F132: of:=[.B132] -> nie | G132: of:=[.B132] -> nie | H132: of:=[.C132] -> nurLaden | I132: of:=[.D132] -> nie | J132: of:=[.E132] -> nie | K132: of:=[.F132] -> nie | L132: immer | M132: 1 | N132: LFP-HE | O132: of:=(VLOOKUP([.B133]; [.$L$130:.$M$132];2;0)) -> 4 | P132: of:=(VLOOKUP([.C133]; [.$L$130:.$M$132];2;0)) -> 3 | Q132: of:=(VLOOKUP([.C133]; [.$L$130:.$M$132];2;0)) -> 3 | R132: of:=(VLOOKUP([.E133]; [.$L$130:.$M$132];2;0)) -> 4 | S132: of:=(VLOOKUP([.F133]; [.$L$130:.$M$132];2;0)) -> 4 | T132: of:=(VLOOKUP([.G133]; [.$L$130:.$M$132];2;0)) -> 4 | U132: of:=(VLOOKUP([.H133]; [.$L$130:.$M$132];2;0)) -> 3 | V132: of:=(VLOOKUP([.I133]; [.$L$130:.$M$132];2;0)) -> 4 | W132: of:=(VLOOKUP([.J133]; [.$L$130:.$M$132];2;0)) -> 4 | X132: of:=(VLOOKUP([.K133]; [.$L$130:.$M$132];2;0)) -> 4
A133: LFP-HE | B133: nie | C133: nurLaden | D133: nie | E133: nie | F133: of:=[.B133] -> nie | G133: of:=[.B133] -> nie | H133: of:=[.C133] -> nurLaden | I133: of:=[.D133] -> nie | J133: of:=[.E133] -> nie | K133: of:=[.F133] -> nie | L133: Gewichtung | M133: 5 | N133: LFP-HP | O133: of:=(VLOOKUP([.B134]; [.$L$130:.$M$132];2;0)) -> 4 | P133: of:=(VLOOKUP([.C134]; [.$L$130:.$M$132];2;0)) -> 3 | Q133: of:=(VLOOKUP([.C134]; [.$L$130:.$M$132];2;0)) -> 3 | R133: of:=(VLOOKUP([.E134]; [.$L$130:.$M$132];2;0)) -> 4 | S133: of:=(VLOOKUP([.F134]; [.$L$130:.$M$132];2;0)) -> 4 | T133: of:=(VLOOKUP([.G134]; [.$L$130:.$M$132];2;0)) -> 4 | U133: of:=(VLOOKUP([.H134]; [.$L$130:.$M$132];2;0)) -> 3 | V133: of:=(VLOOKUP([.I134]; [.$L$130:.$M$132];2;0)) -> 4 | W133: of:=(VLOOKUP([.J134]; [.$L$130:.$M$132];2;0)) -> 4 | X133: of:=(VLOOKUP([.K134]; [.$L$130:.$M$132];2;0)) -> 4
A134: LFP-HP | B134: nie | C134: nurLaden | D134: nie | E134: nie | F134: of:=[.B134] -> nie | G134: of:=[.B134] -> nie | H134: of:=[.C134] -> nurLaden | I134: of:=[.D134] -> nie | J134: of:=[.E134] -> nie | K134: of:=[.F134] -> nie | N134: LiTiO | O134: of:=(VLOOKUP([.B135]; [.$L$130:.$M$132];2;0)) -> 4 | P134: of:=(VLOOKUP([.C135]; [.$L$130:.$M$132];2;0)) -> 3 | Q134: of:=(VLOOKUP([.C135]; [.$L$130:.$M$132];2;0)) -> 3 | R134: of:=(VLOOKUP([.E135]; [.$L$130:.$M$132];2;0)) -> 4 | S134: of:=(VLOOKUP([.F135]; [.$L$130:.$M$132];2;0)) -> 4 | T134: of:=(VLOOKUP([.G135]; [.$L$130:.$M$132];2;0)) -> 4 | U134: of:=(VLOOKUP([.H135]; [.$L$130:.$M$132];2;0)) -> 3 | V134: of:=(VLOOKUP([.I135]; [.$L$130:.$M$132];2;0)) -> 4 | W134: of:=(VLOOKUP([.J135]; [.$L$130:.$M$132];2;0)) -> 4 | X134: of:=(VLOOKUP([.K135]; [.$L$130:.$M$132];2;0)) -> 4
A135: LiTiO | B135: nie | C135: nurLaden | D135: nie | E135: nie | F135: of:=[.B135] -> nie | G135: of:=[.B135] -> nie | H135: of:=[.C135] -> nurLaden | I135: of:=[.D135] -> nie | J135: of:=[.E135] -> nie | K135: of:=[.F135] -> nie | N135: Mittelwert | O135: of:=AVERAGE([.O131:.X134]) -> 3.7
A136: Mittelwert | B136: of:=AVERAGE([.B132:.K135]) ->  | N136: Min | O136: of:=MIN([.O131:.X134]) -> 3
A137: Min | B137: of:=MIN([.B132:.K135]) -> 0 | N137: Max | O137: of:=MAX([.O131:.X134]) -> 4
A138: Max | B138: of:=MAX([.B132:.K135]) -> 0
B140: Zugänglihckeit Ladestaion | L140: Punktezuordnung zugLade | O140: Punte Zuänglichkeit Ladestation
B141: 204 Opportunity | F141: 204 Overnight | G141: 192 Opportunity | K141: 192 Overnight | L141: Wert | M141: Punkte | O141: 204 Opportunity | S141: 204 Overnight | T141: 192 Opportunity | X141: 192 Overnight
B142: 40kW | C142: 375kW | D142: 200kW | E142: Swap | F142: 40kW | G142: 40kW | H142: 375kW | I142: 200kW | J142: Swap | K142: 40kW | L142: unzugänglich | M142: 4 | O142: 40kW | P142: 375kW | Q142: 200kW | R142: Swap | S142: 40kW | T142: 40kW | U142: 375kW | V142: 200kW | W142: Swap | X142: 40kW
B143: ebenerdig | C143: erhöht | D143: unterflur | E143: unzugänglich | F143: of:=[.B143] -> ebenerdig | G143: of:=[.B143] -> ebenerdig | H143: of:=[.C143] -> erhöht | I143: of:=[.D143] -> unterflur | J143: of:=[.E143] -> unzugänglich | K143: of:=[.F143] -> ebenerdig | L143: unterflur | M143: 3 | N143: 18650 | O143: of:=(VLOOKUP([.B144]; [.$L$142:.$M$145];2;0)) -> 1 | P143: of:=(VLOOKUP([.C144]; [.$L$142:.$M$145];2;0)) -> 2 | Q143: of:=(VLOOKUP([.D144]; [.$L$142:.$M$145];2;0)) -> 3 | R143: of:=(VLOOKUP([.E144]; [.$L$142:.$M$145];2;0)) -> 4 | S143: of:=(VLOOKUP([.F144]; [.$L$142:.$M$145];2;0)) -> 1 | T143: of:=(VLOOKUP([.G144]; [.$L$142:.$M$145];2;0)) -> 1 | U143: of:=(VLOOKUP([.H144]; [.$L$142:.$M$145];2;0)) -> 2 | V143: of:=(VLOOKUP([.I144]; [.$L$142:.$M$145];2;0)) -> 3 | W143: of:=(VLOOKUP([.J144]; [.$L$142:.$M$145];2;0)) -> 4 | X143: of:=(VLOOKUP([.K144]; [.$L$142:.$M$145];2;0)) -> 1
A144: 18650 | B144: ebenerdig | C144: erhöht | D144: unterflur | E144: unzugänglich | F144: of:=[.B144] -> ebenerdig | G144: of:=[.B144] -> ebenerdig | H144: of:=[.C144] -> erhöht | I144: of:=[.D144] -> unterflur | J144: of:=[.E144] -> unzugänglich | K144: of:=[.F144] -> ebenerdig | L144: erhöht | M144: 2 | N144: LFP-HE | O144: of:=(VLOOKUP([.B145]; [.$L$142:.$M$145];2;0)) -> 1 | P144: of:=(VLOOKUP([.C145]; [.$L$142:.$M$145];2;0)) -> 2 | Q144: of:=(VLOOKUP([.D145]; [.$L$142:.$M$145];2;0)) -> 3 | R144: of:=(VLOOKUP([.E145]; [.$L$142:.$M$145];2;0)) -> 4 | S144: of:=(VLOOKUP([.F145]; [.$L$142:.$M$145];2;0)) -> 1 | T144: of:=(VLOOKUP([.G145]; [.$L$142:.$M$145];2;0)) -> 1 | U144: of:=(VLOOKUP([.H145]; [.$L$142:.$M$145];2;0)) -> 2 | V144: of:=(VLOOKUP([.I145]; [.$L$142:.$M$145];2;0)) -> 3 | W144: of:=(VLOOKUP([.J145]; [.$L$142:.$M$145];2;0)) -> 4 | X144: of:=(VLOOKUP([.K145]; [.$L$142:.$M$145];2;0)) -> 1
A145: LFP-HE | B145: ebenerdig | C145: erhöht | D145: unterflur | E145: unzugänglich | F145: of:=[.B145] -> ebenerdig | G145: of:=[.B145] -> ebenerdig | H145: of:=[.C145] -> erhöht | I145: of:=[.D145] -> unterflur | J145: of:=[.E145] -> unzugänglich | K145: of:=[.F145] -> ebenerdig | L145: ebenerdig | M145: 1 | N145: LFP-HP | O145: of:=(VLOOKUP([.B146]; [.$L$142:.$M$145];2;0)) -> 1 | P145: of:=(VLOOKUP([.C146]; [.$L$142:.$M$145];2;0)) -> 2 | Q145: of:=(VLOOKUP([.D146]; [.$L$142:.$M$145];2;0)) -> 3 | R145: of:=(VLOOKUP([.E146]; [.$L$142:.$M$145];2;0)) -> 4 | S145: of:=(VLOOKUP([.F146]; [.$L$142:.$M$145];2;0)) -> 1 | T145: of:=(VLOOKUP([.G146]; [.$L$142:.$M$145];2;0)) -> 1 | U145: of:=(VLOOKUP([.H146]; [.$L$142:.$M$145];2;0)) -> 2 | V145: of:=(VLOOKUP([.I146]; [.$L$142:.$M$145];2;0)) -> 3 | W145: of:=(VLOOKUP([.J146]; [.$L$142:.$M$145];2;0)) -> 4 | X145: of:=(VLOOKUP([.K146]; [.$L$142:.$M$145];2;0)) -> 1
A146: LFP-HP | B146: ebenerdig | C146: erhöht | D146: unterflur | E146: unzugänglich | F146: of:=[.B146] -> ebenerdig | G146: of:=[.B146] -> ebenerdig | H146: of:=[.C146] -> erhöht | I146: of:=[.D146] -> unterflur | J146: of:=[.E146] -> unzugänglich | K146: of:=[.F146] -> ebenerdig | L146: Gewichtung | M146: 5 | N146: LiTiO | O146: of:=(VLOOKUP([.B147]; [.$L$142:.$M$145];2;0)) -> 1 | P146: of:=(VLOOKUP([.C147]; [.$L$142:.$M$145];2;0)) -> 2 | Q146: of:=(VLOOKUP([.D147]; [.$L$142:.$M$145];2;0)) -> 3 | R146: of:=(VLOOKUP([.E147]; [.$L$142:.$M$145];2;0)) -> 4 | S146: of:=(VLOOKUP([.F147]; [.$L$142:.$M$145];2;0)) -> 1 | T146: of:=(VLOOKUP([.G147]; [.$L$142:.$M$145];2;0)) -> 1 | U146: of:=(VLOOKUP([.H147]; [.$L$142:.$M$145];2;0)) -> 2 | V146: of:=(VLOOKUP([.I147]; [.$L$142:.$M$145];2;0)) -> 3 | W146: of:=(VLOOKUP([.J147]; [.$L$142:.$M$145];2;0)) -> 4 | X146: of:=(VLOOKUP([.K147]; [.$L$142:.$M$145];2;0)) -> 1
A147: LiTiO | B147: ebenerdig | C147: erhöht | D147: unterflur | E147: unzugänglich | F147: of:=[.B147] -> ebenerdig | G147: of:=[.B147] -> ebenerdig | H147: of:=[.C147] -> erhöht | I147: of:=[.D147] -> unterflur | J147: of:=[.E147] -> unzugänglich | K147: of:=[.F147] -> ebenerdig | N147: Mittelwert | O147: of:=AVERAGE([.O143:.X146]) -> 2.2
A148: Mittelwert | B148: of:=AVERAGE([.B144:.K147]) ->  | N148: Min | O148: of:=MIN([.O143:.X146]) -> 1
A149: Min | B149: of:=MIN([.B144:.K147]) -> 0 | N149: Max | O149: of:=MAX([.O143:.X146]) -> 4
A150: Max | B150: of:=MAX([.B144:.K147]) -> 0
B152: Volumen LS fest | L152: Punktezuordnung Vol LS fest | O152: Punkte Volumen LS fest
B153: 204 Opportunity | F153: 204 Overnight | G153: 192 Opportunity | K153: 192 Overnight | L153: Wert | M153: Punkte | O153: 204 Opportunity | S153: 204 Overnight | T153: 192 Opportunity | X153: 192 Overnight
B154: 40kW | C154: 375kW | D154: 200kW | E154: Swap | F154: 40kW | G154: 40kW | H154: 375kW | I154: 200kW | J154: Swap | K154: 40kW | L154: 0 | M154: 4 | O154: 40kW | P154: 375kW | Q154: 200kW | R154: Swap | S154: 40kW | T154: 40kW | U154: 375kW | V154: 200kW | W154: Swap | X154: 40kW
B155: 0 | C155: 1000 | D155: 1000 | E155: 0 | F155: of:=[.B155] -> 0 | G155: of:=[.B155] -> 0 | H155: of:=[.C155] -> 1000 | I155: of:=[.D155] -> 1000 | J155: of:=[.E155] -> 0 | K155: of:=[.F155] -> 0 | L155: 250 | M155: 3 | N155: 18650 | O155: of:=(VLOOKUP([.B156]; [.$L$154:.$M$157];2;1)) -> 4 | P155: of:=(VLOOKUP([.C156]; [.$L$154:.$M$157];2;1)) -> 1 | Q155: of:=(VLOOKUP([.D156]; [.$L$154:.$M$157];2;1)) -> 1 | R155: of:=(VLOOKUP([.E156]; [.$L$154:.$M$157];2;1)) -> 4 | S155: of:=(VLOOKUP([.F156]; [.$L$154:.$M$157];2;1)) -> 4 | T155: of:=(VLOOKUP([.G156]; [.$L$154:.$M$157];2;1)) -> 4 | U155: of:=(VLOOKUP([.H156]; [.$L$154:.$M$157];2;1)) -> 1 | V155: of:=(VLOOKUP([.I156]; [.$L$154:.$M$157];2;1)) -> 1 | W155: of:=(VLOOKUP([.J156]; [.$L$154:.$M$157];2;1)) -> 4 | X155: of:=(VLOOKUP([.K156]; [.$L$154:.$M$157];2;1)) -> 4
A156: 18650 | B156: of:=[.B$155] -> 0 | C156: of:=[.C$155] -> 1000 | D156: of:=[.D$155] -> 1000 | E156: of:=[.E$155] -> 0 | F156: of:=[.F$155] -> 0 | G156: of:=[.G$155] -> 0 | H156: of:=[.H$155] -> 1000 | I156: of:=[.I$155] -> 1000 | J156: of:=[.J$155] -> 0 | K156: of:=[.K$155] -> 0 | L156: 500 | M156: 2 | N156: LFP-HE | O156: of:=(VLOOKUP([.B157]; [.$L$154:.$M$157];2;1)) -> 4 | P156: of:=(VLOOKUP([.C157]; [.$L$154:.$M$157];2;1)) -> 1 | Q156: of:=(VLOOKUP([.D157]; [.$L$154:.$M$157];2;1)) -> 1 | R156: of:=(VLOOKUP([.E157]; [.$L$154:.$M$157];2;1)) -> 4 | S156: of:=(VLOOKUP([.F157]; [.$L$154:.$M$157];2;1)) -> 4 | T156: of:=(VLOOKUP([.G157]; [.$L$154:.$M$157];2;1)) -> 4 | U156: of:=(VLOOKUP([.H157]; [.$L$154:.$M$157];2;1)) -> 1 | V156: of:=(VLOOKUP([.I157]; [.$L$154:.$M$157];2;1)) -> 1 | W156: of:=(VLOOKUP([.J157]; [.$L$154:.$M$157];2;1)) -> 4 | X156: of:=(VLOOKUP([.K157]; [.$L$154:.$M$157];2;1)) -> 4
A157: LFP-HE | B157: of:=[.B$155] -> 0 | C157: of:=[.C$155] -> 1000 | D157: of:=[.D$155] -> 1000 | E157: of:=[.E$155] -> 0 | F157: of:=[.F$155] -> 0 | G157: of:=[.G$155] -> 0 | H157: of:=[.H$155] -> 1000 | I157: of:=[.I$155] -> 1000 | J157: of:=[.J$155] -> 0 | K157: of:=[.K$155] -> 0 | L157: 1000 | M157: 1 | N157: LFP-HP | O157: of:=(VLOOKUP([.B158]; [.$L$154:.$M$157];2;1)) -> 4 | P157: of:=(VLOOKUP([.C158]; [.$L$154:.$M$157];2;1)) -> 1 | Q157: of:=(VLOOKUP([.D158]; [.$L$154:.$M$157];2;1)) -> 1 | R157: of:=(VLOOKUP([.E158]; [.$L$154:.$M$157];2;1)) -> 4 | S157: of:=(VLOOKUP([.F158]; [.$L$154:.$M$157];2;1)) -> 4 | T157: of:=(VLOOKUP([.G158]; [.$L$154:.$M$157];2;1)) -> 4 | U157: of:=(VLOOKUP([.H158]; [.$L$154:.$M$157];2;1)) -> 1 | V157: of:=(VLOOKUP([.I158]; [.$L$154:.$M$157];2;1)) -> 1 | W157: of:=(VLOOKUP([.J158]; [.$L$154:.$M$157];2;1)) -> 4 | X157: of:=(VLOOKUP([.K158]; [.$L$154:.$M$157];2;1)) -> 4
A158: LFP-HP | B158: of:=[.B$155] -> 0 | C158: of:=[.C$155] -> 1000 | D158: of:=[.D$155] -> 1000 | E158: of:=[.E$155] -> 0 | F158: of:=[.F$155] -> 0 | G158: of:=[.G$155] -> 0 | H158: of:=[.H$155] -> 1000 | I158: of:=[.I$155] -> 1000 | J158: of:=[.J$155] -> 0 | K158: of:=[.K$155] -> 0 | L158: Gewichtung | M158: 10 | N158: LiTiO | O158: of:=(VLOOKUP([.B159]; [.$L$154:.$M$157];2;1)) -> 4 | P158: of:=(VLOOKUP([.C159]; [.$L$154:.$M$157];2;1)) -> 1 | Q158: of:=(VLOOKUP([.D159]; [.$L$154:.$M$157];2;1)) -> 1 | R158: of:=(VLOOKUP([.E159]; [.$L$154:.$M$157];2;1)) -> 4 | S158: of:=(VLOOKUP([.F159]; [.$L$154:.$M$157];2;1)) -> 4 | T158: of:=(VLOOKUP([.G159]; [.$L$154:.$M$157];2;1)) -> 4 | U158: of:=(VLOOKUP([.H159]; [.$L$154:.$M$157];2;1)) -> 1 | V158: of:=(VLOOKUP([.I159]; [.$L$154:.$M$157];2;1)) -> 1 | W158: of:=(VLOOKUP([.J159]; [.$L$154:.$M$157];2;1)) -> 4 | X158: of:=(VLOOKUP([.K159]; [.$L$154:.$M$157];2;1)) -> 4
A159: LiTiO | B159: of:=[.B$155] -> 0 | C159: of:=[.C$155] -> 1000 | D159: of:=[.D$155] -> 1000 | E159: of:=[.E$155] -> 0 | F159: of:=[.F$155] -> 0 | G159: of:=[.G$155] -> 0 | H159: of:=[.H$155] -> 1000 | I159: of:=[.I$155] -> 1000 | J159: of:=[.J$155] -> 0 | K159: of:=[.K$155] -> 0 | N159: Mittelwert | O159: of:=AVERAGE([.O155:.X158]) -> 2.8
A160: Mittelwert | B160: of:=AVERAGE([.B156:.K159]) -> 400 | N160: Min | O160: of:=MIN([.O155:.X158]) -> 1
A161: Min | B161: of:=MIN([.B156:.K159]) -> 0 | N161: Max | O161: of:=MAX([.O155:.X158]) -> 4
A162: Max | B162: of:=MAX([.B156:.K159]) -> 1000
B164: Energieverbrauch | L164: Punktezuordnung Energie | O164: Punkte Energie
B165: 204 Opportunity | F165: 204 Overnight | G165: 192 Opportunity | K165: 192 Overnight | L165: Wert | M165: Punkte | O165: 204 Opportunity | S165: 204 Overnight | T165: 192 Opportunity | X165: 192 Overnight
B166: 40kW | C166: 375kW | D166: 200kW | E166: Swap | F166: 40kW | G166: 40kW | H166: 375kW | I166: 200kW | J166: Swap | K166: 40kW | L166: 0 | M166: 4 | O166: 40kW | P166: 375kW | Q166: 200kW | R166: Swap | S166: 40kW | T166: 40kW | U166: 375kW | V166: 200kW | W166: Swap | X166: 40kW
A167: 18650 | B167: 1.453 | C167: 1.4562 | D167: 1.5275 | E167: 1.4497 | F167: 1.2055 | G167: 1.1552 | H167: 1.1581 | I167: 1.2161 | J167: 1.1523 | K167: 0.92738 | L167: 0.9 | M167: 3 | N167: 18650 | O167: of:=(VLOOKUP([.B167]; [.$L$166:.$M$169];2;1)) -> 2 | P167: of:=(VLOOKUP([.C167]; [.$L$166:.$M$169];2;1)) -> 2 | Q167: of:=(VLOOKUP([.D167]; [.$L$166:.$M$169];2;1)) -> 1 | R167: of:=(VLOOKUP([.E167]; [.$L$166:.$M$169];2;1)) -> 2 | S167: of:=(VLOOKUP([.F167]; [.$L$166:.$M$169];2;1)) -> 2 | T167: of:=(VLOOKUP([.G167]; [.$L$166:.$M$169];2;1)) -> 3 | U167: of:=(VLOOKUP([.H167]; [.$L$166:.$M$169];2;1)) -> 3 | V167: of:=(VLOOKUP([.I167]; [.$L$166:.$M$169];2;1)) -> 2 | W167: of:=(VLOOKUP([.J167]; [.$L$166:.$M$169];2;1)) -> 3 | X167: of:=(VLOOKUP([.K167]; [.$L$166:.$M$169];2;1)) -> 3
A168: LFP-HE | B168: 1.3112 | C168: 1.3273 | D168: 1.3916 | E168: 1.322 | F168: 1.1585 | G168: 1.0209 | H168: 1.0386 | I168: 1.0897 | J168: 1.0338 | K168: 0.88175 | L168: 1.2 | M168: 2 | N168: LFP-HE | O168: of:=(VLOOKUP([.B168]; [.$L$166:.$M$169];2;1)) -> 2 | P168: of:=(VLOOKUP([.C168]; [.$L$166:.$M$169];2;1)) -> 2 | Q168: of:=(VLOOKUP([.D168]; [.$L$166:.$M$169];2;1)) -> 2 | R168: of:=(VLOOKUP([.E168]; [.$L$166:.$M$169];2;1)) -> 2 | S168: of:=(VLOOKUP([.F168]; [.$L$166:.$M$169];2;1)) -> 3 | T168: of:=(VLOOKUP([.G168]; [.$L$166:.$M$169];2;1)) -> 3 | U168: of:=(VLOOKUP([.H168]; [.$L$166:.$M$169];2;1)) -> 3 | V168: of:=(VLOOKUP([.I168]; [.$L$166:.$M$169];2;1)) -> 3 | W168: of:=(VLOOKUP([.J168]; [.$L$166:.$M$169];2;1)) -> 3 | X168: of:=(VLOOKUP([.K168]; [.$L$166:.$M$169];2;1)) -> 4
A169: LFP-HP | B169: 1.431 | C169: 1.4341 | D169: 1.5044 | E169: 1.4278 | F169: 1.238 | G169: 1.1359 | H169: 1.1388 | I169: 1.1962 | J169: 1.133 | K169: 0.96049 | L169: 1.5 | M169: 1 | N169: LFP-HP | O169: of:=(VLOOKUP([.B169]; [.$L$166:.$M$169];2;1)) -> 2 | P169: of:=(VLOOKUP([.C169]; [.$L$166:.$M$169];2;1)) -> 2 | Q169: of:=(VLOOKUP([.D169]; [.$L$166:.$M$169];2;1)) -> 1 | R169: of:=(VLOOKUP([.E169]; [.$L$166:.$M$169];2;1)) -> 2 | S169: of:=(VLOOKUP([.F169]; [.$L$166:.$M$169];2;1)) -> 2 | T169: of:=(VLOOKUP([.G169]; [.$L$166:.$M$169];2;1)) -> 3 | U169: of:=(VLOOKUP([.H169]; [.$L$166:.$M$169];2;1)) -> 3 | V169: of:=(VLOOKUP([.I169]; [.$L$166:.$M$169];2;1)) -> 3 | W169: of:=(VLOOKUP([.J169]; [.$L$166:.$M$169];2;1)) -> 3 | X169: of:=(VLOOKUP([.K169]; [.$L$166:.$M$169];2;1)) -> 3
A170: LiTiO | B170: 1.2228 | C170: 1.3122 | D170: 1.3741 | E170: 1.3079 | F170: 1.2582 | G170: 0.93659 | H170: 1.0123 | I170: 1.0611 | J170: 1.0086 | K170: 0.97974 | L170: Gewichtung | M170: 15 | N170: LiTiO | O170: of:=(VLOOKUP([.B170]; [.$L$166:.$M$169];2;1)) -> 2 | P170: of:=(VLOOKUP([.C170]; [.$L$166:.$M$169];2;1)) -> 2 | Q170: of:=(VLOOKUP([.D170]; [.$L$166:.$M$169];2;1)) -> 2 | R170: of:=(VLOOKUP([.E170]; [.$L$166:.$M$169];2;1)) -> 2 | S170: of:=(VLOOKUP([.F170]; [.$L$166:.$M$169];2;1)) -> 2 | T170: of:=(VLOOKUP([.G170]; [.$L$166:.$M$169];2;1)) -> 3 | U170: of:=(VLOOKUP([.H170]; [.$L$166:.$M$169];2;1)) -> 3 | V170: of:=(VLOOKUP([.I170]; [.$L$166:.$M$169];2;1)) -> 3 | W170: of:=(VLOOKUP([.J170]; [.$L$166:.$M$169];2;1)) -> 3 | X170: of:=(VLOOKUP([.K170]; [.$L$166:.$M$169];2;1)) -> 3
A171: Mittelwert | B171: of:=AVERAGE([.B167:.K170]) -> 1.20873875 | N171: Mittelwert | O171: of:=AVERAGE([.O167:.X170]) -> 2.475
A172: Min | B172: of:=MIN([.B167:.K170]) -> 0.88175 | N172: Min | O172: of:=MIN([.O167:.X170]) -> 1
A173: Max | B173: of:=MAX([.B167:.K170]) -> 1.5275 | N173: Max | O173: of:=MAX([.O167:.X170]) -> 4
B175: Kühlluftmasse | L175: Punktezuordnung KLM | O175: Punkte Kühlluftmasse
B176: 204 Opportunity | F176: 204 Overnight | G176: 192 Opportunity | K176: 192 Overnight | L176: Wert | M176: Punkte | O176: 204 Opportunity | S176: 204 Overnight | T176: 192 Opportunity | X176: 192 Overnight
B177: 40kW | C177: 375kW | D177: 200kW | E177: Swap | F177: 40kW | G177: 40kW | H177: 375kW | I177: 200kW | J177: Swap | K177: 40kW | L177: 0 | M177: 4 | O177: 40kW | P177: 375kW | Q177: 200kW | R177: Swap | S177: 40kW | T177: 40kW | U177: 375kW | V177: 200kW | W177: Swap | X177: 40kW
A178: 18650 | B178: 245.17 | C178: 241.06 | D178: 242.33 | E178: 275.63 | F178: 1735.1 | G178: 269.09 | H178: 264.42 | I178: 265.48 | J178: 303.05 | K178: 2241.4 | L178: 1000 | M178: 3 | N178: 18650 | O178: of:=(VLOOKUP([.B178]; [.$L$177:.$M$180];2;1)) -> 4 | P178: of:=(VLOOKUP([.C178]; [.$L$177:.$M$180];2;1)) -> 4 | Q178: of:=(VLOOKUP([.D178]; [.$L$177:.$M$180];2;1)) -> 4 | R178: of:=(VLOOKUP([.E178]; [.$L$177:.$M$180];2;1)) -> 4 | S178: of:=(VLOOKUP([.F178]; [.$L$177:.$M$180];2;1)) -> 3 | T178: of:=(VLOOKUP([.G178]; [.$L$177:.$M$180];2;1)) -> 4 | U178: of:=(VLOOKUP([.H178]; [.$L$177:.$M$180];2;1)) -> 4 | V178: of:=(VLOOKUP([.I178]; [.$L$177:.$M$180];2;1)) -> 4 | W178: of:=(VLOOKUP([.J178]; [.$L$177:.$M$180];2;1)) -> 4 | X178: of:=(VLOOKUP([.K178]; [.$L$177:.$M$180];2;1)) -> 3
A179: LFP-HE | B179: 5130.3 | C179: 5141.4 | D179: 5174.2 | E179: 5119.2 | F179: 5330.9 | G179: 5972 | H179: 5984.5 | I179: 6022.3 | J179: 5959.5 | K179: 5461 | L179: 3000 | M179: 2 | N179: LFP-HE | O179: of:=(VLOOKUP([.B179]; [.$L$177:.$M$180];2;1)) -> 1 | P179: of:=(VLOOKUP([.C179]; [.$L$177:.$M$180];2;1)) -> 1 | Q179: of:=(VLOOKUP([.D179]; [.$L$177:.$M$180];2;1)) -> 1 | R179: of:=(VLOOKUP([.E179]; [.$L$177:.$M$180];2;1)) -> 1 | S179: of:=(VLOOKUP([.F179]; [.$L$177:.$M$180];2;1)) -> 1 | T179: of:=(VLOOKUP([.G179]; [.$L$177:.$M$180];2;1)) -> 1 | U179: of:=(VLOOKUP([.H179]; [.$L$177:.$M$180];2;1)) -> 1 | V179: of:=(VLOOKUP([.I179]; [.$L$177:.$M$180];2;1)) -> 1 | W179: of:=(VLOOKUP([.J179]; [.$L$177:.$M$180];2;1)) -> 1 | X179: of:=(VLOOKUP([.K179]; [.$L$177:.$M$180];2;1)) -> 1
A180: LFP-HP | B180: 3827.4 | C180: 3835.1 | D180: 3858.2 | E180: 3819.6 | F180: 4989.4 | G180: 4321.3 | H180: 4329.4 | I180: 4353.8 | J180: 4313.2 | K180: 5511.8 | L180: 5000 | M180: 1 | N180: LFP-HP | O180: of:=(VLOOKUP([.B180]; [.$L$177:.$M$180];2;1)) -> 2 | P180: of:=(VLOOKUP([.C180]; [.$L$177:.$M$180];2;1)) -> 2 | Q180: of:=(VLOOKUP([.D180]; [.$L$177:.$M$180];2;1)) -> 2 | R180: of:=(VLOOKUP([.E180]; [.$L$177:.$M$180];2;1)) -> 2 | S180: of:=(VLOOKUP([.F180]; [.$L$177:.$M$180];2;1)) -> 2 | T180: of:=(VLOOKUP([.G180]; [.$L$177:.$M$180];2;1)) -> 2 | U180: of:=(VLOOKUP([.H180]; [.$L$177:.$M$180];2;1)) -> 2 | V180: of:=(VLOOKUP([.I180]; [.$L$177:.$M$180];2;1)) -> 2 | W180: of:=(VLOOKUP([.J180]; [.$L$177:.$M$180];2;1)) -> 2 | X180: of:=(VLOOKUP([.K180]; [.$L$177:.$M$180];2;1)) -> 1
A181: LiTiO | B181: 582.47 | C181: 1420.7 | D181: 1426 | E181: 1417.1 | F181: 201.82 | G181: 625.26 | H181: 1687.2 | I181: 1694.1 | J181: 1682.9 | K181: 305.59 | L181: Gewichtung | M181: 10 | N181: LiTiO | O181: of:=(VLOOKUP([.B181]; [.$L$177:.$M$180];2;1)) -> 4 | P181: of:=(VLOOKUP([.C181]; [.$L$177:.$M$180];2;1)) -> 3 | Q181: of:=(VLOOKUP([.D181]; [.$L$177:.$M$180];2;1)) -> 3 | R181: of:=(VLOOKUP([.E181]; [.$L$177:.$M$180];2;1)) -> 3 | S181: of:=(VLOOKUP([.F181]; [.$L$177:.$M$180];2;1)) -> 4 | T181: of:=(VLOOKUP([.G181]; [.$L$177:.$M$180];2;1)) -> 4 | U181: of:=(VLOOKUP([.H181]; [.$L$177:.$M$180];2;1)) -> 3 | V181: of:=(VLOOKUP([.I181]; [.$L$177:.$M$180];2;1)) -> 3 | W181: of:=(VLOOKUP([.J181]; [.$L$177:.$M$180];2;1)) -> 3 | X181: of:=(VLOOKUP([.K181]; [.$L$177:.$M$180];2;1)) -> 4
A182: Mittelwert | B182: of:=AVERAGE([.B178:.K181]) -> 2889.50925 | L182: Summe gewi. | M182: of:=[.M181]+[.M170]+[.M158]+[.M146]+[.M133]+[.M122]+[.M110]+[.M99]+[.M74]+[.M62]+[.M51]+[.M39]+[.M18] -> 100 | N182: Mittelwert | O182: of:=AVERAGE([.O178:.X181]) -> 2.525
A183: Min | B183: of:=MIN([.B178:.K181]) -> 201.82 | N183: Min | O183: of:=MIN([.O178:.X181]) -> 1
A184: Max | B184: of:=MAX([.B178:.K181]) -> 6022.3 | N184: Max | O184: of:=MAX([.O178:.X181]) -> 4
O186: Gesamtpunktzahl
O187: 204 Opportunity | S187: 204 Overnight | T187: 192 Opportunity | X187: 192 Overnight
O188: 40kW | P188: 375kW | Q188: 200kW | R188: Swap | S188: 40kW | T188: 40kW | U188: 375kW | V188: 200kW | W188: Swap | X188: 40kW | Y188: MW
N189: 18650 | O189: of:=([.$M$181]/100)*[.O178]+([.$M$170]/100)*[.O167]+([.$M$158]/100)*[.O155]+([.$M$146]/100)*[.O131]+([.$M$122]/100)*[.O119]+([.$M$110]/100)*[.O107]+([.$M$99]/100)*[.O96]+([.$M$74]/100)*[.O71]+([.$M$62]/100)*[.O59]+([.$M$51]/100)*[.O48]+([.$M$39]/100)*[.O36]+([.$M$18]/100)*[.O14] -> 2.92 | P189: of:=([.$M$181]/100)*[.P178]+([.$M$170]/100)*[.P167]+([.$M$158]/100)*[.P155]+([.$M$146]/100)*[.P131]+([.$M$122]/100)*[.P119]+([.$M$110]/100)*[.P107]+([.$M$99]/100)*[.P96]+([.$M$74]/100)*[.P71]+([.$M$62]/100)*[.P59]+([.$M$51]/100)*[.P48]+([.$M$39]/100)*[.P36]+([.$M$18]/100)*[.P14] -> 2.2 | Q189: of:=([.$M$181]/100)*[.Q178]+([.$M$170]/100)*[.Q167]+([.$M$158]/100)*[.Q155]+([.$M$146]/100)*[.Q131]+([.$M$122]/100)*[.Q119]+([.$M$110]/100)*[.Q107]+([.$M$99]/100)*[.Q96]+([.$M$74]/100)*[.Q71]+([.$M$62]/100)*[.Q59]+([.$M$51]/100)*[.Q48]+([.$M$39]/100)*[.Q36]+([.$M$18]/100)*[.Q14] -> 2.13 | R189: of:=([.$M$181]/100)*[.R178]+([.$M$170]/100)*[.R167]+([.$M$158]/100)*[.R155]+([.$M$146]/100)*[.R131]+([.$M$122]/100)*[.R119]+([.$M$110]/100)*[.R107]+([.$M$99]/100)*[.R96]+([.$M$74]/100)*[.R71]+([.$M$62]/100)*[.R59]+([.$M$51]/100)*[.R48]+([.$M$39]/100)*[.R36]+([.$M$18]/100)*[.R14] -> 2.95 | S189: of:=([.$M$181]/100)*[.S178]+([.$M$170]/100)*[.S167]+([.$M$158]/100)*[.S155]+([.$M$146]/100)*[.S131]+([.$M$122]/100)*[.S119]+([.$M$110]/100)*[.S107]+([.$M$99]/100)*[.S96]+([.$M$74]/100)*[.S71]+([.$M$62]/100)*[.S59]+([.$M$51]/100)*[.S48]+([.$M$39]/100)*[.S36]+([.$M$18]/100)*[.S14] -> 3.05 | T189: of:=([.$M$181]/100)*[.T178]+([.$M$170]/100)*[.T167]+([.$M$158]/100)*[.T155]+([.$M$146]/100)*[.T131]+([.$M$122]/100)*[.T119]+([.$M$110]/100)*[.T107]+([.$M$99]/100)*[.T96]+([.$M$74]/100)*[.T71]+([.$M$62]/100)*[.T59]+([.$M$51]/100)*[.T48]+([.$M$39]/100)*[.T36]+([.$M$18]/100)*[.T14] -> 3.07 | U189: of:=([.$M$181]/100)*[.U178]+([.$M$170]/100)*[.U167]+([.$M$158]/100)*[.U155]+([.$M$146]/100)*[.U131]+([.$M$122]/100)*[.U119]+([.$M$110]/100)*[.U107]+([.$M$99]/100)*[.U96]+([.$M$74]/100)*[.U71]+([.$M$62]/100)*[.U59]+([.$M$51]/100)*[.U48]+([.$M$39]/100)*[.U36]+([.$M$18]/100)*[.U14] -> 2.29 | V189: of:=([.$M$181]/100)*[.V178]+([.$M$170]/100)*[.V167]+([.$M$158]/100)*[.V155]+([.$M$146]/100)*[.V131]+([.$M$122]/100)*[.V119]+([.$M$110]/100)*[.V107]+([.$M$99]/100)*[.V96]+([.$M$74]/100)*[.V71]+([.$M$62]/100)*[.V59]+([.$M$51]/100)*[.V48]+([.$M$39]/100)*[.V36]+([.$M$18]/100)*[.V14] -> 2.33 | W189: of:=([.$M$181]/100)*[.W178]+([.$M$170]/100)*[.W167]+([.$M$158]/100)*[.W155]+([.$M$146]/100)*[.W131]+([.$M$122]/100)*[.W119]+([.$M$110]/100)*[.W107]+([.$M$99]/100)*[.W96]+([.$M$74]/100)*[.W71]+([.$M$62]/100)*[.W59]+([.$M$51]/100)*[.W48]+([.$M$39]/100)*[.W36]+([.$M$18]/100)*[.W14] -> 2.89 | X189: of:=([.$M$181]/100)*[.X178]+([.$M$170]/100)*[.X167]+([.$M$158]/100)*[.X155]+([.$M$146]/100)*[.X131]+([.$M$122]/100)*[.X119]+([.$M$110]/100)*[.X107]+([.$M$99]/100)*[.X96]+([.$M$74]/100)*[.X71]+([.$M$62]/100)*[.X59]+([.$M$51]/100)*[.X48]+([.$M$39]/100)*[.X36]+([.$M$18]/100)*[.X14] -> 3.07 | Y189: of:=AVERAGE([.O189:.X189]) -> 2.69
N190: LFP-HE | O190: of:=([.$M$181]/100)*[.O179]+([.$M$170]/100)*[.O168]+([.$M$158]/100)*[.O156]+([.$M$146]/100)*[.O132]+([.$M$122]/100)*[.O120]+([.$M$110]/100)*[.O108]+([.$M$99]/100)*[.O97]+([.$M$74]/100)*[.O72]+([.$M$62]/100)*[.O60]+([.$M$51]/100)*[.O49]+([.$M$39]/100)*[.O37]+([.$M$18]/100)*[.O15] -> 2.67 | P190: of:=([.$M$181]/100)*[.P179]+([.$M$170]/100)*[.P168]+([.$M$158]/100)*[.P156]+([.$M$146]/100)*[.P132]+([.$M$122]/100)*[.P120]+([.$M$110]/100)*[.P108]+([.$M$99]/100)*[.P97]+([.$M$74]/100)*[.P72]+([.$M$62]/100)*[.P60]+([.$M$51]/100)*[.P49]+([.$M$39]/100)*[.P37]+([.$M$18]/100)*[.P15] -> 2.05 | Q190: of:=([.$M$181]/100)*[.Q179]+([.$M$170]/100)*[.Q168]+([.$M$158]/100)*[.Q156]+([.$M$146]/100)*[.Q132]+([.$M$122]/100)*[.Q120]+([.$M$110]/100)*[.Q108]+([.$M$99]/100)*[.Q97]+([.$M$74]/100)*[.Q72]+([.$M$62]/100)*[.Q60]+([.$M$51]/100)*[.Q49]+([.$M$39]/100)*[.Q37]+([.$M$18]/100)*[.Q15] -> 2.07 | R190: of:=([.$M$181]/100)*[.R179]+([.$M$170]/100)*[.R168]+([.$M$158]/100)*[.R156]+([.$M$146]/100)*[.R132]+([.$M$122]/100)*[.R120]+([.$M$110]/100)*[.R108]+([.$M$99]/100)*[.R97]+([.$M$74]/100)*[.R72]+([.$M$62]/100)*[.R60]+([.$M$51]/100)*[.R49]+([.$M$39]/100)*[.R37]+([.$M$18]/100)*[.R15] -> 2.59 | S190: of:=([.$M$181]/100)*[.S179]+([.$M$170]/100)*[.S168]+([.$M$158]/100)*[.S156]+([.$M$146]/100)*[.S132]+([.$M$122]/100)*[.S120]+([.$M$110]/100)*[.S108]+([.$M$99]/100)*[.S97]+([.$M$74]/100)*[.S72]+([.$M$62]/100)*[.S60]+([.$M$51]/100)*[.S49]+([.$M$39]/100)*[.S37]+([.$M$18]/100)*[.S15] -> 2.74 | T190: of:=([.$M$181]/100)*[.T179]+([.$M$170]/100)*[.T168]+([.$M$158]/100)*[.T156]+([.$M$146]/100)*[.T132]+([.$M$122]/100)*[.T120]+([.$M$110]/100)*[.T108]+([.$M$99]/100)*[.T97]+([.$M$74]/100)*[.T72]+([.$M$62]/100)*[.T60]+([.$M$51]/100)*[.T49]+([.$M$39]/100)*[.T37]+([.$M$18]/100)*[.T15] -> 2.67 | U190: of:=([.$M$181]/100)*[.U179]+([.$M$170]/100)*[.U168]+([.$M$158]/100)*[.U156]+([.$M$146]/100)*[.U132]+([.$M$122]/100)*[.U120]+([.$M$110]/100)*[.U108]+([.$M$99]/100)*[.U97]+([.$M$74]/100)*[.U72]+([.$M$62]/100)*[.U60]+([.$M$51]/100)*[.U49]+([.$M$39]/100)*[.U37]+([.$M$18]/100)*[.U15] -> 2.14 | V190: of:=([.$M$181]/100)*[.V179]+([.$M$170]/100)*[.V168]+([.$M$158]/100)*[.V156]+([.$M$146]/100)*[.V132]+([.$M$122]/100)*[.V120]+([.$M$110]/100)*[.V108]+([.$M$99]/100)*[.V97]+([.$M$74]/100)*[.V72]+([.$M$62]/100)*[.V60]+([.$M$51]/100)*[.V49]+([.$M$39]/100)*[.V37]+([.$M$18]/100)*[.V15] -> 2.27 | W190: of:=([.$M$181]/100)*[.W179]+([.$M$170]/100)*[.W168]+([.$M$158]/100)*[.W156]+([.$M$146]/100)*[.W132]+([.$M$122]/100)*[.W120]+([.$M$110]/100)*[.W108]+([.$M$99]/100)*[.W97]+([.$M$74]/100)*[.W72]+([.$M$62]/100)*[.W60]+([.$M$51]/100)*[.W49]+([.$M$39]/100)*[.W37]+([.$M$18]/100)*[.W15] -> 2.59 | X190: of:=([.$M$181]/100)*[.X179]+([.$M$170]/100)*[.X168]+([.$M$158]/100)*[.X156]+([.$M$146]/100)*[.X132]+([.$M$122]/100)*[.X120]+([.$M$110]/100)*[.X108]+([.$M$99]/100)*[.X97]+([.$M$74]/100)*[.X72]+([.$M$62]/100)*[.X60]+([.$M$51]/100)*[.X49]+([.$M$39]/100)*[.X37]+([.$M$18]/100)*[.X15] -> 2.76 | Y190: of:=AVERAGE([.O190:.X190]) -> 2.455
N191: LFP-HP | O191: of:=([.$M$181]/100)*[.O180]+([.$M$170]/100)*[.O169]+([.$M$158]/100)*[.O157]+([.$M$146]/100)*[.O133]+([.$M$122]/100)*[.O121]+([.$M$110]/100)*[.O109]+([.$M$99]/100)*[.O98]+([.$M$74]/100)*[.O73]+([.$M$62]/100)*[.O61]+([.$M$51]/100)*[.O50]+([.$M$39]/100)*[.O38]+([.$M$18]/100)*[.O16] -> 2.52 | P191: of:=([.$M$181]/100)*[.P180]+([.$M$170]/100)*[.P169]+([.$M$158]/100)*[.P157]+([.$M$146]/100)*[.P133]+([.$M$122]/100)*[.P121]+([.$M$110]/100)*[.P109]+([.$M$99]/100)*[.P98]+([.$M$74]/100)*[.P73]+([.$M$62]/100)*[.P61]+([.$M$51]/100)*[.P50]+([.$M$39]/100)*[.P38]+([.$M$18]/100)*[.P16] -> 1.9 | Q191: of:=([.$M$181]/100)*[.Q180]+([.$M$170]/100)*[.Q169]+([.$M$158]/100)*[.Q157]+([.$M$146]/100)*[.Q133]+([.$M$122]/100)*[.Q121]+([.$M$110]/100)*[.Q109]+([.$M$99]/100)*[.Q98]+([.$M$74]/100)*[.Q73]+([.$M$62]/100)*[.Q61]+([.$M$51]/100)*[.Q50]+([.$M$39]/100)*[.Q38]+([.$M$18]/100)*[.Q16] -> 1.77 | R191: of:=([.$M$181]/100)*[.R180]+([.$M$170]/100)*[.R169]+([.$M$158]/100)*[.R157]+([.$M$146]/100)*[.R133]+([.$M$122]/100)*[.R121]+([.$M$110]/100)*[.R109]+([.$M$99]/100)*[.R98]+([.$M$74]/100)*[.R73]+([.$M$62]/100)*[.R61]+([.$M$51]/100)*[.R50]+([.$M$39]/100)*[.R38]+([.$M$18]/100)*[.R16] -> 2.49 | S191: of:=([.$M$181]/100)*[.S180]+([.$M$170]/100)*[.S169]+([.$M$158]/100)*[.S157]+([.$M$146]/100)*[.S133]+([.$M$122]/100)*[.S121]+([.$M$110]/100)*[.S109]+([.$M$99]/100)*[.S98]+([.$M$74]/100)*[.S73]+([.$M$62]/100)*[.S61]+([.$M$51]/100)*[.S50]+([.$M$39]/100)*[.S38]+([.$M$18]/100)*[.S16] -> 2.38 | T191: of:=([.$M$181]/100)*[.T180]+([.$M$170]/100)*[.T169]+([.$M$158]/100)*[.T157]+([.$M$146]/100)*[.T133]+([.$M$122]/100)*[.T121]+([.$M$110]/100)*[.T109]+([.$M$99]/100)*[.T98]+([.$M$74]/100)*[.T73]+([.$M$62]/100)*[.T61]+([.$M$51]/100)*[.T50]+([.$M$39]/100)*[.T38]+([.$M$18]/100)*[.T16] -> 2.67 | U191: of:=([.$M$181]/100)*[.U180]+([.$M$170]/100)*[.U169]+([.$M$158]/100)*[.U157]+([.$M$146]/100)*[.U133]+([.$M$122]/100)*[.U121]+([.$M$110]/100)*[.U109]+([.$M$99]/100)*[.U98]+([.$M$74]/100)*[.U73]+([.$M$62]/100)*[.U61]+([.$M$51]/100)*[.U50]+([.$M$39]/100)*[.U38]+([.$M$18]/100)*[.U16] -> 1.93 | V191: of:=([.$M$181]/100)*[.V180]+([.$M$170]/100)*[.V169]+([.$M$158]/100)*[.V157]+([.$M$146]/100)*[.V133]+([.$M$122]/100)*[.V121]+([.$M$110]/100)*[.V109]+([.$M$99]/100)*[.V98]+([.$M$74]/100)*[.V73]+([.$M$62]/100)*[.V61]+([.$M$51]/100)*[.V50]+([.$M$39]/100)*[.V38]+([.$M$18]/100)*[.V16] -> 2.12 | W191: of:=([.$M$181]/100)*[.W180]+([.$M$170]/100)*[.W169]+([.$M$158]/100)*[.W157]+([.$M$146]/100)*[.W133]+([.$M$122]/100)*[.W121]+([.$M$110]/100)*[.W109]+([.$M$99]/100)*[.W98]+([.$M$74]/100)*[.W73]+([.$M$62]/100)*[.W61]+([.$M$51]/100)*[.W50]+([.$M$39]/100)*[.W38]+([.$M$18]/100)*[.W16] -> 2.49 | X191: of:=([.$M$181]/100)*[.X180]+([.$M$170]/100)*[.X169]+([.$M$158]/100)*[.X157]+([.$M$146]/100)*[.X133]+([.$M$122]/100)*[.X121]+([.$M$110]/100)*[.X109]+([.$M$99]/100)*[.X98]+([.$M$74]/100)*[.X73]+([.$M$62]/100)*[.X61]+([.$M$51]/100)*[.X50]+([.$M$39]/100)*[.X38]+([.$M$18]/100)*[.X16] -> 2.51 | Y191: of:=AVERAGE([.O191:.X191]) -> 2.278
N192: LiTiO | O192: of:=([.$M$181]/100)*[.O181]+([.$M$170]/100)*[.O170]+([.$M$158]/100)*[.O158]+([.$M$146]/100)*[.O134]+([.$M$122]/100)*[.O122]+([.$M$110]/100)*[.O110]+([.$M$99]/100)*[.O99]+([.$M$74]/100)*[.O74]+([.$M$62]/100)*[.O62]+([.$M$51]/100)*[.O51]+([.$M$39]/100)*[.O39]+([.$M$18]/100)*[.O17] -> 2.87 | P192: of:=([.$M$181]/100)*[.P181]+([.$M$170]/100)*[.P170]+([.$M$158]/100)*[.P158]+([.$M$146]/100)*[.P134]+([.$M$122]/100)*[.P122]+([.$M$110]/100)*[.P110]+([.$M$99]/100)*[.P99]+([.$M$74]/100)*[.P74]+([.$M$62]/100)*[.P62]+([.$M$51]/100)*[.P51]+([.$M$39]/100)*[.P39]+([.$M$18]/100)*[.P17] -> 2.3 | Q192: of:=([.$M$181]/100)*[.Q181]+([.$M$170]/100)*[.Q170]+([.$M$158]/100)*[.Q158]+([.$M$146]/100)*[.Q134]+([.$M$122]/100)*[.Q122]+([.$M$110]/100)*[.Q110]+([.$M$99]/100)*[.Q99]+([.$M$74]/100)*[.Q74]+([.$M$62]/100)*[.Q62]+([.$M$51]/100)*[.Q51]+([.$M$39]/100)*[.Q39]+([.$M$18]/100)*[.Q17] -> 2.32 | R192: of:=([.$M$181]/100)*[.R181]+([.$M$170]/100)*[.R170]+([.$M$158]/100)*[.R158]+([.$M$146]/100)*[.R134]+([.$M$122]/100)*[.R122]+([.$M$110]/100)*[.R110]+([.$M$99]/100)*[.R99]+([.$M$74]/100)*[.R74]+([.$M$62]/100)*[.R62]+([.$M$51]/100)*[.R51]+([.$M$39]/100)*[.R39]+([.$M$18]/100)*[.R17] -> 2.59 | S192: of:=([.$M$181]/100)*[.S181]+([.$M$170]/100)*[.S170]+([.$M$158]/100)*[.S158]+([.$M$146]/100)*[.S134]+([.$M$122]/100)*[.S122]+([.$M$110]/100)*[.S110]+([.$M$99]/100)*[.S99]+([.$M$74]/100)*[.S74]+([.$M$62]/100)*[.S62]+([.$M$51]/100)*[.S51]+([.$M$39]/100)*[.S39]+([.$M$18]/100)*[.S17] -> 2.58 | T192: of:=([.$M$181]/100)*[.T181]+([.$M$170]/100)*[.T170]+([.$M$158]/100)*[.T158]+([.$M$146]/100)*[.T134]+([.$M$122]/100)*[.T122]+([.$M$110]/100)*[.T110]+([.$M$99]/100)*[.T99]+([.$M$74]/100)*[.T74]+([.$M$62]/100)*[.T62]+([.$M$51]/100)*[.T51]+([.$M$39]/100)*[.T39]+([.$M$18]/100)*[.T17] -> 2.87 | U192: of:=([.$M$181]/100)*[.U181]+([.$M$170]/100)*[.U170]+([.$M$158]/100)*[.U158]+([.$M$146]/100)*[.U134]+([.$M$122]/100)*[.U122]+([.$M$110]/100)*[.U110]+([.$M$99]/100)*[.U99]+([.$M$74]/100)*[.U74]+([.$M$62]/100)*[.U62]+([.$M$51]/100)*[.U51]+([.$M$39]/100)*[.U39]+([.$M$18]/100)*[.U17] -> 2.08 | V192: of:=([.$M$181]/100)*[.V181]+([.$M$170]/100)*[.V170]+([.$M$158]/100)*[.V158]+([.$M$146]/100)*[.V134]+([.$M$122]/100)*[.V122]+([.$M$110]/100)*[.V110]+([.$M$99]/100)*[.V99]+([.$M$74]/100)*[.V74]+([.$M$62]/100)*[.V62]+([.$M$51]/100)*[.V51]+([.$M$39]/100)*[.V39]+([.$M$18]/100)*[.V17] -> 2.27 | W192: of:=([.$M$181]/100)*[.W181]+([.$M$170]/100)*[.W170]+([.$M$158]/100)*[.W158]+([.$M$146]/100)*[.W134]+([.$M$122]/100)*[.W122]+([.$M$110]/100)*[.W110]+([.$M$99]/100)*[.W99]+([.$M$74]/100)*[.W74]+([.$M$62]/100)*[.W62]+([.$M$51]/100)*[.W51]+([.$M$39]/100)*[.W39]+([.$M$18]/100)*[.W17] -> 2.59 | X192: of:=([.$M$181]/100)*[.X181]+([.$M$170]/100)*[.X170]+([.$M$158]/100)*[.X158]+([.$M$146]/100)*[.X134]+([.$M$122]/100)*[.X122]+([.$M$110]/100)*[.X110]+([.$M$99]/100)*[.X99]+([.$M$74]/100)*[.X74]+([.$M$62]/100)*[.X62]+([.$M$51]/100)*[.X51]+([.$M$39]/100)*[.X39]+([.$M$18]/100)*[.X17] -> 2.81 | Y192: of:=AVERAGE([.O192:.X192]) -> 2.528
N193: Mittelwert | O193: of:=AVERAGE([.O189:.X192]) -> 2.48775 | P193: Stabw | Q193: of:=STDEV([.O189:.Y192]) -> 0.331812858786114
N194: Min | O194: of:=MIN([.O189:.X192]) -> 1.77
N195: Max | O195: of:=MAX([.O189:.X192]) -> 3.07
Q196: 40kW | R196: 375kW | S196: 200kW | T196: Swap | U196: Overnight
P197: MW204 | Q197: of:=AVERAGE([.O189:.O192]) -> 2.745 | R197: of:=AVERAGE([.P189:.P192]) -> 2.1125 | S197: of:=AVERAGE([.Q189:.Q192]) -> 2.0725 | T197: of:=AVERAGE([.R189:.R192]) -> 2.655 | U197: of:=AVERAGE([.S189:.S192]) -> 2.6875
P198: MW192 | Q198: of:=AVERAGE([.T189:.T192]) -> 2.82 | R198: of:=AVERAGE([.U189:.U192]) -> 2.11 | S198: of:=AVERAGE([.V189:.V192]) -> 2.2475 | T198: of:=AVERAGE([.W189:.W192]) -> 2.64 | U198: of:=AVERAGE([.X189:.X192]) -> 2.7875
P199: Mwges | Q199: of:=AVERAGE([.Q197:.Q198]) -> 2.7825 | R199: of:=AVERAGE([.R197:.R198]) -> 2.11125 | S199: of:=AVERAGE([.S197:.S198]) -> 2.16 | T199: of:=AVERAGE([.T197:.T198]) -> 2.6475 | U199: of:=AVERAGE([.U197:.U198]) -> 2.7375
N203: Buslinie 204
O204: kond.-man. | P204: kond.-auto. | Q204: induktiv | R204: Batteriewechsel | S204: Nachtladung | T204: Zeilendurchschnitt
N205: Li-Ion klassisch | O205: of:=[.O189] -> 2.92 | P205: of:=[.P189] -> 2.2 | Q205: of:=[.Q189] -> 2.13 | R205: of:=[.R189] -> 2.95 | S205: of:=[.S189] -> 3.05 | T205: of:=AVERAGE([.O205:.S205]) -> 2.65
N206: Li-Eisenphosphat hohe Energie | O206: of:=[.O190] -> 2.67 | P206: of:=[.P190] -> 2.05 | Q206: of:=[.Q190] -> 2.07 | R206: of:=[.R190] -> 2.59 | S206: of:=[.S190] -> 2.74 | T206: of:=AVERAGE([.O206:.S206]) -> 2.424
N207: Li-Eisenphosphat hohe Leistung | O207: of:=[.O191] -> 2.52 | P207: of:=[.P191] -> 1.9 | Q207: of:=[.Q191] -> 1.77 | R207: of:=[.R191] -> 2.49 | S207: of:=[.S191] -> 2.38 | T207: of:=AVERAGE([.O207:.S207]) -> 2.212
N208: Li-Titanat | O208: of:=[.O192] -> 2.87 | P208: of:=[.P192] -> 2.3 | Q208: of:=[.Q192] -> 2.32 | R208: of:=[.R192] -> 2.59 | T208: of:=AVERAGE([.O208:.S208]) -> 2.52
N209: Spaltendurchschnitt | O209: of:=AVERAGE([.O205:.O208]) -> 2.745 | P209: of:=AVERAGE([.P205:.P208]) -> 2.1125 | Q209: of:=AVERAGE([.Q205:.Q208]) -> 2.0725 | R209: of:=AVERAGE([.R205:.R208]) -> 2.655 | S209: of:=AVERAGE([.S205:.S208]) -> 2.72333333333333 | U209: of:=MAX([.O205:.S208]) -> 3.05
N210: Buslinie 192
O211: kond.-man. | P211: kond.-auto. | Q211: induktiv | R211: Batteriewechsel | S211: Nachtladung
N212: Li-Ion klassisch | O212: of:=[.T189] -> 3.07 | P212: of:=[.U189] -> 2.29 | Q212: of:=[.V189] -> 2.33 | R212: of:=[.W189] -> 2.89 | S212: of:=[.X189] -> 3.07 | T212: of:=AVERAGE([.O212:.S212]) -> 2.73
N213: Li-Eisenphosphat hohe Energie | O213: of:=[.T190] -> 2.67 | P213: of:=[.U190] -> 2.14 | Q213: of:=[.V190] -> 2.27 | R213: of:=[.W190] -> 2.59 | S213: of:=[.X190] -> 2.76 | T213: of:=AVERAGE([.O213:.S213]) -> 2.486
N214: Li-Eisenphosphat hohe Leistung | O214: of:=[.T191] -> 2.67 | P214: of:=[.U191] -> 1.93 | Q214: of:=[.V191] -> 2.12 | R214: of:=[.W191] -> 2.49 | T214: of:=AVERAGE([.O214:.S214]) -> 2.3025
N215: Li-Titanat | O215: of:=[.T192] -> 2.87 | P215: of:=[.U192] -> 2.08 | Q215: of:=[.V192] -> 2.27 | R215: of:=[.W192] -> 2.59 | T215: of:=AVERAGE([.O215:.S215]) -> 2.4525
N216: Spaltendurchschnitt | O216: of:=AVERAGE([.O212:.O215]) -> 2.82 | P216: of:=AVERAGE([.P212:.P215]) -> 2.11 | Q216: of:=AVERAGE([.Q212:.Q215]) -> 2.2475 | R216: of:=AVERAGE([.R212:.R215]) -> 2.64 | S216: of:=AVERAGE([.S212:.S215]) -> 2.915 | U216: of:=MAX([.O212:.S215]) -> 3.07

Sheet: Bewertungen_alternativ
B1: Batteriemasse (indirekt)
B2: 204 Opportunity | F2: 204 Overnight | G2: 192 Opportunity | K2: 192 Overnight
B3: 40kW | C3: 375kW | D3: 200kW | E3: Swap | F3: 40kW | G3: 40kW | H3: 375kW | I3: 200kW | J3: Swap | K3: 40kW
A4: Blei | B4: 2125 | C4: 2130.1 | D4: 2145.4 | E4: 2119.9 | F4: 8051.1 | G4: 2751.1 | H4: 2758.5 | I4: 2780.6 | J4: 2743.8 | K4: 11432
A5: 18650 | B5: 214.96 | C5: 215.44 | D5: 216.85 | E5: 214.48 | F5: 667.9 | G5: 264.39 | H5: 265.06 | I5: 267.08 | J5: 263.71 | K5: 797.25
A6: LFP-HE | B6: 358.06 | C6: 358.76 | D6: 360.96 | E6: 357.34 | F6: 1180.4 | G6: 435 | H6: 435.99 | I6: 438.96 | J6: 433.98 | K6: 1400.4
A7: LFP-HP | B7: 480.13 | C7: 481.2 | D7: 484.39 | E7: 479.08 | F7: 1532.1 | G7: 592.47 | H7: 593.98 | I7: 598.47 | J7: 590.97 | K7: 1850.6
A8: LTO | B8: 539.91 | C8: 540.8 | D8: 543.45 | E8: 539 | F8: 2107.4 | G8: 646.65 | H8: 647.91 | I8: 651.71 | J8: 645.55 | K8: 2558.8
B10: Fahrzeugmasse
B11: 204 Opportunity | F11: 204 Overnight | G11: 192 Opportunity | K11: 192 Overnight | L11: Punktezuordnung Masse | O11: Batteriemasse Punkte
B12: 40kW | C12: 375kW | D12: 200kW | E12: Swap | F12: 40kW | G12: 40kW | H12: 375kW | I12: 200kW | J12: Swap | K12: 40kW | L12: Wert | M12: Punkte | O12: 204 Opportunity | S12: 204 Overnight | T12: 192 Opportunity | X12: 192 Overnight
A13: Ladesysmasse | B13: 50 | C13: 185 | D13: 450 | E13: 0 | F13: 50 | G13: of:=[.B13] -> 50 | H13: of:=[.C13] -> 185 | I13: of:=[.D13] -> 450 | J13: of:=[.E13] -> 0 | K13: of:=[.F13] -> 50 | L13: 0 | M13: 4 | O13: 40kW | P13: 375kW | Q13: 200kW | R13: Swap | S13: 40kW | T13: 40kW | U13: 375kW | V13: 200kW | W13: Swap | X13: 40kW
A14: 18650 | B14: of:=[.B5]+[.B$13] -> 264.96 | C14: of:=[.C5]+[.C$13] -> 400.44 | D14: of:=[.D5]+[.D$13] -> 666.85 | E14: of:=[.E5]+[.E$13] -> 214.48 | F14: of:=[.F5]+[.F$13] -> 717.9 | G14: of:=[.G5]+[.G$13] -> 314.39 | H14: of:=[.H5]+[.H$13] -> 450.06 | I14: of:=[.I5]+[.I$13] -> 717.08 | J14: of:=[.J5]+[.J$13] -> 263.71 | K14: of:=[.K5]+[.K$13] -> 847.25 | L14: 250 | M14: 3 | N14: 18650 | O14: of:=(VLOOKUP([.B14]; [.$L$13:.$M$17];2;1)) -> 3 | P14: of:=(VLOOKUP([.C14]; [.$L$13:.$M$17];2;1)) -> 3 | Q14: of:=(VLOOKUP([.D14]; [.$L$13:.$M$17];2;1)) -> 3 | R14: of:=(VLOOKUP([.E14]; [.$L$13:.$M$17];2;1)) -> 4 | S14: of:=(VLOOKUP([.F14]; [.$L$13:.$M$17];2;1)) -> 3 | T14: of:=(VLOOKUP([.G14]; [.$L$13:.$M$17];2;1)) -> 3 | U14: of:=(VLOOKUP([.H14]; [.$L$13:.$M$17];2;1)) -> 3 | V14: of:=(VLOOKUP([.I14]; [.$L$13:.$M$17];2;1)) -> 3 | W14: of:=(VLOOKUP([.J14]; [.$L$13:.$M$17];2;1)) -> 3 | X14: of:=(VLOOKUP([.K14]; [.$L$13:.$M$17];2;1)) -> 2
A15: LFP-HE | B15: of:=[.B6]+[.B$13] -> 408.06 | C15: of:=[.C6]+[.C$13] -> 543.76 | D15: of:=[.D6]+[.D$13] -> 810.96 | E15: of:=[.E6]+[.E$13] -> 357.34 | F15: of:=[.F6]+[.F$13] -> 1230.4 | G15: of:=[.G6]+[.G$13] -> 485 | H15: of:=[.H6]+[.H$13] -> 620.99 | I15: of:=[.I6]+[.I$13] -> 888.96 | J15: of:=[.J6]+[.J$13] -> 433.98 | K15: of:=[.K6]+[.K$13] -> 1450.4 | L15: 750 | M15: 2 | N15: LFP-HE | O15: of:=(VLOOKUP([.B15]; [.$L$13:.$M$17];2;1)) -> 3 | P15: of:=(VLOOKUP([.C15]; [.$L$13:.$M$17];2;1)) -> 3 | Q15: of:=(VLOOKUP([.D15]; [.$L$13:.$M$17];2;1)) -> 2 | R15: of:=(VLOOKUP([.E15]; [.$L$13:.$M$17];2;1)) -> 3 | S15: of:=(VLOOKUP([.F15]; [.$L$13:.$M$17];2;1)) -> 2 | T15: of:=(VLOOKUP([.G15]; [.$L$13:.$M$17];2;1)) -> 3 | U15: of:=(VLOOKUP([.H15]; [.$L$13:.$M$17];2;1)) -> 3 | V15: of:=(VLOOKUP([.I15]; [.$L$13:.$M$17];2;1)) -> 2 | W15: of:=(VLOOKUP([.J15]; [.$L$13:.$M$17];2;1)) -> 3 | X15: of:=(VLOOKUP([.K15]; [.$L$13:.$M$17];2;1)) -> 1
A16: LFP-HP | B16: of:=[.B7]+[.B$13] -> 530.13 | C16: of:=[.C7]+[.C$13] -> 666.2 | D16: of:=[.D7]+[.D$13] -> 934.39 | E16: of:=[.E7]+[.E$13] -> 479.08 | F16: of:=[.F7]+[.F$13] -> 1582.1 | G16: of:=[.G7]+[.G$13] -> 642.47 | H16: of:=[.H7]+[.H$13] -> 778.98 | I16: of:=[.I7]+[.I$13] -> 1048.47 | J16: of:=[.J7]+[.J$13] -> 590.97 | K16: of:=[.K7]+[.K$13] -> 1900.6 | L16: 1250 | M16: 1 | N16: LFP-HP | O16: of:=(VLOOKUP([.B16]; [.$L$13:.$M$17];2;1)) -> 3 | P16: of:=(VLOOKUP([.C16]; [.$L$13:.$M$17];2;1)) -> 3 | Q16: of:=(VLOOKUP([.D16]; [.$L$13:.$M$17];2;1)) -> 2 | R16: of:=(VLOOKUP([.E16]; [.$L$13:.$M$17];2;1)) -> 3 | S16: of:=(VLOOKUP([.F16]; [.$L$13:.$M$17];2;1)) -> 1 | T16: of:=(VLOOKUP([.G16]; [.$L$13:.$M$17];2;1)) -> 3 | U16: of:=(VLOOKUP([.H16]; [.$L$13:.$M$17];2;1)) -> 2 | V16: of:=(VLOOKUP([.I16]; [.$L$13:.$M$17];2;1)) -> 2 | W16: of:=(VLOOKUP([.J16]; [.$L$13:.$M$17];2;1)) -> 3 | X16: of:=(VLOOKUP([.K16]; [.$L$13:.$M$17];2;1)) -> 1
A17: LiTiO | B17: of:=[.B8]+[.B$13] -> 589.91 | C17: of:=[.C8]+[.C$13] -> 725.8 | D17: of:=[.D8]+[.D$13] -> 993.45 | E17: of:=[.E8]+[.E$13] -> 539 | F17: of:=[.F8]+[.F$13] -> 2157.4 | G17: of:=[.G8]+[.G$13] -> 696.65 | H17: of:=[.H8]+[.H$13] -> 832.91 | I17: of:=[.I8]+[.I$13] -> 1101.71 | J17: of:=[.J8]+[.J$13] -> 645.55 | K17: of:=[.K8]+[.K$13] -> 2608.8 | L17: 100000 | M17: 0 | N17: LiTiO | O17: of:=(VLOOKUP([.B17]; [.$L$13:.$M$17];2;1)) -> 3 | P17: of:=(VLOOKUP([.C17]; [.$L$13:.$M$17];2;1)) -> 3 | Q17: of:=(VLOOKUP([.D17]; [.$L$13:.$M$17];2;1)) -> 2 | R17: of:=(VLOOKUP([.E17]; [.$L$13:.$M$17];2;1)) -> 3 | S17: of:=(VLOOKUP([.F17]; [.$L$13:.$M$17];2;1)) -> 1 | T17: of:=(VLOOKUP([.G17]; [.$L$13:.$M$17];2;1)) -> 3 | U17: of:=(VLOOKUP([.H17]; [.$L$13:.$M$17];2;1)) -> 2 | V17: of:=(VLOOKUP([.I17]; [.$L$13:.$M$17];2;1)) -> 2 | W17: of:=(VLOOKUP([.J17]; [.$L$13:.$M$17];2;1)) -> 3 | X17: of:=(VLOOKUP([.K17]; [.$L$13:.$M$17];2;1)) -> 1
A18: Mittelwert | B18: of:=AVERAGE([.B14:.K17]) -> 803.2885 | L18: Gewichtung | M18: 3.333 | N18: Mittelwert | O18: of:=AVERAGE([.O14:.X17]) -> 2.525
A19: Min | B19: of:=MIN([.B14:.K17]) -> 214.48 | N19: Min | O19: of:=MIN([.O14:.X17]) -> 1
A20: Max | B20: of:=MAX([.B14:.K17]) -> 2608.8 | N20: Max | O20: of:=MAX([.O14:.X17]) -> 4
B22: Fahrzeugvolumen frei (indirekt)
B23: 204 Opportunity | F23: 204 Overnight | G23: 192 Opportunity | K23: 192 Overnight
B24: 40kW | C24: 375kW | D24: 200kW | E24: Swap | F24: 40kW | G24: 40kW | H24: 375kW | I24: 200kW | J24: Swap | K24: 40kW
A25: 18650 | B25: 77.783 | C25: 77.956 | D25: 78.468 | E25: 77.61 | F25: 241.68 | G25: 95.671 | H25: 95.915 | I25: 96.646 | J25: 95.427 | K25: 288.49
A26: LFP-HE | B26: 217.01 | C26: 217.43 | D26: 218.77 | E26: 216.57 | F26: 715.41 | G26: 263.63 | H26: 264.24 | I26: 266.04 | J26: 263.02 | K26: 848.72
A27: LFP-HP | B27: 250.72 | C27: 251.28 | D27: 252.95 | E27: 250.17 | F27: 800.07 | G27: 309.39 | H27: 310.17 | I27: 312.52 | J27: 308.6 | K27: 966.36
A28: LiTiO | B28: 377.93 | C28: 378.56 | D28: 380.41 | E28: 377.3 | F28: 1475.2 | G28: 452.65 | H28: 453.54 | I28: 456.2 | J28: 451.88 | K28: 1791.1
A29: Mittelwert | B29: of:=AVERAGE([.B25:.K28]) -> 383.08715
A30: Min | B30: of:=MIN([.B25:.K28]) -> 77.61
A31: Max | B31: of:=MAX([.B25:.K28]) -> 1791.1
B33: Gesamtvlumen frei | L33: Punktezuordnung Volumen | O33: Batterievolumen Punkte
B34: 204 Opportunity | F34: 204 Overnight | G34: 192 Opportunity | K34: 192 Overnight | L34: Wert | M34: Punkte | O34: 204 Opportunity | S34: 204 Overnight | T34: 192 Opportunity | X34: 192 Overnight
B35: 40kW | C35: 375kW | D35: 200kW | E35: Swap | F35: 40kW | G35: 40kW | H35: 375kW | I35: 200kW | J35: Swap | K35: 40kW | L35: 0 | M35: 4 | O35: 40kW | P35: 375kW | Q35: 200kW | R35: Swap | S35: 40kW | T35: 40kW | U35: 375kW | V35: 200kW | W35: Swap | X35: 40kW
A36: Ladesysvol | B36: 50 | C36: 100 | D36: 100 | E36: 0 | F36: 50 | G36: of:=[.B36] -> 50 | H36: of:=[.C36] -> 100 | I36: of:=[.D36] -> 100 | J36: of:=[.E36] -> 0 | K36: of:=[.F36] -> 50 | L36: 100 | M36: 3 | N36: 18650 | O36: of:=(VLOOKUP([.B36]; [.$L$35:.$M$38];2;1)) -> 4 | P36: of:=(VLOOKUP([.C36]; [.$L$35:.$M$38];2;1)) -> 3 | Q36: of:=(VLOOKUP([.D36]; [.$L$35:.$M$38];2;1)) -> 3 | R36: of:=(VLOOKUP([.E36]; [.$L$35:.$M$38];2;1)) -> 4 | S36: of:=(VLOOKUP([.F36]; [.$L$35:.$M$38];2;1)) -> 4 | T36: of:=(VLOOKUP([.G36]; [.$L$35:.$M$38];2;1)) -> 4 | U36: of:=(VLOOKUP([.H36]; [.$L$35:.$M$38];2;1)) -> 3 | V36: of:=(VLOOKUP([.I36]; [.$L$35:.$M$38];2;1)) -> 3 | W36: of:=(VLOOKUP([.J36]; [.$L$35:.$M$38];2;1)) -> 4 | X36: of:=(VLOOKUP([.K36]; [.$L$35:.$M$38];2;1)) -> 4
A37: 18650 | B37: of:=[.B25]+[.B$36] -> 127.783 | C37: of:=[.C25]+[.C$36] -> 177.956 | D37: of:=[.D25]+[.D$36] -> 178.468 | E37: of:=[.E25]+[.E$36] -> 77.61 | F37: of:=[.F25]+[.F$36] -> 291.68 | G37: of:=[.G25]+[.G$36] -> 145.671 | H37: of:=[.H25]+[.H$36] -> 195.915 | I37: of:=[.I25]+[.I$36] -> 196.646 | J37: of:=[.J25]+[.J$36] -> 95.427 | K37: of:=[.K25]+[.K$36] -> 338.49 | L37: 200 | M37: 2 | N37: LFP-HE | O37: of:=(VLOOKUP([.B37]; [.$L$35:.$M$38];2;1)) -> 3 | P37: of:=(VLOOKUP([.C37]; [.$L$35:.$M$38];2;1)) -> 3 | Q37: of:=(VLOOKUP([.D37]; [.$L$35:.$M$38];2;1)) -> 3 | R37: of:=(VLOOKUP([.E37]; [.$L$35:.$M$38];2;1)) -> 4 | S37: of:=(VLOOKUP([.F37]; [.$L$35:.$M$38];2;1)) -> 2 | T37: of:=(VLOOKUP([.G37]; [.$L$35:.$M$38];2;1)) -> 3 | U37: of:=(VLOOKUP([.H37]; [.$L$35:.$M$38];2;1)) -> 3 | V37: of:=(VLOOKUP([.I37]; [.$L$35:.$M$38];2;1)) -> 3 | W37: of:=(VLOOKUP([.J37]; [.$L$35:.$M$38];2;1)) -> 4 | X37: of:=(VLOOKUP([.K37]; [.$L$35:.$M$38];2;1)) -> 2
A38: LFP-HE | B38: of:=[.B26]+[.B$36] -> 267.01 | C38: of:=[.C26]+[.C$36] -> 317.43 | D38: of:=[.D26]+[.D$36] -> 318.77 | E38: of:=[.E26]+[.E$36] -> 216.57 | F38: of:=[.F26]+[.F$36] -> 765.41 | G38: of:=[.G26]+[.G$36] -> 313.63 | H38: of:=[.H26]+[.H$36] -> 364.24 | I38: of:=[.I26]+[.I$36] -> 366.04 | J38: of:=[.J26]+[.J$36] -> 263.02 | K38: of:=[.K26]+[.K$36] -> 898.72 | L38: 400 | M38: 1 | N38: LFP-HP | O38: of:=(VLOOKUP([.B38]; [.$L$35:.$M$38];2;1)) -> 2 | P38: of:=(VLOOKUP([.C38]; [.$L$35:.$M$38];2;1)) -> 2 | Q38: of:=(VLOOKUP([.D38]; [.$L$35:.$M$38];2;1)) -> 2 | R38: of:=(VLOOKUP([.E38]; [.$L$35:.$M$38];2;1)) -> 2 | S38: of:=(VLOOKUP([.F38]; [.$L$35:.$M$38];2;1)) -> 1 | T38: of:=(VLOOKUP([.G38]; [.$L$35:.$M$38];2;1)) -> 2 | U38: of:=(VLOOKUP([.H38]; [.$L$35:.$M$38];2;1)) -> 2 | V38: of:=(VLOOKUP([.I38]; [.$L$35:.$M$38];2;1)) -> 2 | W38: of:=(VLOOKUP([.J38]; [.$L$35:.$M$38];2;1)) -> 2 | X38: of:=(VLOOKUP([.K38]; [.$L$35:.$M$38];2;1)) -> 1
A39: LFP-HP | B39: of:=[.B27]+[.B$36] -> 300.72 | C39: of:=[.C27]+[.C$36] -> 351.28 | D39: of:=[.D27]+[.D$36] -> 352.95 | E39: of:=[.E27]+[.E$36] -> 250.17 | F39: of:=[.F27]+[.F$36] -> 850.07 | G39: of:=[.G27]+[.G$36] -> 359.39 | H39: of:=[.H27]+[.H$36] -> 410.17 | I39: of:=[.I27]+[.I$36] -> 412.52 | J39: of:=[.J27]+[.J$36] -> 308.6 | K39: of:=[.K27]+[.K$36] -> 1016.36 | L39: Gewichtung | M39: 10 | N39: LiTiO | O39: of:=(VLOOKUP([.B39]; [.$L$35:.$M$38];2;1)) -> 2 | P39: of:=(VLOOKUP([.C39]; [.$L$35:.$M$38];2;1)) -> 2 | Q39: of:=(VLOOKUP([.D39]; [.$L$35:.$M$38];2;1)) -> 2 | R39: of:=(VLOOKUP([.E39]; [.$L$35:.$M$38];2;1)) -> 2 | S39: of:=(VLOOKUP([.F39]; [.$L$35:.$M$38];2;1)) -> 1 | T39: of:=(VLOOKUP([.G39]; [.$L$35:.$M$38];2;1)) -> 2 | U39: of:=(VLOOKUP([.H39]; [.$L$35:.$M$38];2;1)) -> 1 | V39: of:=(VLOOKUP([.I39]; [.$L$35:.$M$38];2;1)) -> 1 | W39: of:=(VLOOKUP([.J39]; [.$L$35:.$M$38];2;1)) -> 2 | X39: of:=(VLOOKUP([.K39]; [.$L$35:.$M$38];2;1)) -> 1
A40: LiTiO | B40: of:=[.B28]+[.B$36] -> 427.93 | C40: of:=[.C28]+[.C$36] -> 478.56 | D40: of:=[.D28]+[.D$36] -> 480.41 | E40: of:=[.E28]+[.E$36] -> 377.3 | F40: of:=[.F28]+[.F$36] -> 1525.2 | G40: of:=[.G28]+[.G$36] -> 502.65 | H40: of:=[.H28]+[.H$36] -> 553.54 | I40: of:=[.I28]+[.I$36] -> 556.2 | J40: of:=[.J28]+[.J$36] -> 451.88 | K40: of:=[.K28]+[.K$36] -> 1841.1 | N40: Mittelwert | O40: of:=AVERAGE([.O36:.X39]) -> 2.5
A41: Mittelwert | B41: of:=AVERAGE([.B37:.K40]) -> 443.08715 | N41: Min | O41: of:=MIN([.O36:.X39]) -> 1
A42: Min | B42: of:=MIN([.B37:.K40]) -> 77.61 | N42: Max | O42: of:=MAX([.O36:.X39]) -> 4
A43: Max | B43: of:=MAX([.B37:.K40]) -> 1841.1
B45: Ladezyklen pro tausend km | L45: Punktezuordnung LZPkm | O45: Ladezyklen pro km | AA45: Ladezyklen pro tausend km
B46: 204 Opportunity | F46: 204 Overnight | G46: 192 Opportunity | K46: 192 Overnight | L46: Wert | M46: Punkte | O46: 204 Opportunity | S46: 204 Overnight | T46: 192 Opportunity | X46: 192 Overnight | AA46: 204 Opportunity | AE46: 204 Overnight | AF46: 192 Opportunity | AJ46: 192 Overnight
B47: 40kW | C47: 375kW | D47: 200kW | E47: Swap | F47: 40kW | G47: 40kW | H47: 375kW | I47: 200kW | J47: Swap | K47: 40kW | L47: 0 | M47: 4 | O47: 40kW | P47: 375kW | Q47: 200kW | R47: Swap | S47: 40kW | T47: 40kW | U47: 375kW | V47: 200kW | W47: Swap | X47: 40kW | AA47: 40kW | AB47: 375kW | AC47: 200kW | AD47: Swap | AE47: 40kW | AF47: 40kW | AG47: 375kW | AH47: 200kW | AI47: Swap | AJ47: 40kW
A48: 18650 | B48: of:=1000*[.AA48] -> 23.654 | C48: of:=1000*[.AB48] -> 23.655 | D48: of:=1000*[.AC48] -> 23.657 | E48: of:=1000*[.AD48] -> 23.653 | F48: of:=1000*[.AE48] -> 6.4549 | G48: of:=1000*[.AF48] -> 15.29 | H48: of:=1000*[.AG48] -> 15.29 | I48: of:=1000*[.AH48] -> 15.292 | J48: of:=1000*[.AI48] -> 15.289 | K48: of:=1000*[.AJ48] -> 4.1719 | L48: 5 | M48: 3 | N48: 18650 | O48: of:=(VLOOKUP([.B48]; [.$L$47:.$M$50];2;1)) -> 2 | P48: of:=(VLOOKUP([.C48]; [.$L$47:.$M$50];2;1)) -> 2 | Q48: of:=(VLOOKUP([.D48]; [.$L$47:.$M$50];2;1)) -> 2 | R48: of:=(VLOOKUP([.E48]; [.$L$47:.$M$50];2;1)) -> 2 | S48: of:=(VLOOKUP([.F48]; [.$L$47:.$M$50];2;1)) -> 3 | T48: of:=(VLOOKUP([.G48]; [.$L$47:.$M$50];2;1)) -> 2 | U48: of:=(VLOOKUP([.H48]; [.$L$47:.$M$50];2;1)) -> 2 | V48: of:=(VLOOKUP([.I48]; [.$L$47:.$M$50];2;1)) -> 2 | W48: of:=(VLOOKUP([.J48]; [.$L$47:.$M$50];2;1)) -> 2 | X48: of:=(VLOOKUP([.K48]; [.$L$47:.$M$50];2;1)) -> 4 | Z48: 18650 | AA48: 0.023654 | AB48: 0.023655 | AC48: 0.023657 | AD48: 0.023653 | AE48: 0.0064549 | AF48: 0.01529 | AG48: 0.01529 | AH48: 0.015292 | AI48: 0.015289 | AJ48: 0.0041719
A49: LFP-HE | B49: of:=1000*[.AA49] -> 23.739 | C49: of:=1000*[.AB49] -> 23.739 | D49: of:=1000*[.AC49] -> 23.741 | E49: of:=1000*[.AD49] -> 23.736 | F49: of:=1000*[.AE49] -> 6.4713 | G49: of:=1000*[.AF49] -> 15.28 | H49: of:=1000*[.AG49] -> 15.281 | I49: of:=1000*[.AH49] -> 15.283 | J49: of:=1000*[.AI49] -> 15.279 | K49: of:=1000*[.AJ49] -> 4.157 | L49: 15 | M49: 2 | N49: LFP-HE | O49: of:=(VLOOKUP([.B49]; [.$L$47:.$M$50];2;1)) -> 2 | P49: of:=(VLOOKUP([.C49]; [.$L$47:.$M$50];2;1)) -> 2 | Q49: of:=(VLOOKUP([.D49]; [.$L$47:.$M$50];2;1)) -> 2 | R49: of:=(VLOOKUP([.E49]; [.$L$47:.$M$50];2;1)) -> 2 | S49: of:=(VLOOKUP([.F49]; [.$L$47:.$M$50];2;1)) -> 3 | T49: of:=(VLOOKUP([.G49]; [.$L$47:.$M$50];2;1)) -> 2 | U49: of:=(VLOOKUP([.H49]; [.$L$47:.$M$50];2;1)) -> 2 | V49: of:=(VLOOKUP([.I49]; [.$L$47:.$M$50];2;1)) -> 2 | W49: of:=(VLOOKUP([.J49]; [.$L$47:.$M$50];2;1)) -> 2 | X49: of:=(VLOOKUP([.K49]; [.$L$47:.$M$50];2;1)) -> 4 | Z49: LFP-HE | AA49: 0.023739 | AB49: 0.023739 | AC49: 0.023741 | AD49: 0.023736 | AE49: 0.0064713 | AF49: 0.01528 | AG49: 0.015281 | AH49: 0.015283 | AI49: 0.015279 | AJ49: 0.004157
A50: LFP-HP | B50: of:=1000*[.AA50] -> 23.732 | C50: of:=1000*[.AB50] -> 23.733 | D50: of:=1000*[.AC50] -> 23.735 | E50: of:=1000*[.AD50] -> 23.733 | F50: of:=1000*[.AE50] -> 6.4686 | G50: of:=1000*[.AF50] -> 15.266 | H50: of:=1000*[.AG50] -> 15.267 | I50: of:=1000*[.AH50] -> 15.269 | J50: of:=1000*[.AI50] -> 15.265 | K50: of:=1000*[.AJ50] -> 4.158 | L50: 30 | M50: 1 | N50: LFP-HP | O50: of:=(VLOOKUP([.B50]; [.$L$47:.$M$50];2;1)) -> 2 | P50: of:=(VLOOKUP([.C50]; [.$L$47:.$M$50];2;1)) -> 2 | Q50: of:=(VLOOKUP([.D50]; [.$L$47:.$M$50];2;1)) -> 2 | R50: of:=(VLOOKUP([.E50]; [.$L$47:.$M$50];2;1)) -> 2 | S50: of:=(VLOOKUP([.F50]; [.$L$47:.$M$50];2;1)) -> 3 | T50: of:=(VLOOKUP([.G50]; [.$L$47:.$M$50];2;1)) -> 2 | U50: of:=(VLOOKUP([.H50]; [.$L$47:.$M$50];2;1)) -> 2 | V50: of:=(VLOOKUP([.I50]; [.$L$47:.$M$50];2;1)) -> 2 | W50: of:=(VLOOKUP([.J50]; [.$L$47:.$M$50];2;1)) -> 2 | X50: of:=(VLOOKUP([.K50]; [.$L$47:.$M$50];2;1)) -> 4 | Z50: LFP-HP | AA50: 0.023732 | AB50: 0.023733 | AC50: 0.023735 | AD50: 0.023733 | AE50: 0.0064686 | AF50: 0.015266 | AG50: 0.015267 | AH50: 0.015269 | AI50: 0.015265 | AJ50: 0.004158
A51: LiTiO | B51: of:=1000*[.AA51] -> 23.708 | C51: of:=1000*[.AB51] -> 23.71 | D51: of:=1000*[.AC51] -> 23.715 | E51: of:=1000*[.AD51] -> 23.707 | F51: of:=1000*[.AE51] -> 6.473 | G51: of:=1000*[.AF51] -> 15.253 | H51: of:=1000*[.AG51] -> 15.247 | I51: of:=1000*[.AH51] -> 15.25 | J51: of:=1000*[.AI51] -> 15.247 | K51: of:=1000*[.AJ51] -> 4.1561 | L51: Gewichtung | M51: 3.333 | N51: LiTiO | O51: of:=(VLOOKUP([.B51]; [.$L$47:.$M$50];2;1)) -> 2 | P51: of:=(VLOOKUP([.C51]; [.$L$47:.$M$50];2;1)) -> 2 | Q51: of:=(VLOOKUP([.D51]; [.$L$47:.$M$50];2;1)) -> 2 | R51: of:=(VLOOKUP([.E51]; [.$L$47:.$M$50];2;1)) -> 2 | S51: of:=(VLOOKUP([.F51]; [.$L$47:.$M$50];2;1)) -> 3 | T51: of:=(VLOOKUP([.G51]; [.$L$47:.$M$50];2;1)) -> 2 | U51: of:=(VLOOKUP([.H51]; [.$L$47:.$M$50];2;1)) -> 2 | V51: of:=(VLOOKUP([.I51]; [.$L$47:.$M$50];2;1)) -> 2 | W51: of:=(VLOOKUP([.J51]; [.$L$47:.$M$50];2;1)) -> 2 | X51: of:=(VLOOKUP([.K51]; [.$L$47:.$M$50];2;1)) -> 4 | Z51: LiTiO | AA51: 0.023708 | AB51: 0.02371 | AC51: 0.023715 | AD51: 0.023707 | AE51: 0.006473 | AF51: 0.015253 | AG51: 0.015247 | AH51: 0.01525 | AI51: 0.015247 | AJ51: 0.0041561
A52: Mittelwert | B52: of:=AVERAGE([.B48:.K51]) -> 16.655145 | N52: Mittelwert | O52: of:=AVERAGE([.O48:.X51]) -> 2.3 | Z52: Mittelwert | AA52: of:=AVERAGE([.AA48:.AJ51]) -> 0.016655145
A53: Min | B53: of:=MIN([.B48:.K51]) -> 4.1561 | N53: Min | O53: of:=MIN([.O48:.X51]) -> 2 | Z53: Min | AA53: of:=MIN([.AA48:.AJ51]) -> 0.0041561
A54: Max | B54: of:=MAX([.B48:.K51]) -> 23.741 | N54: Max | O54: of:=MAX([.O48:.X51]) -> 4 | Z54: Max | AA54: of:=MAX([.AA48:.AJ51]) -> 0.023741
B56: Positionierungsgenauigkeit Fläche | L56: Punktezuordnung Fläche | O56: Punkte Fläche
B57: 204 Opportunity | F57: 204 Overnight | G57: 192 Opportunity | K57: 192 Overnight | L57: Wert | M57: Punkte | O57: 204 Opportunity | S57: 204 Overnight | T57: 192 Opportunity | X57: 192 Overnight
B58: 40kW | C58: 375kW | D58: 200kW | E58: Swap | F58: 40kW | G58: 40kW | H58: 375kW | I58: 200kW | J58: Swap | K58: 40kW | L58: 0 | M58: 1 | O58: 40kW | P58: 375kW | Q58: 200kW | R58: Swap | S58: 40kW | T58: 40kW | U58: 375kW | V58: 200kW | W58: Swap | X58: 40kW
B59: 47 | C59: 1.75 | D59: 1 | E59: 4 | F59: of:=[.B59] -> 47 | G59: of:=[.B59] -> 47 | H59: of:=[.C59] -> 1.75 | I59: of:=[.D59] -> 1 | J59: of:=[.E59] -> 4 | K59: of:=[.F59] -> 47 | L59: 3 | M59: 2 | N59: 18650 | O59: of:=(VLOOKUP([.B60]; [.$L$58:.$M$61];2;1)) -> 4 | P59: of:=(VLOOKUP([.C60]; [.$L$58:.$M$61];2;1)) -> 1 | Q59: of:=(VLOOKUP([.D60]; [.$L$58:.$M$61];2;1)) -> 1 | R59: of:=(VLOOKUP([.E60]; [.$L$58:.$M$61];2;1)) -> 2 | S59: of:=(VLOOKUP([.F60]; [.$L$58:.$M$61];2;1)) -> 4 | T59: of:=(VLOOKUP([.G60]; [.$L$58:.$M$61];2;1)) -> 4 | U59: of:=(VLOOKUP([.H60]; [.$L$58:.$M$61];2;1)) -> 1 | V59: of:=(VLOOKUP([.I60]; [.$L$58:.$M$61];2;1)) -> 1 | W59: of:=(VLOOKUP([.J60]; [.$L$58:.$M$61];2;1)) -> 2 | X59: of:=(VLOOKUP([.K60]; [.$L$58:.$M$61];2;1)) -> 4
A60: 18650 | B60: of:=[.B$59] -> 47 | C60: of:=[.C$59] -> 1.75 | D60: 1 | E60: of:=[.E$59] -> 4 | F60: of:=[.F$59] -> 47 | G60: of:=[.G$59] -> 47 | H60: of:=[.H$59] -> 1.75 | I60: of:=[.I$59] -> 1 | J60: of:=[.J$59] -> 4 | K60: of:=[.K$59] -> 47 | L60: 6 | M60: 3 | N60: LFP-HE | O60: of:=(VLOOKUP([.B61]; [.$L$58:.$M$61];2;1)) -> 4 | P60: of:=(VLOOKUP([.C61]; [.$L$58:.$M$61];2;1)) -> 1 | Q60: of:=(VLOOKUP([.D61]; [.$L$58:.$M$61];2;1)) -> 1 | R60: of:=(VLOOKUP([.E61]; [.$L$58:.$M$61];2;1)) -> 2 | S60: of:=(VLOOKUP([.F61]; [.$L$58:.$M$61];2;1)) -> 4 | T60: of:=(VLOOKUP([.G61]; [.$L$58:.$M$61];2;1)) -> 4 | U60: of:=(VLOOKUP([.H61]; [.$L$58:.$M$61];2;1)) -> 1 | V60: of:=(VLOOKUP([.I61]; [.$L$58:.$M$61];2;1)) -> 1 | W60: of:=(VLOOKUP([.J61]; [.$L$58:.$M$61];2;1)) -> 2 | X60: of:=(VLOOKUP([.K61]; [.$L$58:.$M$61];2;1)) -> 4
A61: LFP-HE | B61: of:=[.B$59] -> 47 | C61: of:=[.C$59] -> 1.75 | D61: 1 | E61: of:=[.E$59] -> 4 | F61: of:=[.F$59] -> 47 | G61: of:=[.G$59] -> 47 | H61: of:=[.H$59] -> 1.75 | I61: of:=[.I$59] -> 1 | J61: of:=[.J$59] -> 4 | K61: of:=[.K$59] -> 47 | L61: 9 | M61: 4 | N61: LFP-HP | O61: of:=(VLOOKUP([.B62]; [.$L$58:.$M$61];2;1)) -> 4 | P61: of:=(VLOOKUP([.C62]; [.$L$58:.$M$61];2;1)) -> 1 | Q61: of:=(VLOOKUP([.D62]; [.$L$58:.$M$61];2;1)) -> 1 | R61: of:=(VLOOKUP([.E62]; [.$L$58:.$M$61];2;1)) -> 2 | S61: of:=(VLOOKUP([.F62]; [.$L$58:.$M$61];2;1)) -> 4 | T61: of:=(VLOOKUP([.G62]; [.$L$58:.$M$61];2;1)) -> 4 | U61: of:=(VLOOKUP([.H62]; [.$L$58:.$M$61];2;1)) -> 1 | V61: of:=(VLOOKUP([.I62]; [.$L$58:.$M$61];2;1)) -> 1 | W61: of:=(VLOOKUP([.J62]; [.$L$58:.$M$61];2;1)) -> 2 | X61: of:=(VLOOKUP([.K62]; [.$L$58:.$M$61];2;1)) -> 4
A62: LFP-HP | B62: of:=[.B$59] -> 47 | C62: of:=[.C$59] -> 1.75 | D62: 1 | E62: of:=[.E$59] -> 4 | F62: of:=[.F$59] -> 47 | G62: of:=[.G$59] -> 47 | H62: of:=[.H$59] -> 1.75 | I62: of:=[.I$59] -> 1 | J62: of:=[.J$59] -> 4 | K62: of:=[.K$59] -> 47 | L62: Gewichtung | M62: 3.333 | N62: LiTiO | O62: of:=(VLOOKUP([.B63]; [.$L$58:.$M$61];2;1)) -> 4 | P62: of:=(VLOOKUP([.C63]; [.$L$58:.$M$61];2;1)) -> 1 | Q62: of:=(VLOOKUP([.D63]; [.$L$58:.$M$61];2;1)) -> 1 | R62: of:=(VLOOKUP([.E63]; [.$L$58:.$M$61];2;1)) -> 2 | S62: of:=(VLOOKUP([.F63]; [.$L$58:.$M$61];2;1)) -> 4 | T62: of:=(VLOOKUP([.G63]; [.$L$58:.$M$61];2;1)) -> 4 | U62: of:=(VLOOKUP([.H63]; [.$L$58:.$M$61];2;1)) -> 1 | V62: of:=(VLOOKUP([.I63]; [.$L$58:.$M$61];2;1)) -> 1 | W62: of:=(VLOOKUP([.J63]; [.$L$58:.$M$61];2;1)) -> 2 | X62: of:=(VLOOKUP([.K63]; [.$L$58:.$M$61];2;1)) -> 4
A63: LiTiO | B63: of:=[.B$59] -> 47 | C63: of:=[.C$59] -> 1.75 | D63: 1 | E63: of:=[.E$59] -> 4 | F63: of:=[.F$59] -> 47 | G63: of:=[.G$59] -> 47 | H63: of:=[.H$59] -> 1.75 | I63: of:=[.I$59] -> 1 | J63: of:=[.J$59] -> 4 | K63: of:=[.K$59] -> 47 | N63: Mittelwert | O63: of:=AVERAGE([.O59:.X62]) -> 2.4
A64: Mittelwert | B64: of:=AVERAGE([.B60:.K63]) -> 20.15 | N64: Min | O64: of:=MIN([.O59:.X62]) -> 1
A65: Min | B65: of:=MIN([.B60:.K63]) -> 1 | N65: Max | O65: of:=MAX([.O59:.X62]) -> 4
A66: Max | B66: of:=MAX([.B60:.K63]) -> 47
B68: Positionierungsgenauigkeit Winkel | L68: Punktezuordnung Winkel | O68: Punkte Winkel
B69: 204 Opportunity | F69: 204 Overnight | G69: 192 Opportunity | K69: 192 Overnight | L69: Wert | M69: Punkte | O69: 204 Opportunity | S69: 204 Overnight | T69: 192 Opportunity | X69: 192 Overnight
B70: 40kW | C70: 375kW | D70: 200kW | E70: Swap | F70: 40kW | G70: 40kW | H70: 375kW | I70: 200kW | J70: Swap | K70: 40kW | L70: 0 | M70: 1 | O70: 40kW | P70: 375kW | Q70: 200kW | R70: Swap | S70: 40kW | T70: 40kW | U70: 375kW | V70: 200kW | W70: Swap | X70: 40kW
B71: 360 | C71: 2 | D71: 360 | E71: 1 | F71: of:=[.B71] -> 360 | G71: of:=[.B71] -> 360 | H71: of:=[.C71] -> 2 | I71: of:=[.D71] -> 360 | J71: of:=[.E71] -> 1 | K71: of:=[.F71] -> 360 | L71: 90 | M71: 2 | N71: 18650 | O71: of:=(VLOOKUP([.B72]; [.$L$70:.$M$73];2;1)) -> 4 | P71: of:=(VLOOKUP([.C72]; [.$L$70:.$M$73];2;1)) -> 1 | Q71: of:=(VLOOKUP([.D72]; [.$L$70:.$M$73];2;1)) -> 4 | R71: of:=(VLOOKUP([.E72]; [.$L$70:.$M$73];2;1)) -> 1 | S71: of:=(VLOOKUP([.F72]; [.$L$70:.$M$73];2;1)) -> 4 | T71: of:=(VLOOKUP([.G72]; [.$L$70:.$M$73];2;1)) -> 4 | U71: of:=(VLOOKUP([.H72]; [.$L$70:.$M$73];2;1)) -> 1 | V71: of:=(VLOOKUP([.I72]; [.$L$70:.$M$73];2;1)) -> 4 | W71: of:=(VLOOKUP([.J72]; [.$L$70:.$M$73];2;1)) -> 1 | X71: of:=(VLOOKUP([.K72]; [.$L$70:.$M$73];2;1)) -> 4
A72: 18650 | B72: of:=[.B$71] -> 360 | C72: 2 | D72: of:=[.D$71] -> 360 | E72: of:=[.E$71] -> 1 | F72: of:=[.F$71] -> 360 | G72: of:=[.G$71] -> 360 | H72: of:=[.H$71] -> 2 | I72: of:=[.I$71] -> 360 | J72: of:=[.J$71] -> 1 | K72: of:=[.K$71] -> 360 | L72: 180 | M72: 3 | N72: LFP-HE | O72: of:=(VLOOKUP([.B73]; [.$L$70:.$M$73];2;1)) -> 4 | P72: of:=(VLOOKUP([.C73]; [.$L$70:.$M$73];2;1)) -> 1 | Q72: of:=(VLOOKUP([.D73]; [.$L$70:.$M$73];2;1)) -> 4 | R72: of:=(VLOOKUP([.E73]; [.$L$70:.$M$73];2;1)) -> 1 | S72: of:=(VLOOKUP([.F73]; [.$L$70:.$M$73];2;1)) -> 4 | T72: of:=(VLOOKUP([.G73]; [.$L$70:.$M$73];2;1)) -> 4 | U72: of:=(VLOOKUP([.H73]; [.$L$70:.$M$73];2;1)) -> 1 | V72: of:=(VLOOKUP([.I73]; [.$L$70:.$M$73];2;1)) -> 4 | W72: of:=(VLOOKUP([.J73]; [.$L$70:.$M$73];2;1)) -> 1 | X72: of:=(VLOOKUP([.K73]; [.$L$70:.$M$73];2;1)) -> 4
A73: LFP-HE | B73: of:=[.B$71] -> 360 | C73: 2 | D73: of:=[.D$71] -> 360 | E73: of:=[.E$71] -> 1 | F73: of:=[.F$71] -> 360 | G73: of:=[.G$71] -> 360 | H73: of:=[.H$71] -> 2 | I73: of:=[.I$71] -> 360 | J73: of:=[.J$71] -> 1 | K73: of:=[.K$71] -> 360 | L73: 360 | M73: 4 | N73: LFP-HP | O73: of:=(VLOOKUP([.B74]; [.$L$70:.$M$73];2;1)) -> 4 | P73: of:=(VLOOKUP([.C74]; [.$L$70:.$M$73];2;1)) -> 1 | Q73: of:=(VLOOKUP([.D74]; [.$L$70:.$M$73];2;1)) -> 4 | R73: of:=(VLOOKUP([.E74]; [.$L$70:.$M$73];2;1)) -> 1 | S73: of:=(VLOOKUP([.F74]; [.$L$70:.$M$73];2;1)) -> 4 | T73: of:=(VLOOKUP([.G74]; [.$L$70:.$M$73];2;1)) -> 4 | U73: of:=(VLOOKUP([.H74]; [.$L$70:.$M$73];2;1)) -> 1 | V73: of:=(VLOOKUP([.I74]; [.$L$70:.$M$73];2;1)) -> 4 | W73: of:=(VLOOKUP([.J74]; [.$L$70:.$M$73];2;1)) -> 1 | X73: of:=(VLOOKUP([.K74]; [.$L$70:.$M$73];2;1)) -> 4
A74: LFP-HP | B74: of:=[.B$71] -> 360 | C74: 2 | D74: of:=[.D$71] -> 360 | E74: of:=[.E$71] -> 1 | F74: of:=[.F$71] -> 360 | G74: of:=[.G$71] -> 360 | H74: of:=[.H$71] -> 2 | I74: of:=[.I$71] -> 360 | J74: of:=[.J$71] -> 1 | K74: of:=[.K$71] -> 360 | L74: Gewichtung | M74: 3.333 | N74: LiTiO | O74: of:=(VLOOKUP([.B75]; [.$L$70:.$M$73];2;1)) -> 4 | P74: of:=(VLOOKUP([.C75]; [.$L$70:.$M$73];2;1)) -> 1 | Q74: of:=(VLOOKUP([.D75]; [.$L$70:.$M$73];2;1)) -> 4 | R74: of:=(VLOOKUP([.E75]; [.$L$70:.$M$73];2;1)) -> 1 | S74: of:=(VLOOKUP([.F75]; [.$L$70:.$M$73];2;1)) -> 4 | T74: of:=(VLOOKUP([.G75]; [.$L$70:.$M$73];2;1)) -> 4 | U74: of:=(VLOOKUP([.H75]; [.$L$70:.$M$73];2;1)) -> 1 | V74: of:=(VLOOKUP([.I75]; [.$L$70:.$M$73];2;1)) -> 4 | W74: of:=(VLOOKUP([.J75]; [.$L$70:.$M$73];2;1)) -> 1 | X74: of:=(VLOOKUP([.K75]; [.$L$70:.$M$73];2;1)) -> 4
A75: LiTiO | B75: of:=[.B$71] -> 360 | C75: 2 | D75: of:=[.D$71] -> 360 | E75: of:=[.E$71] -> 1 | F75: of:=[.F$71] -> 360 | G75: of:=[.G$71] -> 360 | H75: of:=[.H$71] -> 2 | I75: of:=[.I$71] -> 360 | J75: of:=[.J$71] -> 1 | K75: of:=[.K$71] -> 360 | N75: Mittelwert | O75: of:=AVERAGE([.O71:.X74]) -> 2.8
A76: Mittelwert | B76: of:=AVERAGE([.B72:.K75]) -> 216.6 | N76: Min | O76: of:=MIN([.O71:.X74]) -> 1
A77: Min | B77: of:=MIN([.B72:.K75]) -> 1 | N77: Max | O77: of:=MAX([.O71:.X74]) -> 4
A78: Max | B78: of:=MAX([.B72:.K75]) -> 360
B81: Ladezeit
B82: 204 Opportunity | F82: 204 Overnight | G82: 192 Opportunity | K82: 192 Overnight
B83: 40kW | C83: 375kW | D83: 200kW | E83: Swap | F83: 40kW | G83: 40kW | H83: 375kW | I83: 200kW | J83: Swap | K83: 40kW
A84: 18650 | B84: 2292 | C84: 2240 | D84: 2241 | E84: 420 | F84: 16910 | G84: 2301 | H84: 2249 | I84: 2250 | J84: 420 | K84: 19566
A85: LFP-HE | B85: 1542 | C85: 1078 | D85: 1079 | E85: 420 | F85: 14597 | G85: 1852 | H85: 1078 | I85: 1079 | J85: 420 | K85: 17160
A86: LFP-HP | B86: 2199 | C86: 2147 | D86: 2148 | E86: 420 | F86: 18227 | G86: 2197 | H86: 2145 | I86: 2147 | J86: 420 | K86: 20930
A87: LiTiO | B87: 1442 | C87: 489 | D87: 490 | E87: 420 | F87: 17562 | G87: 1704 | H87: 489 | I87: 490 | J87: 420 | K87: 20211
A88: Mittelwert | B88: of:=AVERAGE([.B84:.K87]) -> 4697.275
A89: Min | B89: of:=MIN([.B84:.K87]) -> 420
A90: Max | B90: of:=MAX([.B84:.K87]) -> 20930
A92: Fahrzeit 204 | B92: 4646 | D92: Fahrzeit 196 | E92: 3661 | J92: LZ Swap | K92: 420
B93: Fahrzeitanteil | L93: Punktezuordnung FZA | O93: Punkte FZA
B94: 204 Opportunity | F94: 204 Overnight | G94: 192 Opportunity | K94: 192 Overnight | L94: Wert | M94: Punkte | O94: 204 Opportunity | S94: 204 Overnight | T94: 192 Opportunity | X94: 192 Overnight
B95: 40kW | C95: 375kW | D95: 200kW | E95: Swap | F95: 40kW | G95: 40kW | H95: 375kW | I95: 200kW | J95: Swap | K95: 40kW | L95: 0 | M95: 1 | O95: 40kW | P95: 375kW | Q95: 200kW | R95: Swap | S95: 40kW | T95: 40kW | U95: 375kW | V95: 200kW | W95: Swap | X95: 40kW
A96: 18650 | B96: of:=[.$B$92]/([.B84]+[.$B$92]) -> 0.669645430959931 | C96: of:=[.$B$92]/([.C84]+[.$B$92]) -> 0.674702294510601 | D96: of:=[.$B$92]/([.D84]+[.$B$92]) -> 0.674604326992885 | E96: of:=[.$B$92]/([.E84]+[.$B$92]) -> 0.917094354520332 | F96: of:=(11*[.$B$92])/([.F84]+(11*[.$B$92])) -> 0.751382027758175 | G96: of:=[.$E$92]/([.G84]+[.$E$92]) -> 0.614055686011406 | H96: of:=[.$E$92]/([.H84]+[.$E$92]) -> 0.619458544839256 | I96: of:=[.$E$92]/([.I84]+[.$E$92]) -> 0.619353747250888 | J96: of:=[.$E$92]/([.J84]+[.$E$92]) -> 0.897084048027444 | K96: of:=(11*[.$E$92])/([.K84]+(11*[.$E$92])) -> 0.673011681735381 | L96: 0.6 | M96: 2 | N96: 18650 | O96: of:=(VLOOKUP([.B96]; [.$L$95:.$M$98];2;1)) -> 2 | P96: of:=(VLOOKUP([.C96]; [.$L$95:.$M$98];2;1)) -> 2 | Q96: of:=(VLOOKUP([.D96]; [.$L$95:.$M$98];2;1)) -> 2 | R96: of:=(VLOOKUP([.E96]; [.$L$95:.$M$98];2;1)) -> 4 | S96: of:=(VLOOKUP([.F96]; [.$L$95:.$M$98];2;1)) -> 3 | T96: of:=(VLOOKUP([.G96]; [.$L$95:.$M$98];2;1)) -> 2 | U96: of:=(VLOOKUP([.H96]; [.$L$95:.$M$98];2;1)) -> 2 | V96: of:=(VLOOKUP([.I96]; [.$L$95:.$M$98];2;1)) -> 2 | W96: of:=(VLOOKUP([.J96]; [.$L$95:.$M$98];2;1)) -> 3 | X96: of:=(VLOOKUP([.K96]; [.$L$95:.$M$98];2;1)) -> 2
A97: LFP-HE | B97: of:=[.$B$92]/([.B85]+[.$B$92]) -> 0.750808015513898 | C97: of:=[.$B$92]/([.C85]+[.$B$92]) -> 0.811670160726764 | D97: of:=[.$B$92]/([.D85]+[.$B$92]) -> 0.811528384279476 | E97: of:=[.$B$92]/([.E85]+[.$B$92]) -> 0.917094354520332 | F97: of:=(11*[.$B$92])/([.F85]+(11*[.$B$92])) -> 0.777833584463419 | G97: of:=[.$E$92]/([.G85]+[.$E$92]) -> 0.664066751315073 | H97: of:=[.$E$92]/([.H85]+[.$E$92]) -> 0.772525849335303 | I97: of:=[.$E$92]/([.I85]+[.$E$92]) -> 0.772362869198312 | J97: of:=[.$E$92]/([.J85]+[.$E$92]) -> 0.897084048027444 | K97: of:=(11*[.$E$92])/([.K85]+(11*[.$E$92])) -> 0.701206665389772 | L97: 0.75 | M97: 3 | N97: LFP-HE | O97: of:=(VLOOKUP([.B97]; [.$L$95:.$M$98];2;1)) -> 3 | P97: of:=(VLOOKUP([.C97]; [.$L$95:.$M$98];2;1)) -> 3 | Q97: of:=(VLOOKUP([.D97]; [.$L$95:.$M$98];2;1)) -> 3 | R97: of:=(VLOOKUP([.E97]; [.$L$95:.$M$98];2;1)) -> 4 | S97: of:=(VLOOKUP([.F97]; [.$L$95:.$M$98];2;1)) -> 3 | T97: of:=(VLOOKUP([.G97]; [.$L$95:.$M$98];2;1)) -> 2 | U97: of:=(VLOOKUP([.H97]; [.$L$95:.$M$98];2;1)) -> 3 | V97: of:=(VLOOKUP([.I97]; [.$L$95:.$M$98];2;1)) -> 3 | W97: of:=(VLOOKUP([.J97]; [.$L$95:.$M$98];2;1)) -> 3 | X97: of:=(VLOOKUP([.K97]; [.$L$95:.$M$98];2;1)) -> 2
A98: LFP-HP | B98: of:=[.$B$92]/([.B86]+[.$B$92]) -> 0.678743608473338 | C98: of:=[.$B$92]/([.C86]+[.$B$92]) -> 0.683939349330193 | D98: of:=[.$B$92]/([.D86]+[.$B$92]) -> 0.683838681189285 | E98: of:=[.$B$92]/([.E86]+[.$B$92]) -> 0.917094354520332 | F98: of:=(11*[.$B$92])/([.F86]+(11*[.$B$92])) -> 0.737109313025543 | G98: of:=[.$E$92]/([.G86]+[.$E$92]) -> 0.624957323318539 | H98: of:=[.$E$92]/([.H86]+[.$E$92]) -> 0.630554598691009 | I98: of:=[.$E$92]/([.I86]+[.$E$92]) -> 0.630337465564738 | J98: of:=[.$E$92]/([.J86]+[.$E$92]) -> 0.897084048027444 | K98: of:=(11*[.$E$92])/([.K86]+(11*[.$E$92])) -> 0.658012123984902 | L98: 0.9 | M98: 4 | N98: LFP-HP | O98: of:=(VLOOKUP([.B98]; [.$L$95:.$M$98];2;1)) -> 2 | P98: of:=(VLOOKUP([.C98]; [.$L$95:.$M$98];2;1)) -> 2 | Q98: of:=(VLOOKUP([.D98]; [.$L$95:.$M$98];2;1)) -> 2 | R98: of:=(VLOOKUP([.E98]; [.$L$95:.$M$98];2;1)) -> 4 | S98: of:=(VLOOKUP([.F98]; [.$L$95:.$M$98];2;1)) -> 2 | T98: of:=(VLOOKUP([.G98]; [.$L$95:.$M$98];2;1)) -> 2 | U98: of:=(VLOOKUP([.H98]; [.$L$95:.$M$98];2;1)) -> 2 | V98: of:=(VLOOKUP([.I98]; [.$L$95:.$M$98];2;1)) -> 2 | W98: of:=(VLOOKUP([.J98]; [.$L$95:.$M$98];2;1)) -> 3 | X98: of:=(VLOOKUP([.K98]; [.$L$95:.$M$98];2;1)) -> 2
A99: LiTiO | B99: of:=[.$B$92]/([.B87]+[.$B$92]) -> 0.763140604467806 | C99: of:=[.$B$92]/([.C87]+[.$B$92]) -> 0.9047711781889 | D99: of:=[.$B$92]/([.D87]+[.$B$92]) -> 0.904595015576324 | E99: of:=[.$B$92]/([.E87]+[.$B$92]) -> 0.917094354520332 | F99: of:=(11*[.$B$92])/([.F87]+(11*[.$B$92])) -> 0.74424768451098 | G99: of:=[.$E$92]/([.G87]+[.$E$92]) -> 0.682385834109972 | H99: of:=[.$E$92]/([.H87]+[.$E$92]) -> 0.882168674698795 | I99: of:=[.$E$92]/([.I87]+[.$E$92]) -> 0.881956155143339 | J99: of:=[.$E$92]/([.J87]+[.$E$92]) -> 0.897084048027444 | K99: of:=(11*[.$E$92])/([.K87]+(11*[.$E$92])) -> 0.66583446314606 | L99: Gewichtung | M99: 6.666 | N99: LiTiO | O99: of:=(VLOOKUP([.B99]; [.$L$95:.$M$98];2;1)) -> 3 | P99: of:=(VLOOKUP([.C99]; [.$L$95:.$M$98];2;1)) -> 4 | Q99: of:=(VLOOKUP([.D99]; [.$L$95:.$M$98];2;1)) -> 4 | R99: of:=(VLOOKUP([.E99]; [.$L$95:.$M$98];2;1)) -> 4 | S99: of:=(VLOOKUP([.F99]; [.$L$95:.$M$98];2;1)) -> 2 | T99: of:=(VLOOKUP([.G99]; [.$L$95:.$M$98];2;1)) -> 2 | U99: of:=(VLOOKUP([.H99]; [.$L$95:.$M$98];2;1)) -> 3 | V99: of:=(VLOOKUP([.I99]; [.$L$95:.$M$98];2;1)) -> 3 | W99: of:=(VLOOKUP([.J99]; [.$L$95:.$M$98];2;1)) -> 3 | X99: of:=(VLOOKUP([.K99]; [.$L$95:.$M$98];2;1)) -> 2
A100: Mittelwert | B100: of:=AVERAGE([.B96:.K99]) -> 0.759288042597284 | N100: Mittelwert | O100: of:=AVERAGE([.O96:.X99]) -> 2.65
A101: Min | B101: of:=MIN([.B96:.K99]) -> 0.614055686011406 | N101: Min | O101: of:=MIN([.O96:.X99]) -> 2
A102: Max | B102: of:=MAX([.B96:.K99]) -> 0.917094354520332 | N102: Max | O102: of:=MAX([.O96:.X99]) -> 4
B104: Freiheitsgrade | L104: Punktezuordnung FHG | O104: Punkte Winkel
B105: 204 Opportunity | F105: 204 Overnight | G105: 192 Opportunity | K105: 192 Overnight | L105: Wert | M105: Punkte | O105: 204 Opportunity | S105: 204 Overnight | T105: 192 Opportunity | X105: 192 Overnight
B106: 40kW | C106: 375kW | D106: 200kW | E106: Swap | F106: 40kW | G106: 40kW | H106: 375kW | I106: 200kW | J106: Swap | K106: 40kW | L106: 0 | M106: 4 | O106: 40kW | P106: 375kW | Q106: 200kW | R106: Swap | S106: 40kW | T106: 40kW | U106: 375kW | V106: 200kW | W106: Swap | X106: 40kW
B107: 0 | C107: 3 | D107: 1 | E107: 4 | F107: of:=[.B107] -> 0 | G107: of:=[.B107] -> 0 | H107: of:=[.C107] -> 3 | I107: of:=[.D107] -> 1 | J107: of:=[.E107] -> 4 | K107: of:=[.F107] -> 0 | L107: 1 | M107: 3 | N107: 18650 | O107: of:=(VLOOKUP([.B108]; [.$L$106:.$M$109];2;1)) -> 4 | P107: of:=(VLOOKUP([.C108]; [.$L$106:.$M$109];2;1)) -> 1 | Q107: of:=(VLOOKUP([.D108]; [.$L$106:.$M$109];2;1)) -> 3 | R107: of:=(VLOOKUP([.E108]; [.$L$106:.$M$109];2;1)) -> 1 | S107: of:=(VLOOKUP([.F108]; [.$L$106:.$M$109];2;1)) -> 4 | T107: of:=(VLOOKUP([.G108]; [.$L$106:.$M$109];2;1)) -> 4 | U107: of:=(VLOOKUP([.H108]; [.$L$106:.$M$109];2;1)) -> 1 | V107: of:=(VLOOKUP([.I108]; [.$L$106:.$M$109];2;1)) -> 3 | W107: of:=(VLOOKUP([.J108]; [.$L$106:.$M$109];2;1)) -> 1 | X107: of:=(VLOOKUP([.K108]; [.$L$106:.$M$109];2;1)) -> 4
A108: 18650 | B108: of:=[.B$107] -> 0 | C108: of:=[.C$107] -> 3 | D108: of:=[.D$107] -> 1 | E108: of:=[.E$107] -> 4 | F108: of:=[.F$107] -> 0 | G108: of:=[.G$107] -> 0 | H108: of:=[.H$107] -> 3 | I108: of:=[.I$107] -> 1 | J108: of:=[.J$107] -> 4 | K108: of:=[.K$107] -> 0 | L108: 2 | M108: 2 | N108: LFP-HE | O108: of:=(VLOOKUP([.B109]; [.$L$106:.$M$109];2;1)) -> 4 | P108: of:=(VLOOKUP([.C109]; [.$L$106:.$M$109];2;1)) -> 1 | Q108: of:=(VLOOKUP([.D109]; [.$L$106:.$M$109];2;1)) -> 3 | R108: of:=(VLOOKUP([.E109]; [.$L$106:.$M$109];2;1)) -> 1 | S108: of:=(VLOOKUP([.F109]; [.$L$106:.$M$109];2;1)) -> 4 | T108: of:=(VLOOKUP([.G109]; [.$L$106:.$M$109];2;1)) -> 4 | U108: of:=(VLOOKUP([.H109]; [.$L$106:.$M$109];2;1)) -> 1 | V108: of:=(VLOOKUP([.I109]; [.$L$106:.$M$109];2;1)) -> 3 | W108: of:=(VLOOKUP([.J109]; [.$L$106:.$M$109];2;1)) -> 1 | X108: of:=(VLOOKUP([.K109]; [.$L$106:.$M$109];2;1)) -> 4
A109: LFP-HE | B109: of:=[.B$107] -> 0 | C109: of:=[.C$107] -> 3 | D109: of:=[.D$107] -> 1 | E109: of:=[.E$107] -> 4 | F109: of:=[.F$107] -> 0 | G109: of:=[.G$107] -> 0 | H109: of:=[.H$107] -> 3 | I109: of:=[.I$107] -> 1 | J109: of:=[.J$107] -> 4 | K109: of:=[.K$107] -> 0 | L109: 3 | M109: 1 | N109: LFP-HP | O109: of:=(VLOOKUP([.B110]; [.$L$106:.$M$109];2;1)) -> 4 | P109: of:=(VLOOKUP([.C110]; [.$L$106:.$M$109];2;1)) -> 1 | Q109: of:=(VLOOKUP([.D110]; [.$L$106:.$M$109];2;1)) -> 3 | R109: of:=(VLOOKUP([.E110]; [.$L$106:.$M$109];2;1)) -> 1 | S109: of:=(VLOOKUP([.F110]; [.$L$106:.$M$109];2;1)) -> 4 | T109: of:=(VLOOKUP([.G110]; [.$L$106:.$M$109];2;1)) -> 4 | U109: of:=(VLOOKUP([.H110]; [.$L$106:.$M$109];2;1)) -> 1 | V109: of:=(VLOOKUP([.I110]; [.$L$106:.$M$109];2;1)) -> 3 | W109: of:=(VLOOKUP([.J110]; [.$L$106:.$M$109];2;1)) -> 1 | X109: of:=(VLOOKUP([.K110]; [.$L$106:.$M$109];2;1)) -> 4
A110: LFP-HP | B110: of:=[.B$107] -> 0 | C110: of:=[.C$107] -> 3 | D110: of:=[.D$107] -> 1 | E110: of:=[.E$107] -> 4 | F110: of:=[.F$107] -> 0 | G110: of:=[.G$107] -> 0 | H110: of:=[.H$107] -> 3 | I110: of:=[.I$107] -> 1 | J110: of:=[.J$107] -> 4 | K110: of:=[.K$107] -> 0 | L110: Gewichtung | M110: 3.333 | N110: LiTiO | O110: of:=(VLOOKUP([.B111]; [.$L$106:.$M$109];2;1)) -> 4 | P110: of:=(VLOOKUP([.C111]; [.$L$106:.$M$109];2;1)) -> 1 | Q110: of:=(VLOOKUP([.D111]; [.$L$106:.$M$109];2;1)) -> 3 | R110: of:=(VLOOKUP([.E111]; [.$L$106:.$M$109];2;1)) -> 1 | S110: of:=(VLOOKUP([.F111]; [.$L$106:.$M$109];2;1)) -> 4 | T110: of:=(VLOOKUP([.G111]; [.$L$106:.$M$109];2;1)) -> 4 | U110: of:=(VLOOKUP([.H111]; [.$L$106:.$M$109];2;1)) -> 1 | V110: of:=(VLOOKUP([.I111]; [.$L$106:.$M$109];2;1)) -> 3 | W110: of:=(VLOOKUP([.J111]; [.$L$106:.$M$109];2;1)) -> 1 | X110: of:=(VLOOKUP([.K111]; [.$L$106:.$M$109];2;1)) -> 4
A111: LiTiO | B111: of:=[.B$107] -> 0 | C111: of:=[.C$107] -> 3 | D111: of:=[.D$107] -> 1 | E111: of:=[.E$107] -> 4 | F111: of:=[.F$107] -> 0 | G111: of:=[.G$107] -> 0 | H111: of:=[.H$107] -> 3 | I111: of:=[.I$107] -> 1 | J111: of:=[.J$107] -> 4 | K111: of:=[.K$107] -> 0 | N111: Mittelwert | O111: of:=AVERAGE([.O107:.X110]) -> 2.6
A112: Mittelwert | B112: of:=AVERAGE([.B108:.K111]) -> 1.6 | N112: Min | O112: of:=MIN([.O107:.X110]) -> 1
A113: Min | B113: of:=MIN([.B108:.K111]) -> 0 | N113: Max | O113: of:=MAX([.O107:.X110]) -> 4
A114: Max | B114: of:=MAX([.B108:.K111]) -> 4
B116: Zugänglichkeit Fahrzeug | L116: Punktezuordnung Z-FZG | O116: Punkte Zugänglichekti Fzg
B117: 204 Opportunity | F117: 204 Overnight | G117: 192 Opportunity | K117: 192 Overnight | L117: Wert | M117: Punkte | O117: 204 Opportunity | S117: 204 Overnight | T117: 192 Opportunity | X117: 192 Overnight
B118: 40kW | C118: 375kW | D118: 200kW | E118: Swap | F118: 40kW | G118: 40kW | H118: 375kW | I118: 200kW | J118: Swap | K118: 40kW | L118: dach | M118: 4 | O118: 40kW | P118: 375kW | Q118: 200kW | R118: Swap | S118: 40kW | T118: 40kW | U118: 375kW | V118: 200kW | W118: Swap | X118: 40kW
B119: seite | C119: dach | D119: unten | E119: seite | F119: seite | G119: of:=[.B119] -> seite | H119: of:=[.C119] -> dach | I119: of:=[.D119] -> unten | J119: of:=[.E119] -> seite | K119: of:=[.F119] -> seite | L119: unten | M119: 3 | N119: 18650 | O119: of:=(VLOOKUP([.B120]; [.$L$118:.$M$120];2;0)) -> 2 | P119: of:=(VLOOKUP([.C120]; [.$L$118:.$M$120];2;0)) -> 4 | Q119: of:=(VLOOKUP([.D120]; [.$L$118:.$M$120];2;0)) -> 3 | R119: of:=(VLOOKUP([.E120]; [.$L$118:.$M$120];2;0)) -> 2 | S119: of:=(VLOOKUP([.F120]; [.$L$118:.$M$120];2;0)) -> 2 | T119: of:=(VLOOKUP([.G120]; [.$L$118:.$M$120];2;0)) -> 2 | U119: of:=(VLOOKUP([.H120]; [.$L$118:.$M$120];2;0)) -> 4 | V119: of:=(VLOOKUP([.I120]; [.$L$118:.$M$120];2;0)) -> 3 | W119: of:=(VLOOKUP([.J120]; [.$L$118:.$M$120];2;0)) -> 2 | X119: of:=(VLOOKUP([.K120]; [.$L$118:.$M$120];2;0)) -> 2
A120: 18650 | B120: seite | C120: dach | D120: unten | E120: seite | F120: seite | G120: of:=[.B120] -> seite | H120: of:=[.C120] -> dach | I120: of:=[.D120] -> unten | J120: of:=[.E120] -> seite | K120: of:=[.F120] -> seite | L120: seite | M120: 2 | N120: LFP-HE | O120: of:=(VLOOKUP([.B121]; [.$L$118:.$M$120];2;0)) -> 2 | P120: of:=(VLOOKUP([.C121]; [.$L$118:.$M$120];2;0)) -> 4 | Q120: of:=(VLOOKUP([.D121]; [.$L$118:.$M$120];2;0)) -> 3 | R120: of:=(VLOOKUP([.E121]; [.$L$118:.$M$120];2;0)) -> 2 | S120: of:=(VLOOKUP([.F121]; [.$L$118:.$M$120];2;0)) -> 2 | T120: of:=(VLOOKUP([.G121]; [.$L$118:.$M$120];2;0)) -> 2 | U120: of:=(VLOOKUP([.H121]; [.$L$118:.$M$120];2;0)) -> 4 | V120: of:=(VLOOKUP([.I121]; [.$L$118:.$M$120];2;0)) -> 3 | W120: of:=(VLOOKUP([.J121]; [.$L$118:.$M$120];2;0)) -> 2 | X120: of:=(VLOOKUP([.K121]; [.$L$118:.$M$120];2;0)) -> 2
A121: LFP-HE | B121: seite | C121: dach | D121: unten | E121: seite | F121: seite | G121: of:=[.B121] -> seite | H121: of:=[.C121] -> dach | I121: of:=[.D121] -> unten | J121: of:=[.E121] -> seite | K121: of:=[.F121] -> seite | M121: 1 | N121: LFP-HP | O121: of:=(VLOOKUP([.B122]; [.$L$118:.$M$120];2;0)) -> 2 | P121: of:=(VLOOKUP([.C122]; [.$L$118:.$M$120];2;0)) -> 4 | Q121: of:=(VLOOKUP([.D122]; [.$L$118:.$M$120];2;0)) -> 3 | R121: of:=(VLOOKUP([.E122]; [.$L$118:.$M$120];2;0)) -> 2 | S121: of:=(VLOOKUP([.F122]; [.$L$118:.$M$120];2;0)) -> 2 | T121: of:=(VLOOKUP([.G122]; [.$L$118:.$M$120];2;0)) -> 2 | U121: of:=(VLOOKUP([.H122]; [.$L$118:.$M$120];2;0)) -> 4 | V121: of:=(VLOOKUP([.I122]; [.$L$118:.$M$120];2;0)) -> 3 | W121: of:=(VLOOKUP([.J122]; [.$L$118:.$M$120];2;0)) -> 2 | X121: of:=(VLOOKUP([.K122]; [.$L$118:.$M$120];2;0)) -> 2
A122: LFP-HP | B122: seite | C122: dach | D122: unten | E122: seite | F122: seite | G122: of:=[.B122] -> seite | H122: of:=[.C122] -> dach | I122: of:=[.D122] -> unten | J122: of:=[.E122] -> seite | K122: of:=[.F122] -> seite | L122: Gewichtung | M122: 3.333 | N122: LiTiO | O122: of:=(VLOOKUP([.B123]; [.$L$118:.$M$120];2;0)) -> 2 | P122: of:=(VLOOKUP([.C123]; [.$L$118:.$M$120];2;0)) -> 4 | Q122: of:=(VLOOKUP([.D123]; [.$L$118:.$M$120];2;0)) -> 3 | R122: of:=(VLOOKUP([.E123]; [.$L$118:.$M$120];2;0)) -> 2 | S122: of:=(VLOOKUP([.F123]; [.$L$118:.$M$120];2;0)) -> 2 | T122: of:=(VLOOKUP([.G123]; [.$L$118:.$M$120];2;0)) -> 2 | U122: of:=(VLOOKUP([.H123]; [.$L$118:.$M$120];2;0)) -> 4 | V122: of:=(VLOOKUP([.I123]; [.$L$118:.$M$120];2;0)) -> 3 | W122: of:=(VLOOKUP([.J123]; [.$L$118:.$M$120];2;0)) -> 2 | X122: of:=(VLOOKUP([.K123]; [.$L$118:.$M$120];2;0)) -> 2
A123: LiTiO | B123: seite | C123: dach | D123: unten | E123: seite | F123: seite | G123: of:=[.B123] -> seite | H123: of:=[.C123] -> dach | I123: of:=[.D123] -> unten | J123: of:=[.E123] -> seite | K123: of:=[.F123] -> seite | N123: Mittelwert | O123: of:=AVERAGE([.O119:.X122]) -> 2.6
A124: Mittelwert | B124: of:=AVERAGE([.B120:.K123]) ->  | N124: Min | O124: of:=MIN([.O119:.X122]) -> 2
A125: Min | B125: of:=MIN([.B120:.K123]) -> 0 | N125: Max | O125: of:=MAX([.O119:.X122]) -> 4
A126: Max | B126: of:=MAX([.B120:.K123]) -> 0
B128: Exponierte Leiter | L128: Punktezuordnung expLeiter | O128: Punkte exponierte Leiter
B129: 204 Opportunity | F129: 204 Overnight | G129: 192 Opportunity | K129: 192 Overnight | L129: Wert | M129: Punkte | O129: 204 Opportunity | S129: 204 Overnight | T129: 192 Opportunity | X129: 192 Overnight
B130: 40kW | C130: 375kW | D130: 200kW | E130: Swap | F130: 40kW | G130: 40kW | H130: 375kW | I130: 200kW | J130: Swap | K130: 40kW | L130: nie | M130: 4 | O130: 40kW | P130: 375kW | Q130: 200kW | R130: Swap | S130: 40kW | T130: 40kW | U130: 375kW | V130: 200kW | W130: Swap | X130: 40kW
B131: nie | C131: nurLaden | D131: nie | E131: nie | F131: of:=[.B131] -> nie | G131: of:=[.B131] -> nie | H131: of:=[.C131] -> nurLaden | I131: of:=[.D131] -> nie | J131: of:=[.E131] -> nie | K131: of:=[.F131] -> nie | L131: nurLaden | M131: 3 | N131: 18650 | O131: of:=(VLOOKUP([.B132]; [.$L$130:.$M$132];2;0)) -> 4 | P131: of:=(VLOOKUP([.C132]; [.$L$130:.$M$132];2;0)) -> 3 | Q131: of:=(VLOOKUP([.D132]; [.$L$130:.$M$132];2;0)) -> 4 | R131: of:=(VLOOKUP([.E132]; [.$L$130:.$M$132];2;0)) -> 4 | S131: of:=(VLOOKUP([.F132]; [.$L$130:.$M$132];2;0)) -> 4 | T131: of:=(VLOOKUP([.G132]; [.$L$130:.$M$132];2;0)) -> 4 | U131: of:=(VLOOKUP([.H132]; [.$L$130:.$M$132];2;0)) -> 3 | V131: of:=(VLOOKUP([.I132]; [.$L$130:.$M$132];2;0)) -> 4 | W131: of:=(VLOOKUP([.J132]; [.$L$130:.$M$132];2;0)) -> 4 | X131: of:=(VLOOKUP([.K132]; [.$L$130:.$M$132];2;0)) -> 4
A132: 18650 | B132: nie | C132: nurLaden | D132: nie | E132: nie | F132: of:=[.B132] -> nie | G132: of:=[.B132] -> nie | H132: of:=[.C132] -> nurLaden | I132: of:=[.D132] -> nie | J132: of:=[.E132] -> nie | K132: of:=[.F132] -> nie | L132: immer | M132: 1 | N132: LFP-HE | O132: of:=(VLOOKUP([.B133]; [.$L$130:.$M$132];2;0)) -> 4 | P132: of:=(VLOOKUP([.C133]; [.$L$130:.$M$132];2;0)) -> 3 | Q132: of:=(VLOOKUP([.D133]; [.$L$130:.$M$132];2;0)) -> 4 | R132: of:=(VLOOKUP([.E133]; [.$L$130:.$M$132];2;0)) -> 4 | S132: of:=(VLOOKUP([.F133]; [.$L$130:.$M$132];2;0)) -> 4 | T132: of:=(VLOOKUP([.G133]; [.$L$130:.$M$132];2;0)) -> 4 | U132: of:=(VLOOKUP([.H133]; [.$L$130:.$M$132];2;0)) -> 3 | V132: of:=(VLOOKUP([.I133]; [.$L$130:.$M$132];2;0)) -> 4 | W132: of:=(VLOOKUP([.J133]; [.$L$130:.$M$132];2;0)) -> 4 | X132: of:=(VLOOKUP([.K133]; [.$L$130:.$M$132];2;0)) -> 4
A133: LFP-HE | B133: nie | C133: nurLaden | D133: nie | E133: nie | F133: of:=[.B133] -> nie | G133: of:=[.B133] -> nie | H133: of:=[.C133] -> nurLaden | I133: of:=[.D133] -> nie | J133: of:=[.E133] -> nie | K133: of:=[.F133] -> nie | L133: Gewichtung | M133: 6.666 | N133: LFP-HP | O133: of:=(VLOOKUP([.B134]; [.$L$130:.$M$132];2;0)) -> 4 | P133: of:=(VLOOKUP([.C134]; [.$L$130:.$M$132];2;0)) -> 3 | Q133: of:=(VLOOKUP([.D134]; [.$L$130:.$M$132];2;0)) -> 4 | R133: of:=(VLOOKUP([.E134]; [.$L$130:.$M$132];2;0)) -> 4 | S133: of:=(VLOOKUP([.F134]; [.$L$130:.$M$132];2;0)) -> 4 | T133: of:=(VLOOKUP([.G134]; [.$L$130:.$M$132];2;0)) -> 4 | U133: of:=(VLOOKUP([.H134]; [.$L$130:.$M$132];2;0)) -> 3 | V133: of:=(VLOOKUP([.I134]; [.$L$130:.$M$132];2;0)) -> 4 | W133: of:=(VLOOKUP([.J134]; [.$L$130:.$M$132];2;0)) -> 4 | X133: of:=(VLOOKUP([.K134]; [.$L$130:.$M$132];2;0)) -> 4
A134: LFP-HP | B134: nie | C134: nurLaden | D134: nie | E134: nie | F134: of:=[.B134] -> nie | G134: of:=[.B134] -> nie | H134: of:=[.C134] -> nurLaden | I134: of:=[.D134] -> nie | J134: of:=[.E134] -> nie | K134: of:=[.F134] -> nie | N134: LiTiO | O134: of:=(VLOOKUP([.B135]; [.$L$130:.$M$132];2;0)) -> 4 | P134: of:=(VLOOKUP([.C135]; [.$L$130:.$M$132];2;0)) -> 3 | Q134: of:=(VLOOKUP([.D135]; [.$L$130:.$M$132];2;0)) -> 4 | R134: of:=(VLOOKUP([.E135]; [.$L$130:.$M$132];2;0)) -> 4 | S134: of:=(VLOOKUP([.F135]; [.$L$130:.$M$132];2;0)) -> 4 | T134: of:=(VLOOKUP([.G135]; [.$L$130:.$M$132];2;0)) -> 4 | U134: of:=(VLOOKUP([.H135]; [.$L$130:.$M$132];2;0)) -> 3 | V134: of:=(VLOOKUP([.I135]; [.$L$130:.$M$132];2;0)) -> 4 | W134: of:=(VLOOKUP([.J135]; [.$L$130:.$M$132];2;0)) -> 4 | X134: of:=(VLOOKUP([.K135]; [.$L$130:.$M$132];2;0)) -> 4
A135: LiTiO | B135: nie | C135: nurLaden | D135: nie | E135: nie | F135: of:=[.B135] -> nie | G135: of:=[.B135] -> nie | H135: of:=[.C135] -> nurLaden | I135: of:=[.D135] -> nie | J135: of:=[.E135] -> nie | K135: of:=[.F135] -> nie | N135: Mittelwert | O135: of:=AVERAGE([.O131:.X134]) -> 3.8
A136: Mittelwert | B136: of:=AVERAGE([.B132:.K135]) ->  | N136: Min | O136: of:=MIN([.O131:.X134]) -> 3
A137: Min | B137: of:=MIN([.B132:.K135]) -> 0 | N137: Max | O137: of:=MAX([.O131:.X134]) -> 4
A138: Max | B138: of:=MAX([.B132:.K135]) -> 0
B140: Zugänglihckeit Ladestaion | L140: Punktezuordnung zugLade | O140: Punte Zuänglichkeit Ladestation
B141: 204 Opportunity | F141: 204 Overnight | G141: 192 Opportunity | K141: 192 Overnight | L141: Wert | M141: Punkte | O141: 204 Opportunity | S141: 204 Overnight | T141: 192 Opportunity | X141: 192 Overnight
B142: 40kW | C142: 375kW | D142: 200kW | E142: Swap | F142: 40kW | G142: 40kW | H142: 375kW | I142: 200kW | J142: Swap | K142: 40kW | L142: unzugänglich | M142: 4 | O142: 40kW | P142: 375kW | Q142: 200kW | R142: Swap | S142: 40kW | T142: 40kW | U142: 375kW | V142: 200kW | W142: Swap | X142: 40kW
B143: ebenerdig | C143: erhöht | D143: unterflur | E143: unzugänglich | F143: of:=[.B143] -> ebenerdig | G143: of:=[.B143] -> ebenerdig | H143: of:=[.C143] -> erhöht | I143: of:=[.D143] -> unterflur | J143: of:=[.E143] -> unzugänglich | K143: of:=[.F143] -> ebenerdig | L143: unterflur | M143: 3 | N143: 18650 | O143: of:=(VLOOKUP([.B144]; [.$L$142:.$M$145];2;0)) -> 1 | P143: of:=(VLOOKUP([.C144]; [.$L$142:.$M$145];2;0)) -> 2 | Q143: of:=(VLOOKUP([.D144]; [.$L$142:.$M$145];2;0)) -> 3 | R143: of:=(VLOOKUP([.E144]; [.$L$142:.$M$145];2;0)) -> 4 | S143: of:=(VLOOKUP([.F144]; [.$L$142:.$M$145];2;0)) -> 1 | T143: of:=(VLOOKUP([.G144]; [.$L$142:.$M$145];2;0)) -> 1 | U143: of:=(VLOOKUP([.H144]; [.$L$142:.$M$145];2;0)) -> 2 | V143: of:=(VLOOKUP([.I144]; [.$L$142:.$M$145];2;0)) -> 3 | W143: of:=(VLOOKUP([.J144]; [.$L$142:.$M$145];2;0)) -> 4 | X143: of:=(VLOOKUP([.K144]; [.$L$142:.$M$145];2;0)) -> 1
A144: 18650 | B144: ebenerdig | C144: erhöht | D144: unterflur | E144: unzugänglich | F144: of:=[.B144] -> ebenerdig | G144: of:=[.B144] -> ebenerdig | H144: of:=[.C144] -> erhöht | I144: of:=[.D144] -> unterflur | J144: of:=[.E144] -> unzugänglich | K144: of:=[.F144] -> ebenerdig | L144: erhöht | M144: 2 | N144: LFP-HE | O144: of:=(VLOOKUP([.B145]; [.$L$142:.$M$145];2;0)) -> 1 | P144: of:=(VLOOKUP([.C145]; [.$L$142:.$M$145];2;0)) -> 2 | Q144: of:=(VLOOKUP([.D145]; [.$L$142:.$M$145];2;0)) -> 3 | R144: of:=(VLOOKUP([.E145]; [.$L$142:.$M$145];2;0)) -> 4 | S144: of:=(VLOOKUP([.F145]; [.$L$142:.$M$145];2;0)) -> 1 | T144: of:=(VLOOKUP([.G145]; [.$L$142:.$M$145];2;0)) -> 1 | U144: of:=(VLOOKUP([.H145]; [.$L$142:.$M$145];2;0)) -> 2 | V144: of:=(VLOOKUP([.I145]; [.$L$142:.$M$145];2;0)) -> 3 | W144: of:=(VLOOKUP([.J145]; [.$L$142:.$M$145];2;0)) -> 4 | X144: of:=(VLOOKUP([.K145]; [.$L$142:.$M$145];2;0)) -> 1
A145: LFP-HE | B145: ebenerdig | C145: erhöht | D145: unterflur | E145: unzugänglich | F145: of:=[.B145] -> ebenerdig | G145: of:=[.B145] -> ebenerdig | H145: of:=[.C145] -> erhöht | I145: of:=[.D145] -> unterflur | J145: of:=[.E145] -> unzugänglich | K145: of:=[.F145] -> ebenerdig | L145: ebenerdig | M145: 1 | N145: LFP-HP | O145: of:=(VLOOKUP([.B146]; [.$L$142:.$M$145];2;0)) -> 1 | P145: of:=(VLOOKUP([.C146]; [.$L$142:.$M$145];2;0)) -> 2 | Q145: of:=(VLOOKUP([.D146]; [.$L$142:.$M$145];2;0)) -> 3 | R145: of:=(VLOOKUP([.E146]; [.$L$142:.$M$145];2;0)) -> 4 | S145: of:=(VLOOKUP([.F146]; [.$L$142:.$M$145];2;0)) -> 1 | T145: of:=(VLOOKUP([.G146]; [.$L$142:.$M$145];2;0)) -> 1 | U145: of:=(VLOOKUP([.H146]; [.$L$142:.$M$145];2;0)) -> 2 | V145: of:=(VLOOKUP([.I146]; [.$L$142:.$M$145];2;0)) -> 3 | W145: of:=(VLOOKUP([.J146]; [.$L$142:.$M$145];2;0)) -> 4 | X145: of:=(VLOOKUP([.K146]; [.$L$142:.$M$145];2;0)) -> 1
A146: LFP-HP | B146: ebenerdig | C146: erhöht | D146: unterflur | E146: unzugänglich | F146: of:=[.B146] -> ebenerdig | G146: of:=[.B146] -> ebenerdig | H146: of:=[.C146] -> erhöht | I146: of:=[.D146] -> unterflur | J146: of:=[.E146] -> unzugänglich | K146: of:=[.F146] -> ebenerdig | L146: Gewichtung | M146: 6.666 | N146: LiTiO | O146: of:=(VLOOKUP([.B147]; [.$L$142:.$M$145];2;0)) -> 1 | P146: of:=(VLOOKUP([.C147]; [.$L$142:.$M$145];2;0)) -> 2 | Q146: of:=(VLOOKUP([.D147]; [.$L$142:.$M$145];2;0)) -> 3 | R146: of:=(VLOOKUP([.E147]; [.$L$142:.$M$145];2;0)) -> 4 | S146: of:=(VLOOKUP([.F147]; [.$L$142:.$M$145];2;0)) -> 1 | T146: of:=(VLOOKUP([.G147]; [.$L$142:.$M$145];2;0)) -> 1 | U146: of:=(VLOOKUP([.H147]; [.$L$142:.$M$145];2;0)) -> 2 | V146: of:=(VLOOKUP([.I147]; [.$L$142:.$M$145];2;0)) -> 3 | W146: of:=(VLOOKUP([.J147]; [.$L$142:.$M$145];2;0)) -> 4 | X146: of:=(VLOOKUP([.K147]; [.$L$142:.$M$145];2;0)) -> 1
A147: LiTiO | B147: ebenerdig | C147: erhöht | D147: unterflur | E147: unzugänglich | F147: of:=[.B147] -> ebenerdig | G147: of:=[.B147] -> ebenerdig | H147: of:=[.C147] -> erhöht | I147: of:=[.D147] -> unterflur | J147: of:=[.E147] -> unzugänglich | K147: of:=[.F147] -> ebenerdig | N147: Mittelwert | O147: of:=AVERAGE([.O143:.X146]) -> 2.2
A148: Mittelwert | B148: of:=AVERAGE([.B144:.K147]) ->  | N148: Min | O148: of:=MIN([.O143:.X146]) -> 1
A149: Min | B149: of:=MIN([.B144:.K147]) -> 0 | N149: Max | O149: of:=MAX([.O143:.X146]) -> 4
A150: Max | B150: of:=MAX([.B144:.K147]) -> 0
B152: Volumen LS fest | L152: Punktezuordnung Vol LS fest | O152: Punkte Volumen LS fest
B153: 204 Opportunity | F153: 204 Overnight | G153: 192 Opportunity | K153: 192 Overnight | L153: Wert | M153: Punkte | O153: 204 Opportunity | S153: 204 Overnight | T153: 192 Opportunity | X153: 192 Overnight
B154: 40kW | C154: 375kW | D154: 200kW | E154: Swap | F154: 40kW | G154: 40kW | H154: 375kW | I154: 200kW | J154: Swap | K154: 40kW | L154: 0 | M154: 4 | O154: 40kW | P154: 375kW | Q154: 200kW | R154: Swap | S154: 40kW | T154: 40kW | U154: 375kW | V154: 200kW | W154: Swap | X154: 40kW
B155: 0 | C155: 1000 | D155: 1000 | E155: 0 | F155: of:=[.B155] -> 0 | G155: of:=[.B155] -> 0 | H155: of:=[.C155] -> 1000 | I155: of:=[.D155] -> 1000 | J155: of:=[.E155] -> 0 | K155: of:=[.F155] -> 0 | L155: 250 | M155: 3 | N155: 18650 | O155: of:=(VLOOKUP([.B156]; [.$L$154:.$M$157];2;1)) -> 4 | P155: of:=(VLOOKUP([.C156]; [.$L$154:.$M$157];2;1)) -> 1 | Q155: of:=(VLOOKUP([.D156]; [.$L$154:.$M$157];2;1)) -> 1 | R155: of:=(VLOOKUP([.E156]; [.$L$154:.$M$157];2;1)) -> 4 | S155: of:=(VLOOKUP([.F156]; [.$L$154:.$M$157];2;1)) -> 4 | T155: of:=(VLOOKUP([.G156]; [.$L$154:.$M$157];2;1)) -> 4 | U155: of:=(VLOOKUP([.H156]; [.$L$154:.$M$157];2;1)) -> 1 | V155: of:=(VLOOKUP([.I156]; [.$L$154:.$M$157];2;1)) -> 1 | W155: of:=(VLOOKUP([.J156]; [.$L$154:.$M$157];2;1)) -> 4 | X155: of:=(VLOOKUP([.K156]; [.$L$154:.$M$157];2;1)) -> 4
A156: 18650 | B156: of:=[.B$155] -> 0 | C156: of:=[.C$155] -> 1000 | D156: of:=[.D$155] -> 1000 | E156: of:=[.E$155] -> 0 | F156: of:=[.F$155] -> 0 | G156: of:=[.G$155] -> 0 | H156: of:=[.H$155] -> 1000 | I156: of:=[.I$155] -> 1000 | J156: of:=[.J$155] -> 0 | K156: of:=[.K$155] -> 0 | L156: 500 | M156: 2 | N156: LFP-HE | O156: of:=(VLOOKUP([.B157]; [.$L$154:.$M$157];2;1)) -> 4 | P156: of:=(VLOOKUP([.C157]; [.$L$154:.$M$157];2;1)) -> 1 | Q156: of:=(VLOOKUP([.D157]; [.$L$154:.$M$157];2;1)) -> 1 | R156: of:=(VLOOKUP([.E157]; [.$L$154:.$M$157];2;1)) -> 4 | S156: of:=(VLOOKUP([.F157]; [.$L$154:.$M$157];2;1)) -> 4 | T156: of:=(VLOOKUP([.G157]; [.$L$154:.$M$157];2;1)) -> 4 | U156: of:=(VLOOKUP([.H157]; [.$L$154:.$M$157];2;1)) -> 1 | V156: of:=(VLOOKUP([.I157]; [.$L$154:.$M$157];2;1)) -> 1 | W156: of:=(VLOOKUP([.J157]; [.$L$154:.$M$157];2;1)) -> 4 | X156: of:=(VLOOKUP([.K157]; [.$L$154:.$M$157];2;1)) -> 4
A157: LFP-HE | B157: of:=[.B$155] -> 0 | C157: of:=[.C$155] -> 1000 | D157: of:=[.D$155] -> 1000 | E157: of:=[.E$155] -> 0 | F157: of:=[.F$155] -> 0 | G157: of:=[.G$155] -> 0 | H157: of:=[.H$155] -> 1000 | I157: of:=[.I$155] -> 1000 | J157: of:=[.J$155] -> 0 | K157: of:=[.K$155] -> 0 | L157: 1000 | M157: 1 | N157: LFP-HP | O157: of:=(VLOOKUP([.B158]; [.$L$154:.$M$157];2;1)) -> 4 | P157: of:=(VLOOKUP([.C158]; [.$L$154:.$M$157];2;1)) -> 1 | Q157: of:=(VLOOKUP([.D158]; [.$L$154:.$M$157];2;1)) -> 1 | R157: of:=(VLOOKUP([.E158]; [.$L$154:.$M$157];2;1)) -> 4 | S157: of:=(VLOOKUP([.F158]; [.$L$154:.$M$157];2;1)) -> 4 | T157: of:=(VLOOKUP([.G158]; [.$L$154:.$M$157];2;1)) -> 4 | U157: of:=(VLOOKUP([.H158]; [.$L$154:.$M$157];2;1)) -> 1 | V157: of:=(VLOOKUP([.I158]; [.$L$154:.$M$157];2;1)) -> 1 | W157: of:=(VLOOKUP([.J158]; [.$L$154:.$M$157];2;1)) -> 4 | X157: of:=(VLOOKUP([.K158]; [.$L$154:.$M$157];2;1)) -> 4
A158: LFP-HP | B158: of:=[.B$155] -> 0 | C158: of:=[.C$155] -> 1000 | D158: of:=[.D$155] -> 1000 | E158: of:=[.E$155] -> 0 | F158: of:=[.F$155] -> 0 | G158: of:=[.G$155] -> 0 | H158: of:=[.H$155] -> 1000 | I158: of:=[.I$155] -> 1000 | J158: of:=[.J$155] -> 0 | K158: of:=[.K$155] -> 0 | L158: Gewichtung | M158: 10 | N158: LiTiO | O158: of:=(VLOOKUP([.B159]; [.$L$154:.$M$157];2;1)) -> 4 | P158: of:=(VLOOKUP([.C159]; [.$L$154:.$M$157];2;1)) -> 1 | Q158: of:=(VLOOKUP([.D159]; [.$L$154:.$M$157];2;1)) -> 1 | R158: of:=(VLOOKUP([.E159]; [.$L$154:.$M$157];2;1)) -> 4 | S158: of:=(VLOOKUP([.F159]; [.$L$154:.$M$157];2;1)) -> 4 | T158: of:=(VLOOKUP([.G159]; [.$L$154:.$M$157];2;1)) -> 4 | U158: of:=(VLOOKUP([.H159]; [.$L$154:.$M$157];2;1)) -> 1 | V158: of:=(VLOOKUP([.I159]; [.$L$154:.$M$157];2;1)) -> 1 | W158: of:=(VLOOKUP([.J159]; [.$L$154:.$M$157];2;1)) -> 4 | X158: of:=(VLOOKUP([.K159]; [.$L$154:.$M$157];2;1)) -> 4
A159: LiTiO | B159: of:=[.B$155] -> 0 | C159: of:=[.C$155] -> 1000 | D159: of:=[.D$155] -> 1000 | E159: of:=[.E$155] -> 0 | F159: of:=[.F$155] -> 0 | G159: of:=[.G$155] -> 0 | H159: of:=[.H$155] -> 1000 | I159: of:=[.I$155] -> 1000 | J159: of:=[.J$155] -> 0 | K159: of:=[.K$155] -> 0 | N159: Mittelwert | O159: of:=AVERAGE([.O155:.X158]) -> 2.8
A160: Mittelwert | B160: of:=AVERAGE([.B156:.K159]) -> 400 | N160: Min | O160: of:=MIN([.O155:.X158]) -> 1
A161: Min | B161: of:=MIN([.B156:.K159]) -> 0 | N161: Max | O161: of:=MAX([.O155:.X158]) -> 4
A162: Max | B162: of:=MAX([.B156:.K159]) -> 1000
B164: Energieverbrauch | L164: Punktezuordnung Energie | O164: Punkte Energie
B165: 204 Opportunity | F165: 204 Overnight | G165: 192 Opportunity | K165: 192 Overnight | L165: Wert | M165: Punkte | O165: 204 Opportunity | S165: 204 Overnight | T165: 192 Opportunity | X165: 192 Overnight
B166: 40kW | C166: 375kW | D166: 200kW | E166: Swap | F166: 40kW | G166: 40kW | H166: 375kW | I166: 200kW | J166: Swap | K166: 40kW | L166: 0 | M166: 4 | O166: 40kW | P166: 375kW | Q166: 200kW | R166: Swap | S166: 40kW | T166: 40kW | U166: 375kW | V166: 200kW | W166: Swap | X166: 40kW
A167: 18650 | B167: 1.453 | C167: 1.4562 | D167: 1.5275 | E167: 1.4497 | F167: 1.2055 | G167: 1.1552 | H167: 1.1581 | I167: 1.2161 | J167: 1.1523 | K167: 0.92738 | L167: 0.9 | M167: 3 | N167: 18650 | O167: of:=(VLOOKUP([.B167]; [.$L$166:.$M$169];2;1)) -> 2 | P167: of:=(VLOOKUP([.C167]; [.$L$166:.$M$169];2;1)) -> 2 | Q167: of:=(VLOOKUP([.D167]; [.$L$166:.$M$169];2;1)) -> 1 | R167: of:=(VLOOKUP([.E167]; [.$L$166:.$M$169];2;1)) -> 2 | S167: of:=(VLOOKUP([.F167]; [.$L$166:.$M$169];2;1)) -> 2 | T167: of:=(VLOOKUP([.G167]; [.$L$166:.$M$169];2;1)) -> 3 | U167: of:=(VLOOKUP([.H167]; [.$L$166:.$M$169];2;1)) -> 3 | V167: of:=(VLOOKUP([.I167]; [.$L$166:.$M$169];2;1)) -> 2 | W167: of:=(VLOOKUP([.J167]; [.$L$166:.$M$169];2;1)) -> 3 | X167: of:=(VLOOKUP([.K167]; [.$L$166:.$M$169];2;1)) -> 3
A168: LFP-HE | B168: 1.3112 | C168: 1.3273 | D168: 1.3916 | E168: 1.322 | F168: 1.1585 | G168: 1.0209 | H168: 1.0386 | I168: 1.0897 | J168: 1.0338 | K168: 0.88175 | L168: 1.2 | M168: 2 | N168: LFP-HE | O168: of:=(VLOOKUP([.B168]; [.$L$166:.$M$169];2;1)) -> 2 | P168: of:=(VLOOKUP([.C168]; [.$L$166:.$M$169];2;1)) -> 2 | Q168: of:=(VLOOKUP([.D168]; [.$L$166:.$M$169];2;1)) -> 2 | R168: of:=(VLOOKUP([.E168]; [.$L$166:.$M$169];2;1)) -> 2 | S168: of:=(VLOOKUP([.F168]; [.$L$166:.$M$169];2;1)) -> 3 | T168: of:=(VLOOKUP([.G168]; [.$L$166:.$M$169];2;1)) -> 3 | U168: of:=(VLOOKUP([.H168]; [.$L$166:.$M$169];2;1)) -> 3 | V168: of:=(VLOOKUP([.I168]; [.$L$166:.$M$169];2;1)) -> 3 | W168: of:=(VLOOKUP([.J168]; [.$L$166:.$M$169];2;1)) -> 3 | X168: of:=(VLOOKUP([.K168]; [.$L$166:.$M$169];2;1)) -> 4
A169: LFP-HP | B169: 1.431 | C169: 1.4341 | D169: 1.5044 | E169: 1.4278 | F169: 1.238 | G169: 1.1359 | H169: 1.1388 | I169: 1.1962 | J169: 1.133 | K169: 0.96049 | L169: 1.5 | M169: 1 | N169: LFP-HP | O169: of:=(VLOOKUP([.B169]; [.$L$166:.$M$169];2;1)) -> 2 | P169: of:=(VLOOKUP([.C169]; [.$L$166:.$M$169];2;1)) -> 2 | Q169: of:=(VLOOKUP([.D169]; [.$L$166:.$M$169];2;1)) -> 1 | R169: of:=(VLOOKUP([.E169]; [.$L$166:.$M$169];2;1)) -> 2 | S169: of:=(VLOOKUP([.F169]; [.$L$166:.$M$169];2;1)) -> 2 | T169: of:=(VLOOKUP([.G169]; [.$L$166:.$M$169];2;1)) -> 3 | U169: of:=(VLOOKUP([.H169]; [.$L$166:.$M$169];2;1)) -> 3 | V169: of:=(VLOOKUP([.I169]; [.$L$166:.$M$169];2;1)) -> 3 | W169: of:=(VLOOKUP([.J169]; [.$L$166:.$M$169];2;1)) -> 3 | X169: of:=(VLOOKUP([.K169]; [.$L$166:.$M$169];2;1)) -> 3
A170: LiTiO | B170: 1.2228 | C170: 1.3122 | D170: 1.3741 | E170: 1.3079 | F170: 1.2582 | G170: 0.93659 | H170: 1.0123 | I170: 1.0611 | J170: 1.0086 | K170: 0.97974 | L170: Gewichtung | M170: 20 | N170: LiTiO | O170: of:=(VLOOKUP([.B170]; [.$L$166:.$M$169];2;1)) -> 2 | P170: of:=(VLOOKUP([.C170]; [.$L$166:.$M$169];2;1)) -> 2 | Q170: of:=(VLOOKUP([.D170]; [.$L$166:.$M$169];2;1)) -> 2 | R170: of:=(VLOOKUP([.E170]; [.$L$166:.$M$169];2;1)) -> 2 | S170: of:=(VLOOKUP([.F170]; [.$L$166:.$M$169];2;1)) -> 2 | T170: of:=(VLOOKUP([.G170]; [.$L$166:.$M$169];2;1)) -> 3 | U170: of:=(VLOOKUP([.H170]; [.$L$166:.$M$169];2;1)) -> 3 | V170: of:=(VLOOKUP([.I170]; [.$L$166:.$M$169];2;1)) -> 3 | W170: of:=(VLOOKUP([.J170]; [.$L$166:.$M$169];2;1)) -> 3 | X170: of:=(VLOOKUP([.K170]; [.$L$166:.$M$169];2;1)) -> 3
A171: Mittelwert | B171: of:=AVERAGE([.B167:.K170]) -> 1.20873875 | N171: Mittelwert | O171: of:=AVERAGE([.O167:.X170]) -> 2.475
A172: Min | B172: of:=MIN([.B167:.K170]) -> 0.88175 | N172: Min | O172: of:=MIN([.O167:.X170]) -> 1
A173: Max | B173: of:=MAX([.B167:.K170]) -> 1.5275 | N173: Max | O173: of:=MAX([.O167:.X170]) -> 4
B175: Kühlluftmasse | L175: Punktezuordnung KLM | O175: Punkte Kühlluftmasse
B176: 204 Opportunity | F176: 204 Overnight | G176: 192 Opportunity | K176: 192 Overnight | L176: Wert | M176: Punkte | O176: 204 Opportunity | S176: 204 Overnight | T176: 192 Opportunity | X176: 192 Overnight
B177: 40kW | C177: 375kW | D177: 200kW | E177: Swap | F177: 40kW | G177: 40kW | H177: 375kW | I177: 200kW | J177: Swap | K177: 40kW | L177: 0 | M177: 4 | O177: 40kW | P177: 375kW | Q177: 200kW | R177: Swap | S177: 40kW | T177: 40kW | U177: 375kW | V177: 200kW | W177: Swap | X177: 40kW
A178: 18650 | B178: 245.17 | C178: 241.06 | D178: 242.33 | E178: 275.63 | F178: 1735.1 | G178: 269.09 | H178: 264.42 | I178: 265.48 | J178: 303.05 | K178: 2241.4 | L178: 1000 | M178: 3 | N178: 18650 | O178: of:=(VLOOKUP([.B178]; [.$L$177:.$M$180];2;1)) -> 4 | P178: of:=(VLOOKUP([.C178]; [.$L$177:.$M$180];2;1)) -> 4 | Q178: of:=(VLOOKUP([.D178]; [.$L$177:.$M$180];2;1)) -> 4 | R178: of:=(VLOOKUP([.E178]; [.$L$177:.$M$180];2;1)) -> 4 | S178: of:=(VLOOKUP([.F178]; [.$L$177:.$M$180];2;1)) -> 3 | T178: of:=(VLOOKUP([.G178]; [.$L$177:.$M$180];2;1)) -> 4 | U178: of:=(VLOOKUP([.H178]; [.$L$177:.$M$180];2;1)) -> 4 | V178: of:=(VLOOKUP([.I178]; [.$L$177:.$M$180];2;1)) -> 4 | W178: of:=(VLOOKUP([.J178]; [.$L$177:.$M$180];2;1)) -> 4 | X178: of:=(VLOOKUP([.K178]; [.$L$177:.$M$180];2;1)) -> 3
A179: LFP-HE | B179: 5130.3 | C179: 5141.4 | D179: 5174.2 | E179: 5119.2 | F179: 5330.9 | G179: 5972 | H179: 5984.5 | I179: 6022.3 | J179: 5959.5 | K179: 5461 | L179: 3000 | M179: 2 | N179: LFP-HE | O179: of:=(VLOOKUP([.B179]; [.$L$177:.$M$180];2;1)) -> 1 | P179: of:=(VLOOKUP([.C179]; [.$L$177:.$M$180];2;1)) -> 1 | Q179: of:=(VLOOKUP([.D179]; [.$L$177:.$M$180];2;1)) -> 1 | R179: of:=(VLOOKUP([.E179]; [.$L$177:.$M$180];2;1)) -> 1 | S179: of:=(VLOOKUP([.F179]; [.$L$177:.$M$180];2;1)) -> 1 | T179: of:=(VLOOKUP([.G179]; [.$L$177:.$M$180];2;1)) -> 1 | U179: of:=(VLOOKUP([.H179]; [.$L$177:.$M$180];2;1)) -> 1 | V179: of:=(VLOOKUP([.I179]; [.$L$177:.$M$180];2;1)) -> 1 | W179: of:=(VLOOKUP([.J179]; [.$L$177:.$M$180];2;1)) -> 1 | X179: of:=(VLOOKUP([.K179]; [.$L$177:.$M$180];2;1)) -> 1
A180: LFP-HP | B180: 3827.4 | C180: 3835.1 | D180: 3858.2 | E180: 3819.6 | F180: 4989.4 | G180: 4321.3 | H180: 4329.4 | I180: 4353.8 | J180: 4313.2 | K180: 5511.8 | L180: 5000 | M180: 1 | N180: LFP-HP | O180: of:=(VLOOKUP([.B180]; [.$L$177:.$M$180];2;1)) -> 2 | P180: of:=(VLOOKUP([.C180]; [.$L$177:.$M$180];2;1)) -> 2 | Q180: of:=(VLOOKUP([.D180]; [.$L$177:.$M$180];2;1)) -> 2 | R180: of:=(VLOOKUP([.E180]; [.$L$177:.$M$180];2;1)) -> 2 | S180: of:=(VLOOKUP([.F180]; [.$L$177:.$M$180];2;1)) -> 2 | T180: of:=(VLOOKUP([.G180]; [.$L$177:.$M$180];2;1)) -> 2 | U180: of:=(VLOOKUP([.H180]; [.$L$177:.$M$180];2;1)) -> 2 | V180: of:=(VLOOKUP([.I180]; [.$L$177:.$M$180];2;1)) -> 2 | W180: of:=(VLOOKUP([.J180]; [.$L$177:.$M$180];2;1)) -> 2 | X180: of:=(VLOOKUP([.K180]; [.$L$177:.$M$180];2;1)) -> 1
A181: LiTiO | B181: 582.47 | C181: 1420.7 | D181: 1426 | E181: 1417.1 | F181: 201.82 | G181: 625.26 | H181: 1687.2 | I181: 1694.1 | J181: 1682.9 | K181: 305.59 | L181: Gewichtung | M181: 20 | N181: LiTiO | O181: of:=(VLOOKUP([.B181]; [.$L$177:.$M$180];2;1)) -> 4 | P181: of:=(VLOOKUP([.C181]; [.$L$177:.$M$180];2;1)) -> 3 | Q181: of:=(VLOOKUP([.D181]; [.$L$177:.$M$180];2;1)) -> 3 | R181: of:=(VLOOKUP([.E181]; [.$L$177:.$M$180];2;1)) -> 3 | S181: of:=(VLOOKUP([.F181]; [.$L$177:.$M$180];2;1)) -> 4 | T181: of:=(VLOOKUP([.G181]; [.$L$177:.$M$180];2;1)) -> 4 | U181: of:=(VLOOKUP([.H181]; [.$L$177:.$M$180];2;1)) -> 3 | V181: of:=(VLOOKUP([.I181]; [.$L$177:.$M$180];2;1)) -> 3 | W181: of:=(VLOOKUP([.J181]; [.$L$177:.$M$180];2;1)) -> 3 | X181: of:=(VLOOKUP([.K181]; [.$L$177:.$M$180];2;1)) -> 4
A182: Mittelwert | B182: of:=AVERAGE([.B178:.K181]) -> 2889.50925 | L182: Summe gewi. | M182: of:=[.M181]+[.M170]+[.M158]+[.M146]+[.M133]+[.M122]+[.M110]+[.M99]+[.M74]+[.M62]+[.M51]+[.M39]+[.M18] -> 99.996 | N182: Mittelwert | O182: of:=AVERAGE([.O178:.X181]) -> 2.525
A183: Min | B183: of:=MIN([.B178:.K181]) -> 201.82 | N183: Min | O183: of:=MIN([.O178:.X181]) -> 1
A184: Max | B184: of:=MAX([.B178:.K181]) -> 6022.3 | N184: Max | O184: of:=MAX([.O178:.X181]) -> 4
O186: Gesamtpunktzahl
O187: 204 Opportunity | S187: 204 Overnight | T187: 192 Opportunity | X187: 192 Overnight
O188: 40kW | P188: 375kW | Q188: 200kW | R188: Swap | S188: 40kW | T188: 40kW | U188: 375kW | V188: 200kW | W188: Swap | X188: 40kW | Y188: MW
N189: 18650 | O189: of:=([.$M$181]/100)*[.O178]+([.$M$170]/100)*[.O167]+([.$M$158]/100)*[.O155]+([.$M$146]/100)*[.O131]+([.$M$122]/100)*[.O119]+([.$M$110]/100)*[.O107]+([.$M$99]/100)*[.O96]+([.$M$74]/100)*[.O71]+([.$M$62]/100)*[.O59]+([.$M$51]/100)*[.O48]+([.$M$39]/100)*[.O36]+([.$M$18]/100)*[.O14] -> 3.03323 | P189: of:=([.$M$181]/100)*[.P178]+([.$M$170]/100)*[.P167]+([.$M$158]/100)*[.P155]+([.$M$146]/100)*[.P131]+([.$M$122]/100)*[.P119]+([.$M$110]/100)*[.P107]+([.$M$99]/100)*[.P96]+([.$M$74]/100)*[.P71]+([.$M$62]/100)*[.P59]+([.$M$51]/100)*[.P48]+([.$M$39]/100)*[.P36]+([.$M$18]/100)*[.P14] -> 2.33326 | Q189: of:=([.$M$181]/100)*[.Q178]+([.$M$170]/100)*[.Q167]+([.$M$158]/100)*[.Q155]+([.$M$146]/100)*[.Q131]+([.$M$122]/100)*[.Q119]+([.$M$110]/100)*[.Q107]+([.$M$99]/100)*[.Q96]+([.$M$74]/100)*[.Q71]+([.$M$62]/100)*[.Q59]+([.$M$51]/100)*[.Q48]+([.$M$39]/100)*[.Q36]+([.$M$18]/100)*[.Q14] -> 2.33324 | R189: of:=([.$M$181]/100)*[.R178]+([.$M$170]/100)*[.R167]+([.$M$158]/100)*[.R155]+([.$M$146]/100)*[.R131]+([.$M$122]/100)*[.R119]+([.$M$110]/100)*[.R107]+([.$M$99]/100)*[.R96]+([.$M$74]/100)*[.R71]+([.$M$62]/100)*[.R59]+([.$M$51]/100)*[.R48]+([.$M$39]/100)*[.R36]+([.$M$18]/100)*[.R14] -> 2.93324 | S189: of:=([.$M$181]/100)*[.S178]+([.$M$170]/100)*[.S167]+([.$M$158]/100)*[.S155]+([.$M$146]/100)*[.S131]+([.$M$122]/100)*[.S119]+([.$M$110]/100)*[.S107]+([.$M$99]/100)*[.S96]+([.$M$74]/100)*[.S71]+([.$M$62]/100)*[.S59]+([.$M$51]/100)*[.S48]+([.$M$39]/100)*[.S36]+([.$M$18]/100)*[.S14] -> 2.93322 | T189: of:=([.$M$181]/100)*[.T178]+([.$M$170]/100)*[.T167]+([.$M$158]/100)*[.T155]+([.$M$146]/100)*[.T131]+([.$M$122]/100)*[.T119]+([.$M$110]/100)*[.T107]+([.$M$99]/100)*[.T96]+([.$M$74]/100)*[.T71]+([.$M$62]/100)*[.T59]+([.$M$51]/100)*[.T48]+([.$M$39]/100)*[.T36]+([.$M$18]/100)*[.T14] -> 3.23323 | U189: of:=([.$M$181]/100)*[.U178]+([.$M$170]/100)*[.U167]+([.$M$158]/100)*[.U155]+([.$M$146]/100)*[.U131]+([.$M$122]/100)*[.U119]+([.$M$110]/100)*[.U107]+([.$M$99]/100)*[.U96]+([.$M$74]/100)*[.U71]+([.$M$62]/100)*[.U59]+([.$M$51]/100)*[.U48]+([.$M$39]/100)*[.U36]+([.$M$18]/100)*[.U14] -> 2.53326 | V189: of:=([.$M$181]/100)*[.V178]+([.$M$170]/100)*[.V167]+([.$M$158]/100)*[.V155]+([.$M$146]/100)*[.V131]+([.$M$122]/100)*[.V119]+([.$M$110]/100)*[.V107]+([.$M$99]/100)*[.V96]+([.$M$74]/100)*[.V71]+([.$M$62]/100)*[.V59]+([.$M$51]/100)*[.V48]+([.$M$39]/100)*[.V36]+([.$M$18]/100)*[.V14] -> 2.53324 | W189: of:=([.$M$181]/100)*[.W178]+([.$M$170]/100)*[.W167]+([.$M$158]/100)*[.W155]+([.$M$146]/100)*[.W131]+([.$M$122]/100)*[.W119]+([.$M$110]/100)*[.W107]+([.$M$99]/100)*[.W96]+([.$M$74]/100)*[.W71]+([.$M$62]/100)*[.W59]+([.$M$51]/100)*[.W48]+([.$M$39]/100)*[.W36]+([.$M$18]/100)*[.W14] -> 3.03325 | X189: of:=([.$M$181]/100)*[.X178]+([.$M$170]/100)*[.X167]+([.$M$158]/100)*[.X155]+([.$M$146]/100)*[.X131]+([.$M$122]/100)*[.X119]+([.$M$110]/100)*[.X107]+([.$M$99]/100)*[.X96]+([.$M$74]/100)*[.X71]+([.$M$62]/100)*[.X59]+([.$M$51]/100)*[.X48]+([.$M$39]/100)*[.X36]+([.$M$18]/100)*[.X14] -> 3.06656 | Y189: of:=AVERAGE([.O189:.X189]) -> 2.796573
N190: LFP-HE | O190: of:=([.$M$181]/100)*[.O179]+([.$M$170]/100)*[.O168]+([.$M$158]/100)*[.O156]+([.$M$146]/100)*[.O132]+([.$M$122]/100)*[.O120]+([.$M$110]/100)*[.O108]+([.$M$99]/100)*[.O97]+([.$M$74]/100)*[.O72]+([.$M$62]/100)*[.O60]+([.$M$51]/100)*[.O49]+([.$M$39]/100)*[.O37]+([.$M$18]/100)*[.O15] -> 2.39989 | P190: of:=([.$M$181]/100)*[.P179]+([.$M$170]/100)*[.P168]+([.$M$158]/100)*[.P156]+([.$M$146]/100)*[.P132]+([.$M$122]/100)*[.P120]+([.$M$110]/100)*[.P108]+([.$M$99]/100)*[.P97]+([.$M$74]/100)*[.P72]+([.$M$62]/100)*[.P60]+([.$M$51]/100)*[.P49]+([.$M$39]/100)*[.P37]+([.$M$18]/100)*[.P15] -> 1.79992 | Q190: of:=([.$M$181]/100)*[.Q179]+([.$M$170]/100)*[.Q168]+([.$M$158]/100)*[.Q156]+([.$M$146]/100)*[.Q132]+([.$M$122]/100)*[.Q120]+([.$M$110]/100)*[.Q108]+([.$M$99]/100)*[.Q97]+([.$M$74]/100)*[.Q72]+([.$M$62]/100)*[.Q60]+([.$M$51]/100)*[.Q49]+([.$M$39]/100)*[.Q37]+([.$M$18]/100)*[.Q15] -> 1.96657 | R190: of:=([.$M$181]/100)*[.R179]+([.$M$170]/100)*[.R168]+([.$M$158]/100)*[.R156]+([.$M$146]/100)*[.R132]+([.$M$122]/100)*[.R120]+([.$M$110]/100)*[.R108]+([.$M$99]/100)*[.R97]+([.$M$74]/100)*[.R72]+([.$M$62]/100)*[.R60]+([.$M$51]/100)*[.R49]+([.$M$39]/100)*[.R37]+([.$M$18]/100)*[.R15] -> 2.29991 | S190: of:=([.$M$181]/100)*[.S179]+([.$M$170]/100)*[.S168]+([.$M$158]/100)*[.S156]+([.$M$146]/100)*[.S132]+([.$M$122]/100)*[.S120]+([.$M$110]/100)*[.S108]+([.$M$99]/100)*[.S97]+([.$M$74]/100)*[.S72]+([.$M$62]/100)*[.S60]+([.$M$51]/100)*[.S49]+([.$M$39]/100)*[.S37]+([.$M$18]/100)*[.S15] -> 2.49989 | T190: of:=([.$M$181]/100)*[.T179]+([.$M$170]/100)*[.T168]+([.$M$158]/100)*[.T156]+([.$M$146]/100)*[.T132]+([.$M$122]/100)*[.T120]+([.$M$110]/100)*[.T108]+([.$M$99]/100)*[.T97]+([.$M$74]/100)*[.T72]+([.$M$62]/100)*[.T60]+([.$M$51]/100)*[.T49]+([.$M$39]/100)*[.T37]+([.$M$18]/100)*[.T15] -> 2.53323 | U190: of:=([.$M$181]/100)*[.U179]+([.$M$170]/100)*[.U168]+([.$M$158]/100)*[.U156]+([.$M$146]/100)*[.U132]+([.$M$122]/100)*[.U120]+([.$M$110]/100)*[.U108]+([.$M$99]/100)*[.U97]+([.$M$74]/100)*[.U72]+([.$M$62]/100)*[.U60]+([.$M$51]/100)*[.U49]+([.$M$39]/100)*[.U37]+([.$M$18]/100)*[.U15] -> 1.99992 | V190: of:=([.$M$181]/100)*[.V179]+([.$M$170]/100)*[.V168]+([.$M$158]/100)*[.V156]+([.$M$146]/100)*[.V132]+([.$M$122]/100)*[.V120]+([.$M$110]/100)*[.V108]+([.$M$99]/100)*[.V97]+([.$M$74]/100)*[.V72]+([.$M$62]/100)*[.V60]+([.$M$51]/100)*[.V49]+([.$M$39]/100)*[.V37]+([.$M$18]/100)*[.V15] -> 2.16657 | W190: of:=([.$M$181]/100)*[.W179]+([.$M$170]/100)*[.W168]+([.$M$158]/100)*[.W156]+([.$M$146]/100)*[.W132]+([.$M$122]/100)*[.W120]+([.$M$110]/100)*[.W108]+([.$M$99]/100)*[.W97]+([.$M$74]/100)*[.W72]+([.$M$62]/100)*[.W60]+([.$M$51]/100)*[.W49]+([.$M$39]/100)*[.W37]+([.$M$18]/100)*[.W15] -> 2.43325 | X190: of:=([.$M$181]/100)*[.X179]+([.$M$170]/100)*[.X168]+([.$M$158]/100)*[.X156]+([.$M$146]/100)*[.X132]+([.$M$122]/100)*[.X120]+([.$M$110]/100)*[.X108]+([.$M$99]/100)*[.X97]+([.$M$74]/100)*[.X72]+([.$M$62]/100)*[.X60]+([.$M$51]/100)*[.X49]+([.$M$39]/100)*[.X37]+([.$M$18]/100)*[.X15] -> 2.63323 | Y190: of:=AVERAGE([.O190:.X190]) -> 2.273238
N191: LFP-HP | O191: of:=([.$M$181]/100)*[.O180]+([.$M$170]/100)*[.O169]+([.$M$158]/100)*[.O157]+([.$M$146]/100)*[.O133]+([.$M$122]/100)*[.O121]+([.$M$110]/100)*[.O109]+([.$M$99]/100)*[.O98]+([.$M$74]/100)*[.O73]+([.$M$62]/100)*[.O61]+([.$M$51]/100)*[.O50]+([.$M$39]/100)*[.O38]+([.$M$18]/100)*[.O16] -> 2.43323 | P191: of:=([.$M$181]/100)*[.P180]+([.$M$170]/100)*[.P169]+([.$M$158]/100)*[.P157]+([.$M$146]/100)*[.P133]+([.$M$122]/100)*[.P121]+([.$M$110]/100)*[.P109]+([.$M$99]/100)*[.P98]+([.$M$74]/100)*[.P73]+([.$M$62]/100)*[.P61]+([.$M$51]/100)*[.P50]+([.$M$39]/100)*[.P38]+([.$M$18]/100)*[.P16] -> 1.83326 | Q191: of:=([.$M$181]/100)*[.Q180]+([.$M$170]/100)*[.Q169]+([.$M$158]/100)*[.Q157]+([.$M$146]/100)*[.Q133]+([.$M$122]/100)*[.Q121]+([.$M$110]/100)*[.Q109]+([.$M$99]/100)*[.Q98]+([.$M$74]/100)*[.Q73]+([.$M$62]/100)*[.Q61]+([.$M$51]/100)*[.Q50]+([.$M$39]/100)*[.Q38]+([.$M$18]/100)*[.Q16] -> 1.79991 | R191: of:=([.$M$181]/100)*[.R180]+([.$M$170]/100)*[.R169]+([.$M$158]/100)*[.R157]+([.$M$146]/100)*[.R133]+([.$M$122]/100)*[.R121]+([.$M$110]/100)*[.R109]+([.$M$99]/100)*[.R98]+([.$M$74]/100)*[.R73]+([.$M$62]/100)*[.R61]+([.$M$51]/100)*[.R50]+([.$M$39]/100)*[.R38]+([.$M$18]/100)*[.R16] -> 2.29991 | S191: of:=([.$M$181]/100)*[.S180]+([.$M$170]/100)*[.S169]+([.$M$158]/100)*[.S157]+([.$M$146]/100)*[.S133]+([.$M$122]/100)*[.S121]+([.$M$110]/100)*[.S109]+([.$M$99]/100)*[.S98]+([.$M$74]/100)*[.S73]+([.$M$62]/100)*[.S61]+([.$M$51]/100)*[.S50]+([.$M$39]/100)*[.S38]+([.$M$18]/100)*[.S16] -> 2.2999 | T191: of:=([.$M$181]/100)*[.T180]+([.$M$170]/100)*[.T169]+([.$M$158]/100)*[.T157]+([.$M$146]/100)*[.T133]+([.$M$122]/100)*[.T121]+([.$M$110]/100)*[.T109]+([.$M$99]/100)*[.T98]+([.$M$74]/100)*[.T73]+([.$M$62]/100)*[.T61]+([.$M$51]/100)*[.T50]+([.$M$39]/100)*[.T38]+([.$M$18]/100)*[.T16] -> 2.63323 | U191: of:=([.$M$181]/100)*[.U180]+([.$M$170]/100)*[.U169]+([.$M$158]/100)*[.U157]+([.$M$146]/100)*[.U133]+([.$M$122]/100)*[.U121]+([.$M$110]/100)*[.U109]+([.$M$99]/100)*[.U98]+([.$M$74]/100)*[.U73]+([.$M$62]/100)*[.U61]+([.$M$51]/100)*[.U50]+([.$M$39]/100)*[.U38]+([.$M$18]/100)*[.U16] -> 1.99993 | V191: of:=([.$M$181]/100)*[.V180]+([.$M$170]/100)*[.V169]+([.$M$158]/100)*[.V157]+([.$M$146]/100)*[.V133]+([.$M$122]/100)*[.V121]+([.$M$110]/100)*[.V109]+([.$M$99]/100)*[.V98]+([.$M$74]/100)*[.V73]+([.$M$62]/100)*[.V61]+([.$M$51]/100)*[.V50]+([.$M$39]/100)*[.V38]+([.$M$18]/100)*[.V16] -> 2.19991 | W191: of:=([.$M$181]/100)*[.W180]+([.$M$170]/100)*[.W169]+([.$M$158]/100)*[.W157]+([.$M$146]/100)*[.W133]+([.$M$122]/100)*[.W121]+([.$M$110]/100)*[.W109]+([.$M$99]/100)*[.W98]+([.$M$74]/100)*[.W73]+([.$M$62]/100)*[.W61]+([.$M$51]/100)*[.W50]+([.$M$39]/100)*[.W38]+([.$M$18]/100)*[.W16] -> 2.43325 | X191: of:=([.$M$181]/100)*[.X180]+([.$M$170]/100)*[.X169]+([.$M$158]/100)*[.X157]+([.$M$146]/100)*[.X133]+([.$M$122]/100)*[.X121]+([.$M$110]/100)*[.X109]+([.$M$99]/100)*[.X98]+([.$M$74]/100)*[.X73]+([.$M$62]/100)*[.X61]+([.$M$51]/100)*[.X50]+([.$M$39]/100)*[.X38]+([.$M$18]/100)*[.X16] -> 2.33323 | Y191: of:=AVERAGE([.O191:.X191]) -> 2.226576
N192: LiTiO | O192: of:=([.$M$181]/100)*[.O181]+([.$M$170]/100)*[.O170]+([.$M$158]/100)*[.O158]+([.$M$146]/100)*[.O134]+([.$M$122]/100)*[.O122]+([.$M$110]/100)*[.O110]+([.$M$99]/100)*[.O99]+([.$M$74]/100)*[.O74]+([.$M$62]/100)*[.O62]+([.$M$51]/100)*[.O51]+([.$M$39]/100)*[.O39]+([.$M$18]/100)*[.O17] -> 2.89989 | P192: of:=([.$M$181]/100)*[.P181]+([.$M$170]/100)*[.P170]+([.$M$158]/100)*[.P158]+([.$M$146]/100)*[.P134]+([.$M$122]/100)*[.P122]+([.$M$110]/100)*[.P110]+([.$M$99]/100)*[.P99]+([.$M$74]/100)*[.P74]+([.$M$62]/100)*[.P62]+([.$M$51]/100)*[.P51]+([.$M$39]/100)*[.P39]+([.$M$18]/100)*[.P17] -> 2.16658 | Q192: of:=([.$M$181]/100)*[.Q181]+([.$M$170]/100)*[.Q170]+([.$M$158]/100)*[.Q158]+([.$M$146]/100)*[.Q134]+([.$M$122]/100)*[.Q122]+([.$M$110]/100)*[.Q110]+([.$M$99]/100)*[.Q99]+([.$M$74]/100)*[.Q74]+([.$M$62]/100)*[.Q62]+([.$M$51]/100)*[.Q51]+([.$M$39]/100)*[.Q39]+([.$M$18]/100)*[.Q17] -> 2.33323 | R192: of:=([.$M$181]/100)*[.R181]+([.$M$170]/100)*[.R170]+([.$M$158]/100)*[.R158]+([.$M$146]/100)*[.R134]+([.$M$122]/100)*[.R122]+([.$M$110]/100)*[.R110]+([.$M$99]/100)*[.R99]+([.$M$74]/100)*[.R74]+([.$M$62]/100)*[.R62]+([.$M$51]/100)*[.R51]+([.$M$39]/100)*[.R39]+([.$M$18]/100)*[.R17] -> 2.49991 | S192: of:=([.$M$181]/100)*[.S181]+([.$M$170]/100)*[.S170]+([.$M$158]/100)*[.S158]+([.$M$146]/100)*[.S134]+([.$M$122]/100)*[.S122]+([.$M$110]/100)*[.S110]+([.$M$99]/100)*[.S99]+([.$M$74]/100)*[.S74]+([.$M$62]/100)*[.S62]+([.$M$51]/100)*[.S51]+([.$M$39]/100)*[.S39]+([.$M$18]/100)*[.S17] -> 2.6999 | T192: of:=([.$M$181]/100)*[.T181]+([.$M$170]/100)*[.T170]+([.$M$158]/100)*[.T158]+([.$M$146]/100)*[.T134]+([.$M$122]/100)*[.T122]+([.$M$110]/100)*[.T110]+([.$M$99]/100)*[.T99]+([.$M$74]/100)*[.T74]+([.$M$62]/100)*[.T62]+([.$M$51]/100)*[.T51]+([.$M$39]/100)*[.T39]+([.$M$18]/100)*[.T17] -> 3.03323 | U192: of:=([.$M$181]/100)*[.U181]+([.$M$170]/100)*[.U170]+([.$M$158]/100)*[.U158]+([.$M$146]/100)*[.U134]+([.$M$122]/100)*[.U122]+([.$M$110]/100)*[.U110]+([.$M$99]/100)*[.U99]+([.$M$74]/100)*[.U74]+([.$M$62]/100)*[.U62]+([.$M$51]/100)*[.U51]+([.$M$39]/100)*[.U39]+([.$M$18]/100)*[.U17] -> 2.16659 | V192: of:=([.$M$181]/100)*[.V181]+([.$M$170]/100)*[.V170]+([.$M$158]/100)*[.V158]+([.$M$146]/100)*[.V134]+([.$M$122]/100)*[.V122]+([.$M$110]/100)*[.V110]+([.$M$99]/100)*[.V99]+([.$M$74]/100)*[.V74]+([.$M$62]/100)*[.V62]+([.$M$51]/100)*[.V51]+([.$M$39]/100)*[.V39]+([.$M$18]/100)*[.V17] -> 2.36657 | W192: of:=([.$M$181]/100)*[.W181]+([.$M$170]/100)*[.W170]+([.$M$158]/100)*[.W158]+([.$M$146]/100)*[.W134]+([.$M$122]/100)*[.W122]+([.$M$110]/100)*[.W110]+([.$M$99]/100)*[.W99]+([.$M$74]/100)*[.W74]+([.$M$62]/100)*[.W62]+([.$M$51]/100)*[.W51]+([.$M$39]/100)*[.W39]+([.$M$18]/100)*[.W17] -> 2.63325 | X192: of:=([.$M$181]/100)*[.X181]+([.$M$170]/100)*[.X170]+([.$M$158]/100)*[.X158]+([.$M$146]/100)*[.X134]+([.$M$122]/100)*[.X122]+([.$M$110]/100)*[.X110]+([.$M$99]/100)*[.X99]+([.$M$74]/100)*[.X74]+([.$M$62]/100)*[.X62]+([.$M$51]/100)*[.X51]+([.$M$39]/100)*[.X39]+([.$M$18]/100)*[.X17] -> 2.93323 | Y192: of:=AVERAGE([.O192:.X192]) -> 2.573238
N193: Mittelwert | O193: of:=AVERAGE([.O189:.X192]) -> 2.46740625 | P193: Stabw | Q193: of:=STDEV([.O189:.Y192]) -> 0.361183043717681
N194: Min | O194: of:=MIN([.O189:.X192]) -> 1.79991
N195: Max | O195: of:=MAX([.O189:.X192]) -> 3.23323
Q196: 40kW | R196: 375kW | S196: 200kW | T196: Swap | U196: Overnight
P197: MW204 | Q197: of:=AVERAGE([.O189:.O192]) -> 2.69156 | R197: of:=AVERAGE([.P189:.P192]) -> 2.033255 | S197: of:=AVERAGE([.Q189:.Q192]) -> 2.1082375 | T197: of:=AVERAGE([.R189:.R192]) -> 2.5082425 | U197: of:=AVERAGE([.S189:.S192]) -> 2.6082275
P198: MW192 | Q198: of:=AVERAGE([.T189:.T192]) -> 2.85823 | R198: of:=AVERAGE([.U189:.U192]) -> 2.174925 | S198: of:=AVERAGE([.V189:.V192]) -> 2.3165725 | T198: of:=AVERAGE([.W189:.W192]) -> 2.63325 | U198: of:=AVERAGE([.X189:.X192]) -> 2.7415625
P199: Mwges | Q199: of:=AVERAGE([.Q197:.Q198]) -> 2.774895 | R199: of:=AVERAGE([.R197:.R198]) -> 2.10409 | S199: of:=AVERAGE([.S197:.S198]) -> 2.212405 | T199: of:=AVERAGE([.T197:.T198]) -> 2.57074625 | U199: of:=AVERAGE([.U197:.U198]) -> 2.674895
N203: Buslinie 204
O204: 40kW | P204: 375kW | Q204: 200kW | R204: Swap | S204: Overnight | T204: Zeilendurchschnitt
N205: 18650 | O205: of:=[.O189] -> 3.03323 | P205: of:=[.P189] -> 2.33326 | Q205: of:=[.Q189] -> 2.33324 | R205: of:=[.R189] -> 2.93324 | S205: of:=[.S189] -> 2.93322 | T205: of:=AVERAGE([.O205:.S205]) -> 2.713238
N206: LFP-HE | O206: of:=[.O190] -> 2.39989 | P206: of:=[.P190] -> 1.79992 | Q206: of:=[.Q190] -> 1.96657 | R206: of:=[.R190] -> 2.29991 | S206: of:=[.S190] -> 2.49989 | T206: of:=AVERAGE([.O206:.S206]) -> 2.193236
N207: LFP-HP | O207: of:=[.O191] -> 2.43323 | P207: of:=[.P191] -> 1.83326 | Q207: of:=[.Q191] -> 1.79991 | R207: of:=[.R191] -> 2.29991 | S207: of:=[.S191] -> 2.2999 | T207: of:=AVERAGE([.O207:.S207]) -> 2.133242
N208: LiTiO | O208: of:=[.O192] -> 2.89989 | P208: of:=[.P192] -> 2.16658 | Q208: of:=[.Q192] -> 2.33323 | R208: of:=[.R192] -> 2.49991 | T208: of:=AVERAGE([.O208:.S208]) -> 2.4749025
N209: Spaltendurchschnitt | O209: of:=AVERAGE([.O205:.O208]) -> 2.69156 | P209: of:=AVERAGE([.P205:.P208]) -> 2.033255 | Q209: of:=AVERAGE([.Q205:.Q208]) -> 2.1082375 | R209: of:=AVERAGE([.R205:.R208]) -> 2.5082425 | S209: of:=AVERAGE([.S205:.S208]) -> 2.57767 | U209: of:=MAX([.O205:.S208]) -> 3.03323
N210: Buslinie 192
O211: 40kW | P211: 375kW | Q211: 200kW | R211: Swap | S211: Overnight
N212: 18650 | O212: of:=[.T189] -> 3.23323 | P212: of:=[.U189] -> 2.53326 | Q212: of:=[.V189] -> 2.53324 | R212: of:=[.W189] -> 3.03325 | S212: of:=[.X189] -> 3.06656 | T212: of:=AVERAGE([.O212:.S212]) -> 2.879908
N213: LFP-HE | O213: of:=[.T190] -> 2.53323 | P213: of:=[.U190] -> 1.99992 | Q213: of:=[.V190] -> 2.16657 | R213: of:=[.W190] -> 2.43325 | S213: of:=[.X190] -> 2.63323 | T213: of:=AVERAGE([.O213:.S213]) -> 2.35324
N214: LFP-HP | O214: of:=[.T191] -> 2.63323 | P214: of:=[.U191] -> 1.99993 | Q214: of:=[.V191] -> 2.19991 | R214: of:=[.W191] -> 2.43325 | T214: of:=AVERAGE([.O214:.S214]) -> 2.31658
N215: LiTiO | O215: of:=[.T192] -> 3.03323 | P215: of:=[.U192] -> 2.16659 | Q215: of:=[.V192] -> 2.36657 | R215: of:=[.W192] -> 2.63325 | T215: of:=AVERAGE([.O215:.S215]) -> 2.54991
N216: Spaltendurchschnitt | O216: of:=AVERAGE([.O212:.O215]) -> 2.85823 | P216: of:=AVERAGE([.P212:.P215]) -> 2.174925 | Q216: of:=AVERAGE([.Q212:.Q215]) -> 2.3165725 | R216: of:=AVERAGE([.R212:.R215]) -> 2.63325 | S216: of:=AVERAGE([.S212:.S215]) -> 2.849895 | U216: of:=MAX([.O212:.S215]) -> 3.23323

Sheet: Diagramme 204
A1: Masse
A2: Bat./LS | B2: kond.-man. | C2: kond.-auto. | D2: induktiv | E2: Batteriewechsel | F2: Nachtladung
A3: Blei-Säure | B3: 2125 | C3: 2130.1 | D3: 2145.4 | E3: 2119.9 | F3: 8051.1
A4: Li-Ion klassisch | B4: 214.96 | C4: 215.44 | D4: 216.85 | E4: 214.48 | F4: 667.9
A5: Li-Eisenphosphat hohe Energie | B5: 358.06 | C5: 358.76 | D5: 360.96 | E5: 357.34 | F5: 1180.4
A6: Li-Eisenphosphat hohe Leistung | B6: 480.13 | C6: 481.2 | D6: 484.39 | E6: 479.08 | F6: 1532.1
A7: Li-Titanat | B7: 539.91 | C7: 540.8 | D7: 543.45 | E7: 539 | F7: 2107.4
A9: Volumina
A10: Bat./LS | B10: kond.-man. | C10: kond.-auto. | D10: induktiv | E10: Batteriewechsel | F10: Nachtladung
A11: Blei-Säure | B11: 796.98 | C11: 798.89 | D11: 804.62 | E11: 795.08 | F11: 3019.5
A12: Li-Ion klassisch | B12: 77.783 | C12: 77.956 | D12: 78.468 | E12: 77.61 | F12: 241.68
A13: Li-Eisenphosphat hohe Energie | B13: 217.01 | C13: 217.43 | D13: 218.77 | E13: 216.57 | F13: 715.41
A14: Li-Eisenphosphat hohe Leistung | B14: 250.72 | C14: 251.28 | D14: 252.95 | E14: 250.17 | F14: 800.07
A15: Li-Titanat | B15: 377.93 | C15: 378.56 | D15: 380.41 | E15: 377.3 | F15: 1475.2
A17: Kühlbedarf
A18: Bat./LS | B18: kond.-man. | C18: kond.-auto. | D18: induktiv | E18: Batteriewechsel | F18: Nachtladung
A19: Blei-Säure | B19: 969 | C19: 971.66 | D19: 979.59 | E19: 966.32 | F19: 576.92
A20: Li-Ion klassisch | B20: 245.17 | C20: 241.06 | D20: 242.33 | E20: 275.63 | F20: 1735.1
A21: Li-Eisenphosphat hohe Energie | B21: 5130.3 | C21: 5141.4 | D21: 5174.2 | E21: 5119.2 | F21: 5330.9
A22: Li-Eisenphosphat hohe Leistung | B22: 3827.4 | C22: 3835.1 | D22: 3858.2 | E22: 3819.6 | F22: 4989.4
A23: Li-Titanat | B23: 582.47 | C23: 1420.7 | D23: 1426 | E23: 1417.1 | F23: 201.82
A25: Energieverbrauch
A26: Bat./LS | B26: kond.-man. | C26: kond.-auto. | D26: induktiv | E26: Batteriewechsel | F26: Nachtladung
A27: Blei-Säure | B27: 1.8717 | C27: 1.8762 | D27: 1.9692 | E27: 1.8669 | F27: 1.9112
A28: Li-Ion klassisch | B28: 1.453 | C28: 1.4562 | D28: 1.5275 | E28: 1.4497 | F28: 1.2055
A29: Li-Eisenphosphat hohe Energie | B29: 1.3112 | C29: 1.3273 | D29: 1.3916 | E29: 1.322 | F29: 1.1585
A30: Li-Eisenphosphat hohe Leistung | B30: 1.431 | C30: 1.4341 | D30: 1.5044 | E30: 1.4278 | F30: 1.238
A31: Li-Titanat | B31: 1.2228 | C31: 1.3122 | D31: 1.3741 | E31: 1.3079 | F31: 1.2582
A33: Ladezeit
A34: Bat./LS | B34: kond.-man. | C34: kond.-auto. | D34: induktiv | E34: Batteriewechsel | F34: Nachtladung
A35: Blei-Säure | B35: 5404 | C35: 5352 | D35: 5353 | E35: 420 | F35: 34428
A36: Li-Ion klassisch | B36: 2292 | C36: 2240 | D36: 2241 | E36: 420 | F36: 16910
A37: Li-Eisenphosphat hohe Energie | B37: 1542 | C37: 1078 | D37: 1079 | E37: 420 | F37: 14597
A38: Li-Eisenphosphat hohe Leistung | B38: 2199 | C38: 2147 | D38: 2148 | E38: 420 | F38: 18227
A39: Li-Titanat | B39: 1442 | C39: 489 | D39: 490 | E39: 420 | F39: 17562
A41: Zeiteffizienz (indirekt) | C41: Fahrzeit | D41: 4646
A42: Bat./LS | B42: kond.-man. | C42: kond.-auto. | D42: induktiv | E42: Batteriewechsel | F42: Nachtladung
A43: Blei-Säure | B43: of:=[.$D$41]/([.$D$41]+[.B35]) -> 0.46228855721393 | C43: of:=[.$D$41]/([.$D$41]+[.C35]) -> 0.464692938587718 | D43: of:=[.$D$41]/([.$D$41]+[.D35]) -> 0.464646464646465 | E43: of:=[.$D$41]/([.$D$41]+[.E35]) -> 0.917094354520332 | F43: of:=(11*[.$D$41])/((11*[.$D$41])+[.F35]) -> 0.597493394439638
A44: Li-Ion klassisch | B44: of:=[.$D$41]/([.$D$41]+[.B36]) -> 0.669645430959931 | C44: of:=[.$D$41]/([.$D$41]+[.C36]) -> 0.674702294510601 | D44: of:=[.$D$41]/([.$D$41]+[.D36]) -> 0.674604326992885 | E44: of:=[.$D$41]/([.$D$41]+[.E36]) -> 0.917094354520332 | F44: of:=(11*[.$D$41])/((11*[.$D$41])+[.F36]) -> 0.751382027758175
A45: Li-Eisenphosphat hohe Energie | B45: of:=[.$D$41]/([.$D$41]+[.B37]) -> 0.750808015513898 | C45: of:=[.$D$41]/([.$D$41]+[.C37]) -> 0.811670160726764 | D45: of:=[.$D$41]/([.$D$41]+[.D37]) -> 0.811528384279476 | E45: of:=[.$D$41]/([.$D$41]+[.E37]) -> 0.917094354520332 | F45: of:=(11*[.$D$41])/((11*[.$D$41])+[.F37]) -> 0.777833584463419
A46: Li-Eisenphosphat hohe Leistung | B46: of:=[.$D$41]/([.$D$41]+[.B38]) -> 0.678743608473338 | C46: of:=[.$D$41]/([.$D$41]+[.C38]) -> 0.683939349330193 | D46: of:=[.$D$41]/([.$D$41]+[.D38]) -> 0.683838681189285 | E46: of:=[.$D$41]/([.$D$41]+[.E38]) -> 0.917094354520332 | F46: of:=(11*[.$D$41])/((11*[.$D$41])+[.F38]) -> 0.737109313025543
A47: Li-Titanat | B47: of:=[.$D$41]/([.$D$41]+[.B39]) -> 0.763140604467806 | C47: of:=[.$D$41]/([.$D$41]+[.C39]) -> 0.9047711781889 | D47: of:=[.$D$41]/([.$D$41]+[.D39]) -> 0.904595015576324 | E47: of:=[.$D$41]/([.$D$41]+[.E39]) -> 0.917094354520332 | F47: of:=(11*[.$D$41])/((11*[.$D$41])+[.F39]) -> 0.74424768451098
A49: Ladezyklen pro km
A50: Bat./LS | B50: kond.-man. | C50: kond.-auto. | D50: induktiv | E50: Batteriewechsel | F50: Nachtladung
A51: Blei-Säure | B51: 0.023716 | C51: 0.023717 | D51: 0.023719 | E51: 0.023715 | F51: 0.0064737
A52: Li-Ion klassisch | B52: 0.023654 | C52: 0.023655 | D52: 0.023657 | E52: 0.023653 | F52: 0.0064549
A53: Li-Eisenphosphat hohe Energie | B53: 0.023739 | C53: 0.023739 | D53: 0.023741 | E53: 0.023736 | F53: 0.0064713
A54: Li-Eisenphosphat hohe Leistung | B54: 0.023732 | C54: 0.023733 | D54: 0.023735 | E54: 0.023733 | F54: 0.0064686
A55: Li-Titanat | B55: 0.023708 | C55: 0.02371 | D55: 0.023715 | E55: 0.023707 | F55: 0.006473
A57: Ladezyklen pro tausend km (indirekt)
A58: Bat./LS | B58: kond.-man. | C58: kond.-auto. | D58: induktiv | E58: Batteriewechsel | F58: Nachtladung
A59: Blei-Säure | B59: of:=1000*[.B51] -> 23.716 | C59: of:=1000*[.C51] -> 23.717 | D59: of:=1000*[.D51] -> 23.719 | E59: of:=1000*[.E51] -> 23.715 | F59: of:=1000*[.F51] -> 6.4737
A60: Li-Ion klassisch | B60: of:=1000*[.B52] -> 23.654 | C60: of:=1000*[.C52] -> 23.655 | D60: of:=1000*[.D52] -> 23.657 | E60: of:=1000*[.E52] -> 23.653 | F60: of:=1000*[.F52] -> 6.4549
A61: Li-Eisenphosphat hohe Energie | B61: of:=1000*[.B53] -> 23.739 | C61: of:=1000*[.C53] -> 23.739 | D61: of:=1000*[.D53] -> 23.741 | E61: of:=1000*[.E53] -> 23.736 | F61: of:=1000*[.F53] -> 6.4713
A62: Li-Eisenphosphat hohe Leistung | B62: of:=1000*[.B54] -> 23.732 | C62: of:=1000*[.C54] -> 23.733 | D62: of:=1000*[.D54] -> 23.735 | E62: of:=1000*[.E54] -> 23.733 | F62: of:=1000*[.F54] -> 6.4686
A63: Li-Titanat | B63: of:=1000*[.B55] -> 23.708 | C63: of:=1000*[.C55] -> 23.71 | D63: of:=1000*[.D55] -> 23.715 | E63: of:=1000*[.E55] -> 23.707 | F63: of:=1000*[.F55] -> 6.473

Sheet: Diagramme 192
A1: Masse
A2: Bat./LS | B2: kond.-man. | C2: kond.-auto. | D2: induktiv | E2: Batteriewechsel | F2: Nachtladung
A3: Blei-Säure | B3: 2751.1 | C3: 2758.5 | D3: 2780.6 | E3: 2743.8 | F3: 11432
A4: Li-Ion klassisch | B4: 264.39 | C4: 265.06 | D4: 267.08 | E4: 263.71 | F4: 797.25
A5: Li-Eisenphosphat hohe Energie | B5: 435 | C5: 435.99 | D5: 438.96 | E5: 433.98 | F5: 1400.4
A6: Li-Eisenphosphat hohe Leistung | B6: 592.47 | C6: 593.98 | D6: 598.47 | E6: 590.97 | F6: 1850.6
A7: Li-Titanat | B7: 646.65 | C7: 647.91 | D7: 651.71 | E7: 645.55 | F7: 2558.8
A9: Volumina
A10: Bat./LS | B10: kond.-man. | C10: kond.-auto. | D10: induktiv | E10: Batteriewechsel | F10: Nachtladung
A11: Blei-Säure | B11: 1031.8 | C11: 1034.6 | D11: 1042.9 | E11: 1029 | F11: 4287.7
A12: Li-Ion klassisch | B12: 95.671 | C12: 95.915 | D12: 96.646 | E12: 95.427 | F12: 288.49
A13: Li-Eisenphosphat hohe Energie | B13: 263.63 | C13: 264.24 | D13: 266.04 | E13: 263.02 | F13: 848.72
A14: Li-Eisenphosphat hohe Leistung | B14: 309.39 | C14: 310.17 | D14: 312.52 | E14: 308.6 | F14: 966.36
A15: Li-Titanat | B15: 452.65 | C15: 453.54 | D15: 456.2 | E15: 451.88 | F15: 1791.1
A17: Kühlbedarf
A18: Bat./LS | B18: kond.-man. | C18: kond.-auto. | D18: induktiv | E18: Batteriewechsel | F18: Nachtladung
A19: Blei-Säure | B19: 967.41 | C19: 970.74 | D19: 980.72 | E19: 964.08 | F19: 769.8
A20: Li-Ion klassisch | B20: 269.09 | C20: 264.42 | D20: 265.48 | E20: 303.05 | F20: 2241.4
A21: Li-Eisenphosphat hohe Energie | B21: 5972 | C21: 5984.5 | D21: 6022.3 | E21: 5959.5 | F21: 5461
A22: Li-Eisenphosphat hohe Leistung | B22: 4321.3 | C22: 4329.4 | D22: 4353.8 | E22: 4313.2 | F22: 5511.8
A23: Li-Titanat | B23: 625.26 | C23: 1687.2 | D23: 1694.1 | E23: 1682.9 | F23: 305.59
A25: Energieverbrauch
A26: Bat./LS | B26: kond.-man. | C26: kond.-auto. | D26: induktiv | E26: Batteriewechsel | F26: Nachtladung
A27: Blei-Säure | B27: 1.5599 | C27: 1.5644 | D27: 1.6437 | E27: 1.5558 | F27: 1.7387
A28: Li-Ion klassisch | B28: 1.1552 | C28: 1.1581 | D28: 1.2161 | E28: 1.1523 | F28: 0.92738
A29: Li-Eisenphosphat hohe Energie | B29: 1.0209 | C29: 1.0386 | D29: 1.0897 | E29: 1.0338 | F29: 0.88175
A30: Li-Eisenphosphat hohe Leistung | B30: 1.1359 | C30: 1.1388 | D30: 1.1962 | E30: 1.133 | F30: 0.96049
A31: Li-Titanat | B31: 0.93659 | C31: 1.0123 | D31: 1.0611 | E31: 1.0086 | F31: 0.97974
A33: Ladezeit
A34: Bat./LS | B34: kond.-man. | C34: kond.-auto. | D34: induktiv | E34: Batteriewechsel | F34: Nachtladung
A35: Blei-Säure | B35: 5403 | C35: 5352 | D35: 5354 | E35: 420 | F35: 42753
A36: Li-Ion klassisch | B36: 2301 | C36: 2249 | D36: 2250 | E36: 420 | F36: 19566
A37: Li-Eisenphosphat hohe Energie | B37: 1852 | C37: 1078 | D37: 1079 | E37: 420 | F37: 17160
A38: Li-Eisenphosphat hohe Leistung | B38: 2197 | C38: 2145 | D38: 2147 | E38: 420 | F38: 20930
A39: Li-Titanat | B39: 1704 | C39: 489 | D39: 490 | E39: 420 | F39: 20211
A41: Zeiteffizienz (indirekt) | C41: Fahrzeit | D41: 3661
A42: Bat./LS | B42: kond.-man. | C42: kond.-auto. | D42: induktiv | E42: Batteriewechsel | F42: Nachtladung
A43: Blei-Säure | B43: of:=[.$D$41]/([.$D$41]+[.B35]) -> 0.403905560458959 | C43: of:=[.$D$41]/([.$D$41]+[.C35]) -> 0.406191057361589 | D43: of:=[.$D$41]/([.$D$41]+[.D35]) -> 0.406100942872989 | E43: of:=[.$D$41]/([.$D$41]+[.E35]) -> 0.897084048027444 | F43: of:=(11*[.$D$41])/((11*[.$D$41])+[.F35]) -> 0.48505251493544
A44: Li-Ion klassisch | B44: of:=[.$D$41]/([.$D$41]+[.B36]) -> 0.614055686011406 | C44: of:=[.$D$41]/([.$D$41]+[.C36]) -> 0.619458544839256 | D44: of:=[.$D$41]/([.$D$41]+[.D36]) -> 0.619353747250888 | E44: of:=[.$D$41]/([.$D$41]+[.E36]) -> 0.897084048027444 | F44: of:=(11*[.$D$41])/((11*[.$D$41])+[.F36]) -> 0.673011681735381
A45: Li-Eisenphosphat hohe Energie | B45: of:=[.$D$41]/([.$D$41]+[.B37]) -> 0.664066751315073 | C45: of:=[.$D$41]/([.$D$41]+[.C37]) -> 0.772525849335303 | D45: of:=[.$D$41]/([.$D$41]+[.D37]) -> 0.772362869198312 | E45: of:=[.$D$41]/([.$D$41]+[.E37]) -> 0.897084048027444 | F45: of:=(11*[.$D$41])/((11*[.$D$41])+[.F37]) -> 0.701206665389772
A46: Li-Eisenphosphat hohe Leistung | B46: of:=[.$D$41]/([.$D$41]+[.B38]) -> 0.624957323318539 | C46: of:=[.$D$41]/([.$D$41]+[.C38]) -> 0.630554598691009 | D46: of:=[.$D$41]/([.$D$41]+[.D38]) -> 0.630337465564738 | E46: of:=[.$D$41]/([.$D$41]+[.E38]) -> 0.897084048027444 | F46: of:=(11*[.$D$41])/((11*[.$D$41])+[.F38]) -> 0.658012123984902
A47: Li-Titanat | B47: of:=[.$D$41]/([.$D$41]+[.B39]) -> 0.682385834109972 | C47: of:=[.$D$41]/([.$D$41]+[.C39]) -> 0.882168674698795 | D47: of:=[.$D$41]/([.$D$41]+[.D39]) -> 0.881956155143339 | E47: of:=[.$D$41]/([.$D$41]+[.E39]) -> 0.897084048027444 | F47: of:=(11*[.$D$41])/((11*[.$D$41])+[.F39]) -> 0.66583446314606
A49: Ladezyklen pro km
A50: Bat./LS | B50: kond.-man. | C50: kond.-auto. | D50: induktiv | E50: Batteriewechsel | F50: Nachtladung
A51: Blei-Säure | B51: 0.01527 | C51: 0.015271 | D51: 0.015274 | E51: 0.015269 | F51: 0.0041544
A52: Li-Ion klassisch | B52: 0.01529 | C52: 0.01529 | D52: 0.015292 | E52: 0.015289 | F52: 0.0041719
A53: Li-Eisenphosphat hohe Energie | B53: 0.01528 | C53: 0.015281 | D53: 0.015283 | E53: 0.015279 | F53: 0.004157
A54: Li-Eisenphosphat hohe Leistung | B54: 0.015266 | C54: 0.015267 | D54: 0.015269 | E54: 0.015265 | F54: 0.004158
A55: Li-Titanat | B55: 0.015253 | C55: 0.015247 | D55: 0.01525 | E55: 0.015247 | F55: 0.0041561
A57: Ladezyklen pro tausend km (indirekt)
A58: Bat./LS | B58: kond.-man. | C58: kond.-auto. | D58: induktiv | E58: Batteriewechsel | F58: Nachtladung
A59: Blei-Säure | B59: of:=1000*[.B51] -> 15.27 | C59: of:=1000*[.C51] -> 15.271 | D59: of:=1000*[.D51] -> 15.274 | E59: of:=1000*[.E51] -> 15.269 | F59: of:=1000*[.F51] -> 4.1544
A60: Li-Ion klassisch | B60: of:=1000*[.B52] -> 15.29 | C60: of:=1000*[.C52] -> 15.29 | D60: of:=1000*[.D52] -> 15.292 | E60: of:=1000*[.E52] -> 15.289 | F60: of:=1000*[.F52] -> 4.1719
A61: Li-Eisenphosphat hohe Energie | B61: of:=1000*[.B53] -> 15.28 | C61: of:=1000*[.C53] -> 15.281 | D61: of:=1000*[.D53] -> 15.283 | E61: of:=1000*[.E53] -> 15.279 | F61: of:=1000*[.F53] -> 4.157
A62: Li-Eisenphosphat hohe Leistung | B62: of:=1000*[.B54] -> 15.266 | C62: of:=1000*[.C54] -> 15.267 | D62: of:=1000*[.D54] -> 15.269 | E62: of:=1000*[.E54] -> 15.265 | F62: of:=1000*[.F54] -> 4.158
A63: Li-Titanat | B63: of:=1000*[.B55] -> 15.253 | C63: of:=1000*[.C55] -> 15.247 | D63: of:=1000*[.D55] -> 15.25 | E63: of:=1000*[.E55] -> 15.247 | F63: of:=1000*[.F55] -> 4.1561

Sheet: Tabelle5
A1: Masse/LI | B1: kond.-man. | C1: kond.-auto. | D1: induktiv | E1: Batteriewechsel
A2: 1 | B2: 539.91 | C2: 540.8 | D2: 543.45 | E2: 539
A3: 2 | B3: 1043.4 | C3: 1044.9 | D3: 1049 | E3: 1041.9
A4: 3 | B4: 1570.1 | C4: 1572.4 | D4: 1579.5 | E4: 1567.8
A5: 4 | B5: 2109.5 | C5: 2112.1 | D5: 2120.9 | E5: 2106.7
A6: 5 | B6: 2668.6 | C6: 2672.1 | D6: 2682.4 | E6: 2665
A8: Energieverrbrauch/LI | B8: kond.-man. | C8: kond.-auto. | D8: induktiv | E8: Batteriewechsel
A9: 1 | B9: 1.2228 | C9: 1.3122 | D9: 1.3741 | E9: 1.3079
A10: 2 | B10: 1.1595 | C10: 1.2678 | D10: 1.301 | E10: 1.2641
A11: 3 | B11: 1.1528 | C11: 1.2692 | D11: 1.2684 | E11: 1.2655
A12: 4 | B12: 1.1608 | C12: 1.2549 | D12: 1.262 | E12: 1.2779
A13: 5 | B13: 1.1714 | C13: 1.2494 | D13: 1.2644 | E13: 1.2933
G14: 4646
A15: Ladezeit/LI | B15: kond.-man. | C15: kond.-auto. | D15: induktiv | E15: Batteriewechsel | G15: Fahrzeit
A16: 1 | B16: 1442 | C16: 489 | D16: 490 | E16: 420 | G16: of:=[.$G$14]*[.A16] -> 4646
A17: 2 | B17: 2681 | C17: 489 | D17: 597 | E17: 420 | G17: of:=[.$G$14]*[.A17] -> 9292
A18: 3 | B18: 3969 | C18: 488 | D18: 869 | E18: 420 | G18: of:=[.$G$14]*[.A18] -> 13938
A19: 4 | B19: 5308 | C19: 613 | D19: 1150 | E19: 420 | G19: of:=[.$G$14]*[.A19] -> 18584
A20: 5 | B20: 6680 | C20: 761 | D20: 1438 | E20: 420 | G20: of:=[.$G$14]*[.A20] -> 23230
A22: Zeiteffieizienz#/LI | B22: kond.-man. | C22: kond.-auto. | D22: induktiv | E22: Batteriewechsel
A23: 1 | B23: of:=([.$G16])/([.$G16]+[.B16]) -> 0.763140604467806 | C23: of:=([.$G16])/([.$G16]+[.C16]) -> 0.9047711781889 | D23: of:=([.$G16])/([.$G16]+[.D16]) -> 0.904595015576324 | E23: of:=([.$G16])/([.$G16]+[.E16]) -> 0.917094354520332
A24: 2 | B24: of:=([.$G17])/([.$G17]+[.B17]) -> 0.776079512235864 | C24: of:=([.$G17])/([.$G17]+[.C17]) -> 0.950005111951743 | D24: of:=([.$G17])/([.$G17]+[.D17]) -> 0.939629891798968 | E24: of:=([.$G17])/([.$G17]+[.E17]) -> 0.956754530477759
A25: 3 | B25: of:=([.$G18])/([.$G18]+[.B18]) -> 0.778354833305411 | C25: of:=([.$G18])/([.$G18]+[.C18]) -> 0.966172189103009 | D25: of:=([.$G18])/([.$G18]+[.D18]) -> 0.94131154183832 | E25: of:=([.$G18])/([.$G18]+[.E18]) -> 0.970748015043878
A26: 4 | B26: of:=([.$G19])/([.$G19]+[.B19]) -> 0.777833584463419 | C26: of:=([.$G19])/([.$G19]+[.C19]) -> 0.968067927280304 | D26: of:=([.$G19])/([.$G19]+[.D19]) -> 0.941724941724942 | E26: of:=([.$G19])/([.$G19]+[.E19]) -> 0.977899389602189
A27: 5 | B27: of:=([.$G20])/([.$G20]+[.B20]) -> 0.776663323303243 | C27: of:=([.$G20])/([.$G20]+[.C20]) -> 0.968279771581009 | D27: of:=([.$G20])/([.$G20]+[.D20]) -> 0.941705853737636 | E27: of:=([.$G20])/([.$G20]+[.E20]) -> 0.982241014799154